Movie_Link,Movie_Name,Ratings,Movie_category,Film_Actor,Release_Date,Duration,Country,Original_Language,Companies,Description,Budget,Box Office,Certificate (MPAA),Directors,Writing_Credits,poster_path
https://www.imdb.com/title/tt27431598/?ref_=sr_t_204,Bramayugam,7.9,"Horror, Thriller","Mammootty, Arjun Ashokan, Sidharth Bharathan, Amalda Liz, Manikandan R. Achari, Aluva Sheeba Sebastian, Akash Chandran, Rafnas Rafeek, Andrè, Sergi, Nikola, Stas, Vitalii, Zabi, Dmitri Sergeev, Alex, Sergé, Andrey","February 15, 2024 (India)",2 hours 19 minutes,India,Malayalam,"Night Shift Studios, Y Not Studios","Thevan, a folk singer of the Paanan caste, has a fateful encounter when escaping slavery, leading to him discovering an ancient traditional mansion altering his destiny.","₹280,000,000 (estimated)","$1,388,375",,Rahul Sadasivan,"Rahul Sadasivan, T.D. Ramakrishnan","https://m.media-amazon.com/images/M/MV5BNWExZDRhZTktMGUxOS00ODQyLTk0ZTMtY2VkYWJkZjZlZDUyXkEyXkFqcGdeQXVyMTQ3Mzk2MDg4._V1_QL75_UY281_CR18,0,190,281_.jpg"
https://www.imdb.com/title/tt1411238/?ref_=sr_t_205,No Strings Attached,6.2,"Comedy, Romance","Natalie Portman, Ashton Kutcher, Kevin Kline, Cary Elwes, Greta Gerwig, Lake Bell, Olivia Thirlby, Ludacris, Jake Johnson, Mindy Kaling, Talia Balsam, Ophelia Lovibond, Guy Branum, Ben Lawson, Jennifer Irwin, Adhir Kalyan, Brian H. Dierker, Abby Elliott","January 21, 2011 (United States)",1 hour 48 minutes,United States,English,"Paramount Pictures, Cold Spring Pictures, Spyglass Entertainment","A guy and girl try to keep their relationship strictly physical, but it's not long before they learn that they want something more.","$25,000,000 (estimated)","$149,228,077",R,Ivan Reitman,"Elizabeth Meriwether, Michael Samonek, Elizabeth Meriwether","https://m.media-amazon.com/images/M/MV5BMTg2MDQ1NTEzNl5BMl5BanBnXkFtZTcwOTgxNTMyNA@@._V1_QL75_UX190_CR0,0,190,281_.jpg"
https://www.imdb.com/title/tt1261945/?ref_=sr_t_206,Sex and the City 2,4.5,"Comedy, Drama, Romance","Sarah Jessica Parker, Kim Cattrall, Kristin Davis, Cynthia Nixon, Minglie Chen, Chris Noth, David Eigenberg, Evan Handler, Alexandra Fong, Parker Fong, Mario Cantone, Willie Garson, Noah Mills, Liza Minnelli, Billy Stritch, Nadine Isenegger, Natalie Lomonte, Michael T. Weiss","May 27, 2010 (United States)",2 hours 26 minutes,United States,English,"New Line Cinema, Home Box Office (HBO), HBO Films","While wrestling with the pressures of life, love, and work in Manhattan, Carrie, Miranda, and Charlotte join Samantha for a trip to Abu Dhabi (United Arab Emirates), where Samantha's ex is filming a new movie.","$100,000,000 (estimated)","$290,745,055",R,Michael Patrick King,"Michael Patrick King, Candace Bushnell, Darren Star","https://m.media-amazon.com/images/M/MV5BMTM3OTUyNTI3MF5BMl5BanBnXkFtZTcwODcyMzM0Mw@@._V1_QL75_UX190_CR0,14,190,281_.jpg"
https://www.imdb.com/title/tt0108967/?ref_=sr_t_207,A Touch of Frost,7.9,"Crime, Drama, Mystery","David Jason, Bruce Alexander, John Lyons, Arthur White, James McKenna, David McKail, David Gooderson, Paul Moriarty, George Thompson, Caroline Harker, Bill Stewart, Stuart Barren, Bill Rourke, Jon Sotherton, Lindy Whiteford, Julia St John, Billy Riddoch, Reece Andrews","April 3, 2010 (United States)",1 hour 45 minutes,United Kingdom,English,"ITV Productions, Excelsior, Yorkshire Television (YTV)","DI Jack Frost is an unconventional policeman with sympathy for the underdog and an instinct for moral justice. Sloppy, disorganized, and disrespectful, he attracts trouble like a magnet.",,,TV-MA,"Roger Bamford, Paul Harrison, Don Leaver, Roy Battersby, David Reynolds, Adrian Shergold, Sandy Johnson, Robert Knights, Anthony Simmons, John Glenister, Herbert Wise, Ross Devenish, Peter Smith, Paul Seed, Graham Theakston, Alan Dossor","Christopher Blake, Malcolm Bradbury, Alma Cullen, Thomas Ellice, Russell Gascoigne, David Gilman, Richard Harris, Richard Harris, Sian Orrells, Christopher Russell, Michael Russell, Robert Smith, R.D. Wingfield, R.D. Wingfield, R.D. Wingfield, R.D. Wingfield, R.D. Wingfield, R.D. Wingfield","https://m.media-amazon.com/images/M/MV5BM2FlYjlkN2MtN2ZjZi00NTE2LWFmZjctNzRhMDM2MzY5ZTNjXkEyXkFqcGdeQXVyMjExMjk0ODk@._V1_QL75_UY281_CR9,0,190,281_.jpg"
https://www.imdb.com/title/tt5616176/?ref_=sr_t_208,2 Hearts,6.3,"Drama, Romance","Jacob Elordi, Adan Canto, Tiera Skovbye, Radha Mitchell, Tahmoh Penikett, Kari Matchett, Jordan Burtchett, Anthony Konechny, Steve Bacic, Ryan Jinn, Carolyn Adair, Eric Bempong, Spencer Borgeson, Georgia Bradner, Krystle Dos Santos, Stefania Indelicato, Danielle Kay, Kennedy King","October 16, 2020 (United States)",1 hour 41 minutes,United States,English,Silver Lion Films,"For two couples the future unfolds in different decades and different places, but a hidden connection will bring them together in a way no one could have predicted.","$15,000,000 (estimated)","$1,349,286",PG-13,Lance Hool,"Robin U. Russin, Veronica Szymanski, Eric Gregory","https://m.media-amazon.com/images/M/MV5BYmU2ZTUwNGItYmI1Yy00ODEyLWFkNjItOGYwZWRmNGU3ZTZlXkEyXkFqcGdeQXVyNjkwMzU3NDI@._V1_QL75_UX190_CR0,1,190,281_.jpg"
https://www.imdb.com/title/tt1212450/?ref_=sr_t_209,Lawless,7.2,"Biography, Crime, Drama","Tom Hardy, Shia LaBeouf, Guy Pearce, Jason Clarke, Jessica Chastain, Mia Wasikowska, Dane DeHaan, Chris McGarry, Tim Tolin, Gary Oldman, Lew Temple, Marcus Hester, Bill Camp, Alex Van, Noah Taylor, Mark Ashworth, Tom Proctor, Bruce McKinnon","August 29, 2012 (United States)",1 hour 56 minutes,United States,English,"The Weinstein Company, Yucaipa Films, Revolt Films","Set in Depression-era Franklin County, Virginia, a trio of bootlegging brothers are threatened by a new special deputy and other authorities angling for a cut of their profits.","$26,000,000 (estimated)","$55,404,207",R,John Hillcoat,"Nick Cave, Matt Bondurant","https://m.media-amazon.com/images/M/MV5BMjAxNjUyNjUwN15BMl5BanBnXkFtZTcwMDgwOTIyOA@@._V1_QL75_UY281_CR0,0,190,281_.jpg"
https://www.imdb.com/title/tt14123284/?ref_=sr_t_210,Havoc,,"Action, Thriller","Tom Hardy, Timothy Olyphant, Xelia Mendes-Jones, Forest Whitaker, Luis Guzmán, Richard Harrington, Tom Wu, Jessie Mei Li, Narges Rashidi, Jill Winternitz, Quelin Sepulveda, Jennifer Armour, Justin Cornwell, Jim Caesar, Jeremy Ang Jones, Nicole Joseph, Atul Sharma, Gordon Alexander",,,United Kingdom,English,"One More One Productions, Severn Screen, XYZ Films","After a drug deal gone wrong, a bruised detective must fight his way through the criminal underworld to rescue a politician's estranged son, unraveling a deep web of corruption and conspiracy that ensnares his entire city.",,,,Gareth Evans,Gareth Evans,"https://m.media-amazon.com/images/M/MV5BYzg1MmY0MTctNzk1MS00ZTg4LTg2NDQtNjhiNjk1ZTg0YmFiXkEyXkFqcGdeQXVyNjc1NDY3NzU@._V1_QL75_UY281_CR93,0,190,281_.jpg"
https://www.imdb.com/title/tt27490099/?ref_=sr_t_211,Beating Hearts,6.5,"Comedy, Crime, Drama","Adèle Exarchopoulos, François Civil, Raphaël Quenard, Benoît Poelvoorde, Alain Chabat, Élodie Bouchez, Vincent Lacoste, Karim Leklou, Mallory Wanecque, Malik Frikah, Jean-Pascal Zadi, Anthony Bajon, Nicolas Wanczycki, Ysé Tran, Emmanuel Dehaene, Louis Raison, Bastien Trouvé, Jack Claudany","October 16, 2024 (France)",2 hours 46 minutes,France,French,"Chi-Fou-Mi Productions, Trésor Films, StudioCanal",Follows an improbable relationship between two people. A girl from an upper-middle-class family and a boy from a modest background fall in love but drift apart; he eventually becomes a criminal and spends 12 years in prison.,"€35,700,000 (estimated)",,,Gilles Lellouche,"Gilles Lellouche, Audrey Diwan, Neville Thompson, Julien Lambroschini, Ahmed Hamidi","https://m.media-amazon.com/images/M/MV5BMzA2YzRmNzUtZTcxMy00ZDkzLWJhNDItZDlmY2MzYTBkMDBiXkEyXkFqcGdeQXVyMTc3NDUyNTg3._V1_QL75_UY281_CR7,0,190,281_.jpg"
https://www.imdb.com/title/tt2418558/?ref_=sr_t_212,Ruby Red,6.0,"Action, Adventure, Drama","Josefine Preuß, Florian Bartholomäi, Uwe Kockisch, Johannes Silberschneider, Gerlinde Locker, Laura Berlin, Sibylle Canonica, Katharina Thalbach, Veronica Ferres, Levin Henning, Maria Ehrich, Jannis Niewöhner, Jennifer Lotsi, Gottfried John, Rüdiger Vogler, Oxana Salzmann, Friederike Rhein, Kostja Ullmann","March 14, 2013 (Germany)",2 hours 2 minutes,Germany,German,"Lieblingsfilm, mem-film, Geißendörfer Film- und Fernsehproduktion (GFF)","On her 16th birthday, Gwendolyn Shepherd finds out that instead of her cousin, she has inherited a rare gene that allows her to travel through time.",,,,Felix Fuchssteiner,"Katharina Schöde, Kerstin Gier","https://m.media-amazon.com/images/M/MV5BMjE5NjM0MDQwN15BMl5BanBnXkFtZTcwMjY3NzQxOQ@@._V1_QL75_UY281_CR5,0,190,281_.jpg"
https://www.imdb.com/title/tt0054518/?ref_=sr_t_213,The Avengers,8.3,"Action, Comedy, Crime","Patrick Macnee, Diana Rigg, Honor Blackman, Linda Thorson, Ian Hendry, Patrick Newell, Ingrid Hafner, Douglas Muir, Terence Plummer, Valentino Musetti, Richard Neller, Julie Stevens, Edwin Richfield, Norman Chappell, Frank Maher, Terry Richards, Cliff Diggins, Philip Madoc","March 28, 1966 (United States)",50 minutes,United Kingdom,English,Associated British Corporation,A quirky spy show of the adventures of eccentrically suave British Agent John Steed and his predominantly female partners.,,,TV-14,"Don Leaver, Peter Hammond, Kim Mills, Roy Ward Baker, James Hill, Sidney Hayers, Jonathan Alwyn, Richmond Harding, Bill Bain, Robert Fuest, Robert Day, Charles Crichton, Don Chaffey, Peter Graham Scott, Robert Asher, John Hough, Laurence Bourne, Leslie Norman, John Krish, Don Sharp, Roger Jenkins, John Knight, Raymond Menmuir, Gerry O'Hara, Gordon Flemyng, Peter Sykes, Ray Austin, Robert Tronson, Dennis Vance, Guy Verney, Quentin Lawrence, Peter Duffell, John Llewellyn Moxey, Roy Rossotti, Paul Dickson, Cyril Frankel, Cliff Owen, Wolf Rilla, Harry Booth, Vernon Sewell","Brian Clemens, Brian Clemens, Brian Clemens, Brian Clemens, Sydney Newman, Philip Levene, Philip Levene, Roger Marshall, Roger Marshall, Roger Marshall, Roger Marshall, Malcolm Hulke, Malcolm Hulke, Malcolm Hulke, Tony Williamson, Tony Williamson, Eric Paice, Eric Paice, Eric Paice, Martin Woodhouse, Martin Woodhouse, Martin Woodhouse, John Lucarotti, John Lucarotti, John Lucarotti, John Lucarotti, John Lucarotti, Terry Nation, Richard Harris, Richard Harris, James Mitchell, James Mitchell, Jeremy Burnham, Dennis Spooner, Dennis Spooner, Patrick Brawn, Patrick Brawn, Patrick Brawn, Terrance Dicks, Terrance Dicks, Terrance Dicks, Peter Ling, Jeremy Scott, Jeremy Scott, Reed De Rouen, Reed De Rouen, Lester Powell, Geoffrey Bellman, Terence Feely, Sheilah Ward, John Whitney, Anthony Terpiloff, Philip Chambers, Robert Banks Stewart, Patrick Campbell, Lewis Davidson, Fred Edge, John Kruse, Max Marquis, Berkely Mather, Ray Rigby, Bill Strutton, Gerald Verner, Brandon Brady, Leonard Fincham, John Gilbert, Jon Manchip White, Rex Edwards, Doreen Montgomery, Phyllis Norman, Geoffrey Orme, Edward Rhodes, Ludovic Peters, Colin Finbow, Anthony Marriott, Alan Pattillo, Michael Winder, Dave Freeman, Donald James, Leigh Vance, John Bryce","https://m.media-amazon.com/images/M/MV5BZWQwZTdjMDUtNTY1YS00MDI0LWFkNjYtZDA4MDdmZjdlMDRlXkEyXkFqcGdeQXVyNjUwNzk3NDc@._V1_QL75_UY281_CR8,0,190,281_.jpg"
https://www.imdb.com/title/tt0120794/?ref_=sr_t_214,The Prince of Egypt,7.2,"Animation, Adventure, Drama","Val Kilmer, Ralph Fiennes, Michelle Pfeiffer, Sandra Bullock, Jeff Goldblum, Danny Glover, Patrick Stewart, Helen Mirren, Steve Martin, Martin Short, Bobby Motown, Eden Riegel, Ofra Haza, James Avery, Aria Noelle Curzon, Stephanie Sawyer, Francesca Marie Smith, Shira Roth","December 18, 1998 (United States)",1 hour 39 minutes,United States,English,"DreamWorks Animation, Dreamworks Pictures",Egyptian Prince Moses learns of his identity as a Hebrew and his destiny to become the chosen deliverer of his people.,"$70,000,000 (estimated)","$218,613,188",PG,"Brenda Chapman, Steve Hickner, Simon Wells","Philip LaZebnik, Nicholas Meyer","https://m.media-amazon.com/images/M/MV5BOWNjMjgyNmMtNWMzZC00YjI4LWI1NmUtMTY0ZTA0ZDQ4Y2EwXkEyXkFqcGdeQXVyNTUyMzE4Mzg@._V1_QL75_UX190_CR0,1,190,281_.jpg"
https://www.imdb.com/title/tt13980362/?ref_=sr_t_215,Wrong Side of the Tracks,7.0,Drama,"Jose Coronado, Luis Zahera, Nona Sobo, Felipe Londoño, Laura Ramos, Manolo Caro, Manuel Tallafé, Ell, Miguel Ángel Jiménez, Maria Molins, Itziar Atienza, María de Nati, David Haverty, Carmen Esteban, Martín Páez, Víktor Beltrán, Raúl Sanz, Álvaro Aparicio","May 20, 2022 (United States)",1 hour 19 minutes,Spain,Spanish,"Alea Media, Mediaset España","When his teenage granddaughter falls victim to the drug dealers overtaking his neighborhood, a fed-up war veteran takes matters into his own hands.",,,TV-MA,"Iñaki Mercero, Oriol Ferrer, Alberto Ruiz Rojo, Luis Oliveros","David Bermejo, David Bermejo, David Bermejo, David Bermejo, David Bermejo, David Bermejo, Víctor Pedreira, Víctor Pedreira, Víctor Pedreira, Víctor Pedreira, Jordi Terradas, Jordi Terradas, Jordi Terradas, Jordi Terradas, Patricia Trueba, Patricia Trueba, Patricia Trueba, Patricia Trueba, Juan Ramón Ruiz de Somavía, Juan Ramón Ruiz de Somavía, Juan Ramón Ruiz de Somavía, Natxo López, Natxo López, Natxo López, Joan Barbero","https://m.media-amazon.com/images/M/MV5BMGZhOTcwY2UtZjFlYS00N2E1LWFmNjgtZWU1NTExZmMzMjgwXkEyXkFqcGdeQXVyODIzMjE0NTc@._V1_QL75_UY281_CR1,0,190,281_.jpg"
https://www.imdb.com/title/tt0087985/?ref_=sr_t_216,Red Dawn,6.3,"Action, Drama, Thriller","Patrick Swayze, C. Thomas Howell, Lea Thompson, Charlie Sheen, Darren Dalton, Jennifer Grey, Brad Savage, Doug Toby, Ben Johnson, Harry Dean Stanton, Ron O'Neal, William Smith, Vladek Sheybal, Powers Boothe, Frank McRae, Roy Jenson, Pepe Serna, Lane Smith","August 10, 1984 (United States)",1 hour 54 minutes,United States,English,"United Artists, Valkyrie Films","It is the dawn of World War III. In the west mountains of America, a group of teenagers band together to defend their town, and their country, from invading Soviet forces.","$17,000,000 (estimated)","$38,376,497",PG-13,John Milius,"Kevin Reynolds, John Milius, Kevin Reynolds","https://m.media-amazon.com/images/M/MV5BNGU2NzI1NDEtNTFlNi00NDA4LWIxNDEtNTliM2RmMmQxMjExXkEyXkFqcGdeQXVyMTUzMDUzNTI3._V1_QL75_UX190_CR0,4,190,281_.jpg"
https://www.imdb.com/title/tt0106064/?ref_=sr_t_217,Mighty Morphin Power Rangers,6.6,"Action, Adventure, Family","David Yost, Richard Steven Horvitz, Ed Neil, Paul Schrier, Jason Narvy, David J. Fielding, Robert Axelrod, Barbara Goodson, Amy Jo Johnson, Dave Mallow, Michael Sorich, Kerrigan Mahan, Robert L. Manahan, Jason David Frank, Richard Genelle, Danny Wayne, Wendee Lee, Tadahiro Nakamura","August 28, 1993 (United States)",30 minutes,United States,English,"MMPR Productions Inc., Renaissance-Atlantic Films, Saban Entertainment","A team of teenagers with attitude are recruited to save Angel Grove from the evil witch, Rita Repulsa, and later, Lord Zedd, Emperor of all he sees, and their horde of monsters.",,,TV-Y7,"Terence H. Winkless, Robert Hughes, John Stewart, Shuki Levy, Robert Radler, Worth Keeter, Jonathan Tzachor, Jerry P. Jacobs, Armand Garabidian, David Blyth, Adrian Carr, Jeffrey Reiner, John Blizek, Marco Garibaldi, Douglas Sloan, Vickie Bronaugh, Isaac Florentine, Larry Litton, Paul Schrier, Strathford Hamilton","Shuki Levy, Shuki Levy, Shell Danielson, Stewart St. John, Douglas Sloan, Cheryl Saban, Mark Hoffmeier, Mark Litton, Judd Lynn, Julianne Klemm, Ellen Levy-Sarnoff, Peggy Nicoll, Gary Glasberg, Mark Ryan, Dan Sarnoff, Tony Oliver, Tony Oliver, Jeff Deckman, Jeff Deckman, Steve Kramer, Ronnie Sperling, Tom Wyner, Jackie Marchand, Cindy McKay, Chris Schoon, Barbara Oliver, Barbara Oliver, Gilles Wheeler, Mark McKain, Sindy McKay, Jerry P. Jacobs, Terri Hughes Burton, Ron Milbauer, Kati Rocky, Charlotte Fullerton, Steven Melching, Haim Saban, Saburo Yatsude","https://m.media-amazon.com/images/M/MV5BZWVjMWRjNjktY2I5Yy00NzllLWFiNmMtOTQyZGE3OTNmNzM4XkEyXkFqcGdeQXVyMTUyNjc3NDQ4._V1_QL75_UX190_CR0,2,190,281_.jpg"
https://www.imdb.com/title/tt14354984/?ref_=sr_t_218,Hope Street,6.7,"Crime, Drama","Kerri Quinn, Des McAleer, Ciarán McMenamin, Niall Wright, Niamh McGrady, Aaron McCusker, Rachel Tucker, Louis McCartney, Ellie Lavery, Sade Malone, Brid Brennan, Karen Hassan, Finnian Garbutt, Stephen Hagan, Amara Karan, Meghan Tyler, Carrie Crowley, Ian Beattie","January 31, 2022 (United States)",44 minutes,United Kingdom,English,"BritBox, British Broadcasting Corporation (BBC), Long Story TV",The arrival of DC Leila Hussain sets tongues wagging - what brings this big city girl to a sleepy Northern Irish seaside town?,,,TV-PG,"Dez McCarthy, Sean Glynn, Enda Hughes, Bruce Webb, Amy Coop, Suri Krishnamma","Paul Marquess, Paul Marquess, Susanne Farrell, Susanne Farrell, Christine Murphy, Christine Murphy, Christine Murphy, Jessica Lea, Jessica Lea, Jessica Lea, Stuart Drennan, Greer Ellison, Tess McGowan, Brian McGilloway, Leesa Harker, Phil Mulryne, Sally Tatchell, Shazia Rashid","https://m.media-amazon.com/images/M/MV5BNTNhNDcyY2MtNjA2Yi00YmI0LWFkM2MtZmJjNzhkNTZmMjgyXkEyXkFqcGdeQXVyMTMyMDM0ODk3._V1_QL75_UY281_CR4,0,190,281_.jpg"
https://www.imdb.com/title/tt4604612/?ref_=sr_t_219,The Alienist,7.7,"Crime, Drama, Mystery","Daniel Brühl, Dakota Fanning, Luke Evans, Robert Wisdom, Douglas Smith, Matthew Shear, Ted Levine, Martin McCreadie, Brian Geraghty, Q'orianka Kilcher, Matt Lintz, David Wilmot, Brittany Marie Batchelder, Rosy McEwen, Melanie Field, Emily Barber, Georgia Lowe, Matt Letscher","January 22, 2018 (United States)",1 hour,United States,English,"TNT, Vanessa Productions, Studio T",Newspaper illustrator John Moore meets with criminal psychologist (alienist) Dr. Laszlo Kreizler to investigate a serial killer in New York during the late 19th century.,,,TV-MA,"David Caffrey, Jakob Verbruggen, Clare Kilner, Paco Cabezas, James Hawes, Jamie Payne, David Petrarca","Hossein Amini, Amy Berg, Stuart Carolan, Caleb Carr, Caleb Carr, Alyson Feltes, E. Max Frye, Cary Joji Fukunaga, Gina Gionfriddo, Chase Palmer, John Sayles, Tom Smuts, Karina Wolf","https://m.media-amazon.com/images/M/MV5BMTAyMDg5NjYzNTZeQTJeQWpwZ15BbWU4MDA2MTczMjQz._V1_QL75_UY281_CR5,0,190,281_.jpg"
https://www.imdb.com/title/tt29569035/?ref_=sr_t_220,My Demon,7.7,"Comedy, Drama, Fantasy","Kim Yoo-jung, Song Kang, Lee Sang-yi, Kim Hae-sook, Seo Jung-yeon, Kim Tae-hoon, Jo Hye-joo, Lee Yoon-ji, Kang Seung-ho, Heo Jung-do, Hong Jin-Gi, Cha Cheong-hwa, Lee Gang-wook, Kim Seol-jin, Gi So-yoo, Joo Suk-tae, Woo Hee-Jin, Kim Young-jae","November 24, 2023 (United States)",1 hour,South Korea,Korean,"Seoul Broadcasting System (SBS), Netflix","A pitiless demon becomes powerless after getting entangled with an icy heiress, who may hold the key to his lost abilities -- and his heart.",,,TV-14,Kim Jang-Han,Choi Ah-Il,"https://m.media-amazon.com/images/M/MV5BYjQ0NWYwMmYtYTA5OC00ODQ3LTkwODItZDU3NjY1YjM1ZTliXkEyXkFqcGdeQXVyNjI4NDY5ODM@._V1_QL75_UY281_CR4,0,190,281_.jpg"
https://www.imdb.com/title/tt15268244/?ref_=sr_t_221,Joy Ride,6.4,Comedy,"Ashley Park, Sherry Cola, Stephanie Hsu, Sabrina Wu, Debbie Fan, Kenneth Liu, Annie Mumolo, David Denman, Belle Zhang, Lennon Yee, Kellen Bruce, Kalayna Kozak, Isla Rose Hall, Chloe Pun, Nathan Parrott, Beckam Crawford, Timothy Simons, Nick Fontaine","July 7, 2023 (United States)",1 hour 35 minutes,United Kingdom,English,"Lionsgate Films, Point Grey Pictures","Follows four Asian American friends as they bond and discover the truth of what it means to know and love who you are, while they travel through China in search of one of their birth mothers.",,,R,Adele Lim,"Cherry Chevapravatdumrong, Teresa Hsiao, Cherry Chevapravatdumrong, Teresa Hsiao, Adele Lim","https://m.media-amazon.com/images/M/MV5BNjc3OTJhMzQtMjA0OC00YWViLThmMGUtMjcwOTFiYzRlMTA2XkEyXkFqcGdeQXVyODk4OTc3MTY@._V1_QL75_UX190_CR0,0,190,281_.jpg"
https://www.imdb.com/title/tt4145384/?ref_=sr_t_222,Scream Queens,7.1,"Comedy, Horror, Mystery","Emma Roberts, Lea Michele, Abigail Breslin, Keke Palmer, Billie Lourd, Jamie Lee Curtis, Riley Schmidt, Glen Powell, Oliver Hudson, Niecy Nash, Skyler Samuels, Diego Boneta, Lucien Laviscount, Nasim Pedrad, Kirstie Alley, Taylor Lautner, James Earl, John Stamos","September 22, 2015 (United States)",45 minutes,United States,English,"Prospect Films, Brad Falchuk Teley-Vision, Ryan Murphy Productions","A semi-anthology series that centers on characters being terrorized by a serial killer in different locations, including a university and a hospital.",,,TV-14,"Barbara Brown, Brad Falchuk, Bradley Buecker, Michael Uppendahl, Ian Brennan, Michael Lehmann, Ryan Murphy, Jamie Lee Curtis, Maggie Kiley, Loni Peristere, Mary Wigmore","Ian Brennan, Ian Brennan, Brad Falchuk, Brad Falchuk, Ryan Murphy, Ryan Murphy","https://m.media-amazon.com/images/M/MV5BOTg2Mzk3MmMtMjQ3Yy00NGJhLWEwZDEtNDA5NmMzNjE4YTM1XkEyXkFqcGdeQXVyNjc1OTg0MTA@._V1_QL75_UX190_CR0,2,190,281_.jpg"
https://www.imdb.com/title/tt2578560/?ref_=sr_t_223,Broad City,8.4,Comedy,"Ilana Glazer, Abbi Jacobson, Hannibal Buress, Arturo Castro, John Gemberling, Paul W. Downs, Stephen Schneider, Chris Gethard, Eliot Glazer, Susie Essman, Nicole Drespel, D'Arcy Carden, Teresa Yenque, Bob Balaban, RuPaul, Wanda Sykes, Clea DuVall, Rachel Dratch","January 22, 2014 (United States)",22 minutes,United States,English,"3 Arts Entertainment, Jax Media, Paper Kite Productions","Broad City follows two women throughout their daily lives in New York City, making the smallest and mundane events hysterical and disturbing to watch all at the same time.",,,TV-14,"Lucia Aniello, Nicholas Jasenovec, John Lee, Ilana Glazer, Abbi Jacobson, Todd Biermann, Michael Blieden, Jeff Tomsic, Ryan McFaul, Amy Poehler, Neil Daly, Lilly Burns, Paul W. Downs, Nick Paley","Ilana Glazer, Ilana Glazer, Ilana Glazer, Abbi Jacobson, Abbi Jacobson, Abbi Jacobson, Naomi Ekperigin, Jen Statsky, Jen Statsky, Lucia Aniello, Paul W. Downs, Anthony King, Anthony King, Achilles Stamatelaky, Chris Kelly, Tami Sagher, Gabe Liedman, Kevin Barnett, Josh Rabinowitz, Eliot Glazer, Lisa McQuillan","https://m.media-amazon.com/images/M/MV5BNTVjMGFhMmUtMTMwMS00OTE0LTlkODgtMzU0ZDZhY2U1NTliXkEyXkFqcGdeQXVyNjU2ODM5MjU@._V1_QL75_UX190_CR0,5,190,281_.jpg"
https://www.imdb.com/title/tt0887883/?ref_=sr_t_224,Burn After Reading,7.0,"Comedy, Crime, Drama","Brad Pitt, Frances McDormand, George Clooney, John Malkovich, Tilda Swinton, Richard Jenkins, Elizabeth Marvel, David Rasche, J.K. Simmons, Olek Krupa, Michael Countryman, Kevin Sussman, J.R. Horne, Hamilton Clancy, Armand Schultz, Pun Bandhu, Karla Mosley, Jeffrey DeMunn","September 12, 2008 (United States)",1 hour 36 minutes,United States,English,"Focus Features, StudioCanal, Relativity Media",A disk containing mysterious information from a CIA agent ends up in the hands of two unscrupulous and daft gym employees who attempt to sell it.,"$37,000,000 (estimated)","$163,728,902",R,"Ethan Coen, Joel Coen","Joel Coen, Ethan Coen","https://m.media-amazon.com/images/M/MV5BYzYwMjZhOGEtMGZlZS00Mjg1LTlkMDktYzJiZDU4MzAxZDRiXkEyXkFqcGdeQXVyMTMxODk2OTU@._V1_QL75_UY281_CR0,0,190,281_.jpg"
https://www.imdb.com/title/tt31567422/?ref_=sr_t_225,Night Always Comes,,"Crime, Drama, Thriller","Vanessa Kirby, Jennifer Jason Leigh, Eli Roth, Julia Fox, Michael Kelly, Randall Park, Zack Gottsagen, Stephan James, Nichelle Chand",,,United States,English,"Aluna Entertainment, H2L Media Group, Square Eyed Pictures","Risking everything to secure a future for herself and her brother, Lynette sets out on a dangerous odyssey, confronting her own dark past over the course of one propulsive night.",,,,Benjamin Caron,"Sarah Conradt, Willy Vlautin","https://m.media-amazon.com/images/M/MV5BOTYwMjIyZGMtOTMxNC00NDQzLTkwNWEtMjhjNDgzZDRlNjljXkEyXkFqcGdeQXVyMzY4ODI3NDA@._V1_QL75_UX140_CR0,10,140,140_.jpg"
https://www.imdb.com/title/tt0056085/?ref_=sr_t_226,How the West Was Won,7.1,"Adventure, War, Western","James Stewart, John Wayne, Gregory Peck, Henry Fonda, Carroll Baker, Lee J. Cobb, Carolyn Jones, Karl Malden, George Peppard, Robert Preston, Debbie Reynolds, Eli Wallach, Richard Widmark, Brigid Bazlen, Walter Brennan, David Brian, Andy Devine, Raymond Massey","February 20, 1963 (United States)",2 hours 44 minutes,United States,English,"Metro-Goldwyn-Mayer (MGM), Cinerama Productions Corp.","A family saga covering several decades of Westward expansion in the 19th century, including the Gold Rush, the Civil War, and the building of the railroads.","$15,000,000 (estimated)","$76,729",G,"John Ford, Henry Hathaway, George Marshall, Richard Thorpe","James R. Webb, John Gay","https://m.media-amazon.com/images/M/MV5BNWE0YTcyZjMtZTBhZC00N2YxLTg5ODgtNTkyNDkwMjE2NGM5XkEyXkFqcGdeQXVyMTUzMDUzNTI3._V1_QL75_UX190_CR0,5,190,281_.jpg"
https://www.imdb.com/title/tt9170236/?ref_=sr_t_227,Pieces of Her,6.3,"Crime, Drama, Mystery","Toni Collette, Bella Heathcote, Jessica Barden, Joe Dempsie, Omari Hardwick, David Wenham, Terry O'Quinn, Gil Birmingham, Catherine McClements, Jacob Scipio, Calum Worthy, Nicholas Burton, Ellie Lang, Ewen Leslie, Mia Artemis, Jeremy Waters, Gregory Matchett, Aaron Jeffery","March 4, 2022 (United States)",52 minutes,United States,English,"Fifth Season, Made Up Stories","On her 30th birthday out for lunch with her mother suddenly explodes into violence, an adrift young woman's perception of her mother is forever changed.",,,TV-MA,Minkie Spiro,"Karin Slaughter, Charlotte Stoudt, Charlotte Stoudt, Charlotte Stoudt, Charlotte Stoudt, Anna Fishko, Sharon Hoffman, Dan LeFranc, Jerome Hairston, Michelle Denise Jackson","https://m.media-amazon.com/images/M/MV5BZDBlMjMzN2MtY2YzYS00MWY2LTgzZDgtZTMxYmZjYmIwMDdhXkEyXkFqcGdeQXVyODQzNTE3ODc@._V1_QL75_UX190_CR0,0,190,281_.jpg"
