Movie_Link,Movie_Name,Ratings,Movie_category,Film_Actor,Release_Date,Duration,Country,Original_Language,Companies,Description,Budget,Box Office,Certificate (MPAA),Directors,Writing_Credits,poster_path
https://www.imdb.com/title/tt2870612/?ref_=sr_t_1,"As Above, So Below",6.2,"Horror, Mystery, Thriller","Perdita Weeks, Ben Feldman, Edwin Hodge, François Civil, Marion Lambert, Ali Marhyar, Cosme Castro, Hamid Djavadan, Théo Cholbi, Emy Lévy, Roger Van Hool, Olivia Csiky Trnka, Hellyette Bess, Aryan Rahimian, Samuel Aouizerate, Kaya Blocksage","August 29, 2014 (United States)",1 hour 33 minutes,United States,English,"Legendary Entertainment, Universal Pictures, Brothers Dowdle Productions","When a team of explorers venture into the catacombs that lie beneath the streets of Paris, they uncover the dark secret that lies within this city of the dead.","$5,000,000 (estimated)","$41,898,409",R,John Erick Dowdle,"John Erick Dowdle, Drew Dowdle","https://m.media-amazon.com/images/M/MV5BMTQzNzg0NDI2MF5BMl5BanBnXkFtZTgwMzgxNzY2MTE@._V1_QL75_UX190_CR0,10,190,281_.jpg"
https://www.imdb.com/title/tt1548850/?ref_=sr_t_2,Misfits,8.2,"Comedy, Drama, Fantasy","Nathan Stewart-Jarrett, Joe Gilgun, Iwan Rheon, Lauren Socha, Antonia Thomas, Karla Crome, Nathan McMullen, Shaun Dooley, Matt Stokoe, Robert Sheehan, Natasha O'Keeffe, Craig Parkinson, Matthew McNulty, Alex Reid, Michael Winder, Ruth Negga, Michael Obiora, Matt Cross","July 19, 2012 (United States)",1 hour,United Kingdom,English,Clerkenwell Films,A group of young offenders doing community service gets struck by lightning during a storm and start to develop superpowers.,,,TV-MA,"Tom Green, Jonathan van Tulleken, Tom Harper, Wayne Yip, China Moo-Young, Owen Harris, Alex Garcia Lopez, William Sinclair, Nirpal Bhogal, William McGregor, Dusan Lazarevic, Lewis Arnold, Lawrence Gough, Amanda Boyle","Howard Overman, Howard Overman, Howard Overman, Howard Overman, Howard Overman, Howard Overman, Jon Brown, Jon Brown, Jon Brown, Jon Brown, Mike O'Leary","https://m.media-amazon.com/images/M/MV5BNzRiNDcyZjItNzc1ZC00OTk3LWI3ZTItNDc0NTgxNjg3ZTZhL2ltYWdlL2ltYWdlXkEyXkFqcGdeQXVyMjM4NjgwODc@._V1_QL75_UY281_CR1,0,190,281_.jpg"
https://www.imdb.com/title/tt10244600/?ref_=sr_t_3,Winning Time: The Rise of the Lakers Dynasty,8.3,"Biography, Drama, Sport","John C. Reilly, Quincy Isaiah, Jason Clarke, Gaby Hoffmann, Hadley Robinson, DeVaughn Nixon, Solomon Hughes, Tamera Tomakili, Brett Cullen, Spencer Garrett, Stephen Adly Guirgis, Molly Gordon, Joey Brooks, Rob Morgan, Adrien Brody, Jimel Atkins, Jason Segel, Delante Desouza","March 6, 2022 (United States)",59 minutes,United States,English,"Hyperobject Industries, Home Box Office (HBO)","The professional and personal lives of the 1980s Los Angeles Lakers, one of sports' most revered and dominant dynasties - a team that defined an era, both on and off the court.",,,TV-MA,"Salli Richardson-Whitfield, Tanya Hamilton, Payman Benz, Damian Marcano, Jonah Hill, Adam McKay, Todd Banhazl, Trey Edward Shults","Max Borenstein, Max Borenstein, Max Borenstein, Max Borenstein, Jim Hecht, Jim Hecht, Jim Hecht, Jeff Pearlman, Rodney Barnes, Benjamin Klein, Benjamin Klein, Rebecca Bertuch","https://m.media-amazon.com/images/M/MV5BY2JmMWVjZGQtMTNlZC00MjM5LTg0NGUtMTQ2NTEwMTdlNWQ1XkEyXkFqcGdeQXVyMzQ2MDI5NjU@._V1_QL75_UX190_CR0,2,190,281_.jpg"
https://www.imdb.com/title/tt0162661/?ref_=sr_t_4,Sleepy Hollow,7.3,"Fantasy, Horror, Mystery","Johnny Depp, Christina Ricci, Miranda Richardson, Michael Gambon, Casper Van Dien, Jeffrey Jones, Richard Griffiths, Ian McDiarmid, Michael Gough, Christopher Walken, Marc Pickering, Lisa Marie, Steven Waddington, Claire Skinner, Christopher Lee, Alun Armstrong, Mark Spalding, Jessica Oyelowo","November 19, 1999 (United States)",1 hour 45 minutes,United States,English,"Paramount Pictures, Mandalay Pictures, Scott Rudin Productions",Ichabod Crane is sent to Sleepy Hollow to investigate the decapitations of three people; the culprit is legendary apparition The Headless Horseman.,"$100,000,000 (estimated)","$206,071,502",R,Tim Burton,"Washington Irving, Kevin Yagher, Andrew Kevin Walker, Andrew Kevin Walker","https://m.media-amazon.com/images/M/MV5BMTQ4Yjk5ODEtNGFkOS00OTY1LTgwYTYtOTFkNmU2NzBmNGM2XkEyXkFqcGdeQXVyNDQ2MTMzODA@._V1_QL75_UX190_CR0,1,190,281_.jpg"
https://www.imdb.com/title/tt0078610/?ref_=sr_t_5,The Facts of Life,6.8,"Comedy, Family","Lisa Whelchel, Kim Fields, Mindy Cohn, Nancy McKeon, Charlotte Rae, Mackenzie Astin, Cloris Leachman, Felice Schachter, Julie Piekarski, Julie Anne Haddock, George Clooney, Sherrié Austin, Molly Ringwald, John Lawlor, Pamela Adlon, Geri Jewell, Alex Rocco, Kimberly Craig","August 24, 1979 (United States)",30 minutes,United States,English,"Embassy Communications, Embassy Television, TAT Communications Company","Mrs. Edna Garrett, housemother and dietitian at the Eastland School, teaches a group of girls in her charge how to solve those problems that every teenager has to face.",,,TV-PG,"John Bowab, Asaad Kelada, Valentine Mayer, Bob Claver, Lee Lochhead, Jim Drake, Judi Elterman, Marian Deaton, Nick Havinga, Gary Shimokawa, Dolores Ferraro, Selig Frank, Alejandro Rey, Norman Cohen, Linda Day, Mark W. Travis, Ellen Gittelsohn, Stuart Wolpert, Steven Robman","Dick Clair, Howard Leeds, Jerry Mayer, Jerry Mayer, Jerry Mayer, Jerry Mayer, Jenna McMahon, Ben Starr, Linda Marsh, Linda Marsh, Linda Marsh, Margie Peters, Margie Peters, Margie Peters, Stuart Wolpert, Stuart Wolpert, Stuart Wolpert, Sara Finney-Johnson, Sara Finney-Johnson, Vida Spears, Vida Spears, Deidre Fay, Deidre Fay, Deidre Fay, Paul Haggis, Paul Haggis, Paul Haggis, Bob Myer, Bob Myer, Bob Myer, Bob Young, Bob Young, Bob Young, Martha Williamson, Martha Williamson, Kimberly Hill, Kimberly Hill, Ross Brown, Ross Brown, Michael Maurer, Michael Maurer, Ann Gibbs, Ann Gibbs, Ann Gibbs, Joel Kimmel, Joel Kimmel, Joel Kimmel, Andy Borowitz, Andy Borowitz, Andy Borowitz, Douglas Arango, Phil Doran, Irma Kalish, Michael Poryes, Michael Poryes, Austin Kalish, Jack Elinson, Jane Anderson, John Boni, Mark Tuttle, Glenn Padnick, Glenn Padnick, Martin Ragaway, Migdia Skarsgård Chinea, Sally Sussman, Sally Sussman, Sally Sussman, Lou Messina, Howard Meyers, Howard Meyers, Diane Messina Stanley, Jerry Jacobius, Peter Noah, Bill Shinkai, Bill Shinkai, Bill Steinkellner, Cheri Steinkellner, Gail Honigberg, Patrick Cleary, Patrick Cleary, Bob Bendetson, Howard Bendetson, Bruce Ferber, Bruce Ferber, David Lerner, David Lerner, Racelle Friedman, Katherine Green, Richard Gurman, Richard Gurman, Bob Colleary, Matt Geller, Lawrence H. Levy, Jane Gould, Shelly Landau, Brad Rider, Brad Rider, Rowland Barber, Stan Dreben, Albert E. Lewin, Albert E. Lewin, Warren S. Murray, Skip Usen, Paul L. Friedman, Susan Perkis Haven, Robyn Knapton, Howard Liebling, Gayle MacDonald, Emily Mayer, Mike Mayer, Philip Ross, Larry Swimer, Lloyd Turner, Jerry Winnick, Jerry Winnick, Ruth Bennett, Marvin Braverman, Marvin Braverman, David Chambers, David Chambers, Nick Gore, Steven Gore, Bernard Burnell Mack, Mitch Markowitz, John Markus, Stephen Neigher, Bob Peete, Stephen Spears, Hendrik VanLeuven, Jim Geoghan, Neil Rosen, Neil Rosen, Sandra Kay Siegel, Alan Spencer, George Tricker, George Tricker, J.P. Duffy, Janis Hirsch, Mark Miller, Milt Rosen, Carlo Allen, Susan Beavers, Bob Brush, Linda Elstad, Rick Lombardo, Brian Pollack, Rick Shaw, Larry Strauss, Fredi Towbin, Robert Billson, Shirley Brown, Bart Lindsay, Micki Raton, Barry Vigon, Jake Weinberger, Mike Weinberger, Marilyn Anderson, Jeri Barchilon, Jeri Barchilon, Barbara Berkowitz, Michele Gendelman, Renee Orin, Bob Underwood, The Defiant One, Dave Digregorio, Kathy Lette, Harvey Weitzman, Arnie Wess","https://m.media-amazon.com/images/M/MV5BMTMyNzA0Nzk1Nl5BMl5BanBnXkFtZTcwNzY4NjYzMQ@@._V1_QL75_UX190_CR0,1,190,281_.jpg"
https://www.imdb.com/title/tt0079944/?ref_=sr_t_6,Stalker,8.1,"Drama, Sci-Fi","Alisa Freyndlikh, Aleksandr Kaydanovskiy, Anatoliy Solonitsyn, Nikolay Grinko, Natalya Abramova, Faime Jurno, E. Kostin, Raimo Rendi, Sergey Yakovlev","April 17, 1980 (Netherlands)",2 hours 42 minutes,Soviet Union,Russian,"Mosfilm, Vtoroe Tvorcheskoe Obedinenie",A guide leads two men through an area known as the Zone to find a room that grants wishes.,"RUR 1,000,000 (estimated)","$396,836",Not Rated,Andrei Tarkovsky,"Arkadiy Strugatskiy, Boris Strugatskiy, Arkadiy Strugatskiy, Boris Strugatskiy, Andrei Tarkovsky, Arseniy Tarkovskiy","https://m.media-amazon.com/images/M/MV5BYTAzZmEzZjEtNmIzMS00MzlhLWE0Y2ItNDRlNTQwN2E0MDE4XkEyXkFqcGdeQXVyMzY0MTE3NzU@._V1_QL75_UY281_CR4,0,190,281_.jpg"
https://www.imdb.com/title/tt1504320/?ref_=sr_t_7,The King's Speech,8.0,"Biography, Drama, History","Colin Firth, Geoffrey Rush, Helena Bonham Carter, Derek Jacobi, Robert Portal, Richard Dixon, Paul Trussell, Adrian Scarborough, Andrew Havill, Charles Armstrong, Roger Hammond, Calum Gittins, Jennifer Ehle, Dominic Applewhite, Ben Wimsett, Freya Wilson, Ramona Marquez, David Bamber","December 25, 2010 (United States)",1 hour 58 minutes,United States,English,"The Weinstein Company, UK Film Council, Momentum Pictures","The story of King George VI, his unexpected ascension to the throne of the British Empire in 1936, and the speech therapist who helped the unsure monarch overcome his stammer.","$15,000,000 (estimated)","$484,068,861",R,Tom Hooper,David Seidler,"https://m.media-amazon.com/images/M/MV5BMzU5MjEwMTg2Nl5BMl5BanBnXkFtZTcwNzM3MTYxNA@@._V1_QL75_UY281_CR1,0,190,281_.jpg"
https://www.imdb.com/title/tt0088172/?ref_=sr_t_8,Starman,7.0,"Romance, Sci-Fi","Jeff Bridges, Karen Allen, Charles Martin Smith, Richard Jaeckel, Robert Phalen, Tony Edwards, John Walter Davis, Ted White, Dirk Blocker, M.C. Gainey, Sean Stanek, George 'Buck' Flower, Russ Benning, Ralph Cosham, David Wells, Anthony Grumbach, James Deeth, Alex Daniels","December 14, 1984 (United States)",1 hour 55 minutes,United States,English,"Columbia Pictures, Industrial Light & Magic (ILM), Delphi II Productions","An alien takes the form of a young Wisconsin widow's husband and makes her drive him to his departure point in Arizona. Distrustful government agents, along with a more ambivalent scientist, give pursuit in hopes of intercepting them.","$22,000,000 (estimated)","$28,744,356",PG,John Carpenter,"Bruce A. Evans, Raynold Gideon, Dean Riesner","https://m.media-amazon.com/images/M/MV5BYjUzNDY4YzMtZjNmMS00NjQxLWI0NjctMjQzYTdiYmM5MTliXkEyXkFqcGdeQXVyMjUzOTY1NTc@._V1_QL75_UX190_CR0,4,190,281_.jpg"
https://www.imdb.com/title/tt0964517/?ref_=sr_t_9,The Fighter,7.8,"Action, Biography, Drama","Mark Wahlberg, Christian Bale, Amy Adams, Melissa Leo, Mickey O'Keefe, Jack McGee, Melissa McMeekin, Bianca Hunter, Erica McDermott, Jill Quigg, Dendrie Taylor, Kate B. O'Brien, Jenna Lamia, Frank Renzulli, Paul Campbell, Caitlin Dwyer, Chanty Sok, Ted Arcidi","December 17, 2010 (United States)",1 hour 56 minutes,United States,English,"Closest to the Hole Productions, Fighter, Mandeville Films","Based on the story of Micky Ward, a fledgling boxer who tries to escape the shadow of his more famous but troubled older boxing brother and get his own shot at greatness.","$25,000,000 (estimated)","$129,190,869",R,David O. Russell,"Scott Silver, Paul Tamasy, Eric Johnson, Paul Tamasy, Eric Johnson, Keith Dorrington","https://m.media-amazon.com/images/M/MV5BMTM0ODk3MjM1MV5BMl5BanBnXkFtZTcwNzc1MDIwNA@@._V1_QL75_UX190_CR0,8,190,281_.jpg"
https://www.imdb.com/title/tt5742374/?ref_=sr_t_10,You Were Never Really Here,6.7,"Crime, Drama, Thriller","Joaquin Phoenix, Judith Roberts, Ekaterina Samsonov, John Doman, Dante Pereira-Olson, Larry Canady, Vinicius Damasceno, Neo Randall, Frank Pando, Edward Latham, Alex Manette, Claire Hsu, Denis Ozer, Tia Sofia Begh, Lucy Lan Luo, Annie Mac-Yang, Lilian Tsang, Mengqi He","April 6, 2018 (United States)",1 hour 29 minutes,United Kingdom,English,"Why Not Productions, Film4, British Film Institute (BFI) Production Board","A traumatized veteran unafraid of violence tracks down missing girls for a living. When a job spins out of control, Joe's nightmares overtake him as a conspiracy is uncovered leading to what could be his death trip or his awakening.",,,R,Lynne Ramsay,"Lynne Ramsay, Jonathan Ames","https://m.media-amazon.com/images/M/MV5BMDkwOTE0ZjMtZmRiYS00M2M3LWE3MzUtNzNmNmExNTNmNjg5XkEyXkFqcGdeQXVyODE1MjMyNzI@._V1_QL75_UX190_CR0,0,190,281_.jpg"
https://www.imdb.com/title/tt13258344/?ref_=sr_t_11,Baldur's Gate III,9.7,"Action, Adventure, Drama","Amelia Tyler, Neil Newbon, Jennifer English, Devora Wilde, Theo Solomon, Tim Downie, Samantha Béart, Matthew Mercer, Tracy Wiles, Dave Jones, Emma Gregory, Joshua Wichard, Emerald O'Hanrahan, Ken Nwosu, Tina Barnes, Lynsey Murrell, Pieter Lawman, Neil Roberts","August 3, 2023 (United States)",,Belgium,English,Larian Studios,"Return to Faerun in a tale of fellowship and betrayal, and the lure of absolute power. Mysterious abilities are awakening inside you. Resist, and turn darkness against itself, or, embrace corruption, and become ultimate evil.",,,M,Swen Vincke,"Sarah Baylus, Diana Chaudron, John Corcoran, Chrystal Ding, Martin Docherty, Gavin Jurgens-Fyhrie, Adrienne Law, Ella McConnell, Ruairí Moore, Rachel Quirke, Stephen Rooney, Adam Smith, Jan Van Dosselaer, Ine Van Hamme, Kevin VanOrd","https://m.media-amazon.com/images/M/MV5BMWVlMDdhNzYtNDY5ZS00YzdiLWI3NWEtMDUzMGQyMWQ2NDY3XkEyXkFqcGdeQXVyNDg4NjY5OTQ@._V1_QL75_UX190_CR0,2,190,281_.jpg"
https://www.imdb.com/title/tt14271652/?ref_=sr_t_12,Joe Pickett,7.7,"Drama, Western","Michael Dorman, Julianna Guill, Sharon Lawrence, Mustafa Speaks, Skywalker Hughes, Kamryn Pliva, Chad Rook, Vivienne Guynn, Aadila Dosani, Patrick Gallagher, Roger LeBlanc, David Alan Grier, Paul Sparks, Keean Johnson, Brendan Fletcher, Cassie Dzienny, Zebastin Borjeau, Evie Marsten","December 6, 2021 (United States)",50 minutes,United States,English,"ArsenalFX Color, Brothers Dowdle Productions, Paramount Television",Follows a game warden and his family during a changing political and socioeconomic climate in a small rural town.,,,TV-14,"Drew Dowdle, John Erick Dowdle, Everardo Gout, Jennifer Morrison, Janice Cooke, Blackhorse Lowe, Shana Stein, Stephen Woolfenden","C.J. Box, C.J. Box, Drew Dowdle, Drew Dowdle, John Erick Dowdle, John Erick Dowdle, Sarah Marie Masson, Sarah Marie Masson, Jada Nation, Jada Nation, Stacy Chbosky, Samir Mehta, Nelson Greaves, Alice Dennard, Isaac Gomez, Diego D. Moreno","https://m.media-amazon.com/images/M/MV5BMjkyZGQ3YWQtYjc0ZS00OTE0LTgwZTktZjM1ZDViMzBhNWM3XkEyXkFqcGdeQXVyMTMzOTQyOTk1._V1_QL75_UX190_CR0,0,190,281_.jpg"
https://www.imdb.com/title/tt0070917/?ref_=sr_t_13,The Wicker Man,7.5,"Horror, Mystery, Thriller","Edward Woodward, Christopher Lee, Diane Cilento, Britt Ekland, Ingrid Pitt, Lindsay Kemp, Russell Waters, Aubrey Morris, Irene Sunters, Walter Carr, Ian Campbell, Leslie Blackater, Roy Boyd, Peter Brewis, Barbara Rafferty, Juliet Cadzow, Ross Campbell, Penny Cluer","August 7, 1974 (United States)",1 hour 28 minutes,United Kingdom,English,British Lion Film Corporation,"A puritan police sergeant arrives in a Scottish island village in search of a missing girl, who the pagan locals claim never existed.","$810,000 (estimated)","$528,514",R,Robin Hardy,"Anthony Shaffer, David Pinner","https://m.media-amazon.com/images/M/MV5BMzQ2YWYzOWItYmU4OS00OTgyLWI4M2YtMmQ2ZDc5NzRhNDA5XkEyXkFqcGdeQXVyNDE0OTU3NDY@._V1_QL75_UX190_CR0,0,190,281_.jpg"
https://www.imdb.com/title/tt1398426/?ref_=sr_t_14,Straight Outta Compton,7.8,"Biography, Drama, History","O'Shea Jackson Jr., Corey Hawkins, Jason Mitchell, Neil Brown Jr., Aldis Hodge, Marlon Yates Jr., R. Marcus Taylor, Carra Patterson, Alexandra Shipp, Paul Giamatti, Elena Goode, Keith Powers, Joshua Brockington, Sheldon A. Smith, LaKeith Stanfield, Cleavon McClendon, Aeriél Miranda, Lisa Renee Pitts","August 14, 2015 (United States)",2 hours 27 minutes,United States,English,"Universal Pictures, Legendary Entertainment, New Line Cinema","The rap group NWA emerges from the mean streets of Compton in Los Angeles, California, in the mid-1980s and revolutionizes Hip Hop culture with their music and tales about life in the hood.","$28,000,000 (estimated)","$201,634,991",R,F. Gary Gray,"Jonathan Herman, Andrea Berloff, S. Leigh Savidge, Alan Wenkus, Andrea Berloff","https://m.media-amazon.com/images/M/MV5BMTA5MzkyMzIxNjJeQTJeQWpwZ15BbWU4MDU0MDk0OTUx._V1_QL75_UX190_CR0,10,190,281_.jpg"
https://www.imdb.com/title/tt0416320/?ref_=sr_t_15,Match Point,7.6,"Drama, Romance, Thriller","Scarlett Johansson, Jonathan Rhys Meyers, Emily Mortimer, Matthew Goode, Alexander Armstrong, Paul Kaye, Brian Cox, Penelope Wilton, Janis Kelly, Alan Oke, Mark Gatiss, Philip Mansfield, Simon Kunz, Geoffrey Streatfeild, Mary Hegarty, John Fortune, Rupert Penry-Jones, Patricia Whymark","January 20, 2006 (United States)",2 hours 4 minutes,United Kingdom,English,"BBC Film, Thema Production, Jada Productions","At a turning point in his life, a former tennis pro falls for an actress who happens to be dating his friend and soon-to-be brother-in-law.","$15,000,000 (estimated)","$85,638,656",R,Woody Allen,Woody Allen,"https://m.media-amazon.com/images/M/MV5BMTQ1NzQ4OTM4MV5BMl5BanBnXkFtZTcwNzY2OTQzMw@@._V1_QL75_UX190_CR0,8,190,281_.jpg"
https://www.imdb.com/title/tt23845296/?ref_=sr_t_16,After the Party,7.7,Drama,"Robyn Malcolm, Peter Mullan, Tara Canton, Ian Blackburn, Elz Carrad, Dean O'Gorman, Ziggy O'Reilly, Mia Blake, Catherine Wilkin, Tanea Heke, Peter Hambleton, Kirana Gaeta, Tess Jamieson-Karaha, Tamati Moriarty, Zack Ziogas, Allan Henry, Kieran Charnock, Carmel McGlone","October 29, 2023 (New Zealand)",45 minutes,New Zealand,English,"Lingo Pictures, Luminous Beast",Penny loses everything when she accuses her husband of a sex crime against her daughter's teenage friend and no-one believes her.,,,,Peter Salmon,"Martha Hardy-Ward, Emily Perkins, Samuel E. Shore, Samuel E. Shore, Samuel E. Shore, Dianne Taylor","https://m.media-amazon.com/images/M/MV5BODZjNGQ5ZjAtMjU2Ni00NTZlLWFiYzAtYTQ3NGNjNjQ5NTM3XkEyXkFqcGdeQXVyNjQxNjUyOTA@._V1_QL75_UX190_CR0,0,190,281_.jpg"
https://www.imdb.com/title/tt3949660/?ref_=sr_t_17,Teenage Mutant Ninja Turtles: Out of the Shadows,5.9,"Action, Adventure, Comedy","Megan Fox, Will Arnett, Tyler Perry, Laura Linney, Stephen Amell, Noel Fisher, Jeremy Howard, Pete Ploszek, Alan Ritchson, Brian Tee, Stephen Farrelly, Gary Anthony Williams, Peter Donald Badalamenti II, Tony Shalhoub, Brad Garrett, Opal Alladin, Brittany Ishibashi, Connor Fox","June 3, 2016 (United States)",1 hour 52 minutes,United States,English,"Golden Harvest Company, Paramount Pictures, Nickelodeon Movies","The Turtles get into another battle with their enemy the Shredder, who has acquired new allies: the mutant thugs Bebop and Rocksteady and the alien being Krang.","$135,000,000 (estimated)","$245,623,848",PG-13,Dave Green,"Josh Appelbaum, André Nemec, Peter Laird, Kevin Eastman","https://m.media-amazon.com/images/M/MV5BMmVkNjVjZTQtNTczYS00ODk5LWFkNjItYjNlMDc5ZjMyYTQwXkEyXkFqcGdeQXVyODE5NzE3OTE@._V1_QL75_UX190_CR0,2,190,281_.jpg"
https://www.imdb.com/title/tt5151570/?ref_=sr_t_18,Mrs. Harris Goes to Paris,7.1,"Comedy, Drama","Lesley Manville, Isabelle Huppert, Lambert Wilson, Alba Baptista, Lucas Bravo, Ellen Thomas, Rose Williams, Jason Isaacs, Anna Chancellor, Bertrand Poncet, Christian McKay, Freddie Fox, Guilaine Londez, Philippe Bertin, Roxane Duran, Dorottya Ilosvai, Delroy Atkinson, Vincent Martin","July 15, 2022 (United States)",1 hour 55 minutes,United Kingdom,English,"Moonriver, Superbe Films, Hero Squared","A widowed cleaning lady in 1950s London falls madly in love with a couture Dior dress, and decides that she must have one of her own.","$13,000,000 (estimated)","$30,947,403",PG,Anthony Fabian,"Paul Gallico, Carroll Cartwright, Anthony Fabian, Keith Thompson, Olivia Hetreed","https://m.media-amazon.com/images/M/MV5BY2UyOWJjMWEtNmIwYS00ZjM5LWEyYjMtMTI4NDBhMzViNmIyXkEyXkFqcGdeQXVyMDA4NzMyOA@@._V1_QL75_UY281_CR1,0,190,281_.jpg"
https://www.imdb.com/title/tt0085995/?ref_=sr_t_19,Vacation,7.3,"Adventure, Comedy","Chevy Chase, Beverly D'Angelo, Imogene Coca, Randy Quaid, Anthony Michael Hall, Dana Barron, Eddie Bracken, Brian Doyle-Murray, Miriam Flynn, James Keach, Eugene Levy, Frank McRae, John Candy, Christie Brinkley, Jane Krakowski, John P. Navin Jr., Nathan Cook, Christopher Jackson","July 29, 1983 (United States)",1 hour 38 minutes,United States,English,"National Lampoon, Warner Bros.",The Griswold family's cross-country drive to the Walley World theme park proves to be much more arduous than they ever anticipated.,"$15,000,000 (estimated)","$61,418,362",R,Harold Ramis,"John Hughes, John Hughes","https://m.media-amazon.com/images/M/MV5BMmViMGQ4ZDktNzI3OC00YjVkLWJmZDgtOTI4N2FhNjhjNDVjXkEyXkFqcGdeQXVyNTUyMzE4Mzg@._V1_QL75_UX190_CR0,4,190,281_.jpg"
https://www.imdb.com/title/tt19864828/?ref_=sr_t_20,Memory,6.6,Drama,"Alan Nehama, Dutch Welch, Aliya Campbell, Donald McQueen, Vilma Ortiz Donovan, Sarah Elizabeth Grace, Eileen Weisinger, Catherine Taaffe, Josh Philip Weinstein, Brian Kelly, Tarina Webb, Jessica Chastain, Brooke Timber, Karen Roach, Anthony Aikens, Mario Moreno, Rick Firpi, Oriana Venchiarutti","January 5, 2024 (United States)",1 hour 43 minutes,Mexico,English,"High Frequency Entertainment, Teorema, Case Study Films",Sylvia is a social worker who leads a simple and structured life. This is blown open when Saul follows her home from their high school reunion. Their surprise encounter will profoundly impact both of them as they open the door to the past.,"$100,000 (estimated)","$525,831",R,Michel Franco,Michel Franco,"https://m.media-amazon.com/images/M/MV5BODY0OWE3NTAtZjJkMS00YjVlLWJiZDktMzViMDE3Y2Q2MWQ0XkEyXkFqcGdeQXVyMDA4NzMyOA@@._V1_QL75_UX190_CR0,1,190,281_.jpg"
https://www.imdb.com/title/tt1772341/?ref_=sr_t_21,Wreck-It Ralph,7.7,"Animation, Adventure, Comedy","John C. Reilly, Jack McBrayer, Jane Lynch, Sarah Silverman, Alan Tudyk, Mindy Kaling, Joe Lo Truglio, Ed O'Neill, Dennis Haysbert, Edie McClurg, Raymond S. Persi, Jess Harnell, Rachael Harris, Skylar Astin, Adam Carolla, Horatio Sanz, Maurice LaMarche, Stefanie Scott","November 2, 2012 (United States)",1 hour 41 minutes,United States,English,"Walt Disney Animation Studios, Walt Disney Pictures","A video game villain wants to be a hero and sets out to fulfill his dream, but his quest brings havoc to the whole arcade where he lives.","$165,000,000 (estimated)","$471,222,889",PG,Rich Moore,"Rich Moore, Phil Johnston, Jim Reardon, Phil Johnston, Jennifer Lee","https://m.media-amazon.com/images/M/MV5BNzMxNTExOTkyMF5BMl5BanBnXkFtZTcwMzEyNDc0OA@@._V1_QL75_UX190_CR0,0,190,281_.jpg"
https://www.imdb.com/title/tt15571732/?ref_=sr_t_22,Agatha All Along,,"Action, Adventure, Comedy","Kathryn Hahn, Joe Locke, Patti LuPone, Miles Gutierrez-Riley, Aubrey Plaza, Emma Caulfield Ford, Maria Dizzia, Debra Jo Rupp, Ali Ahn, Holly Bonney, Brian Brightman, Kate Forbes, Sasheer Zamata","September 18, 2024 (United States)",,United States,English,"20th Television, Disney+, Lightnin' Production Rentals","Set after the events of ""WandaVision,"" Agatha Harkness recruits some unlikely allies on her quest to regain her former powers.",,,,"Rachel Goldberg, Gandja Monteiro, Jac Schaeffer","Jac Schaeffer, Jac Schaeffer","https://m.media-amazon.com/images/M/MV5BY2I0MjczMWItMTFlMy00MDdkLWI0ODUtN2MxMDMyMTg3Y2MxXkEyXkFqcGdeQXVyNzEzMDcwMDE@._V1_QL75_UX190_CR0,1,190,281_.jpg"
https://www.imdb.com/title/tt1502712/?ref_=sr_t_23,Fantastic Four,4.3,"Action, Adventure, Sci-Fi","Miles Teller, Kate Mara, Michael B. Jordan, Jamie Bell, Toby Kebbell, Reg E. Cathey, Tim Blake Nelson, Joshua Montes, Dan Castellaneta, Owen Judge, Kylen Davis, Evan Hannemann, Chet Hanks, Mary-Pat Green, Tim Heidecker, Mary Rachel Quinn, Wayne Pére, Rhonda Johnson Dents","August 7, 2015 (United States)",1 hour 40 minutes,United States,English,"Twentieth Century Fox, Constantin Film, Marvel Entertainment",Four young outsiders teleport to an alternate and dangerous universe which alters their physical form in shocking ways. The four must learn to harness their new abilities and work together to save Earth from a former friend turned enemy.,"$120,000,000 (estimated)","$167,882,881",PG-13,Josh Trank,"Jeremy Slater, Simon Kinberg, Josh Trank, Stan Lee, Jack Kirby","https://m.media-amazon.com/images/M/MV5BMTk0OTMyMDA0OF5BMl5BanBnXkFtZTgwMzY5NTkzNTE@._V1_QL75_UX190_CR0,0,190,281_.jpg"
https://www.imdb.com/title/tt0327137/?ref_=sr_t_24,Secondhand Lions,7.5,"Comedy, Drama, Family","Haley Joel Osment, Michael Caine, Robert Duvall, Kyra Sedgwick, Nicky Katt, Josh Lucas, Michael O'Neill, Deirdre O'Connell, Eric Balfour, Christian Kane, Kevin Haberer, Emmanuelle Vaugier, Adam Ozturk, Jennifer Stone, Mitchel Musso, Marc Musso, Joe Stevens, Charles Sanders","September 19, 2003 (United States)",1 hour 49 minutes,United States,English,"New Line Cinema, David Kirschner Productions, Digital Domain","Fourteen-year-old Walter Caldwell's irresponsible mother Mae sends him to live with his bachelor uncles, Hub and Garth, so that she can go on yet another husband-hunting trip.","$30,000,000 (estimated)","$48,260,279",PG,Tim McCanlies,Tim McCanlies,"https://m.media-amazon.com/images/M/MV5BMDExNDM3OGQtYjI3ZC00MmE0LWE0OGEtMzgxZDY2MDE1MDFjXkEyXkFqcGdeQXVyNTA4NzY1MzY@._V1_QL75_UY281_CR3,0,190,281_.jpg"
