Movie_Link,Movie_Name,Ratings,Movie_category,Film_Actor,Release_Date,Duration,Country,Original_Language,Companies,Description,Budget,Box Office,Certificate (MPAA),Directors,Writing_Credits,poster_path
https://www.imdb.com/title/tt7569576/?ref_=sr_t_79,The Flight Attendant,7.1,"Comedy, Drama, Mystery","Kaley Cuoco, Zosia Mamet, Griffin Matthews, Rosie Perez, Audrey Grace Marshall, Deniz Akdeniz, T.R. Knight, Michelle Gomez, Colin Woodell, Michiel Huisman, Mo McRae, Callie Hernandez, Merle Dandridge, J.J. Soria, Nolan Gerard Funk, Yasha Jackson, David Iacono, Terry Serpico","November 18, 2020 (United States)",,United States,English,"Warner Bros. Television, Berlanti Productions, Yes, Norman Productions","A reckless flight attendant with an alcoholism problem wakes up in the wrong hotel, in the wrong bed, with a dead man - and no idea what happened. Unable to piece the night together, she begins to wonder if she could be the killer.",,,TV-MA,"Silver Tree, Susanna Fogel, Marcos Siega, Jennifer Phang, Batan Silva, John Strickland, Tom Vaughan, Glen Winter, Pete Chatmon","Christopher A. Bohjalian, Ryan Jennifer Jones, Ryan Jennifer Jones, Ryan Jennifer Jones, Ryan Jennifer Jones, Steve Yockey, Steve Yockey, Steve Yockey, Kara Lee Corthron, Kara Lee Corthron, Haruna Lee, Haruna Lee, Kristin Layne Tucker, Kristin Layne Tucker, Jess Meyer, Jess Meyer, Ian Weinreich, Ian Weinreich, Ticona S. Joy, Meredith Lavender, Marcie Ulin, Elizabeth Benjamin, Natalie Chaidez, Louisa Levy, Liz Sagal","https://m.media-amazon.com/images/M/MV5BOWYzN2Q0NTYtODEzMi00YWMxLWE3MDMtZGUwNGM4NjMxMzQ4XkEyXkFqcGdeQXVyODk4OTc3MTY@._V1_QL75_UX190_CR0,0,190,281_.jpg"
https://www.imdb.com/title/tt3121722/?ref_=sr_t_80,PAW Patrol,6.1,"Animation, Adventure, Comedy","Ron Pardo, Kallan Holley, Justin Paul Kelly, Devan Cohen, Solomon Brown, Samuel Faraci, Lilly Noelle Bartlam, Jackson Reid, Emily Thorne, Max Calinescu, Caroline Johnson, Gabriela Milani, Berkley Silverman, Ítalo Luiz, Drew Davis, Jaxon Mercey, Christian Distefano, Keegan Hedley","November 14, 2013 (United States)",23 minutes,United States,English,"Spin Master Entertainment, Guru Animation Studio, Nickelodeon Animation Studios","Led by a boy named Ryder, a team of six playful rescue dogs use their individual talents to protect the seaside town of Adventure Bay.",,,TV-Y,"Charles E. Bastien, Jamie Whitney","Louise Moon, Louise Moon, Louise Moon, James Backshall, James Backshall, James Backshall, James Backshall, James Backshall, Al Schwartz, Al Schwartz, Ursula Ziegler-Sullivan, Ursula Ziegler-Sullivan, Ursula Ziegler-Sullivan, Ursula Ziegler-Sullivan, Ursula Ziegler-Sullivan, Keith Chapman, Keith Chapman, Keith Chapman, Kim Duran, Kim Duran, Kim Duran, Kim Duran, Kim Duran, Kim Duran, Scott Kraft, Scott Kraft, Scott Kraft, Steven Sullivan, Steven Sullivan, Steven Sullivan, Steven Sullivan, Franklin Young, Charles Johnston, Charles Johnston, Andrew Guerdat, Andrew Guerdat, Robin Stein, Scott Albert, Scott Albert, Michael Stokes, Hugh Duffy, Hugh Duffy, Carolyn Hay, Carolyn Hay, Alex Ganetakos, Bryan Roy, Simon Nicholson, Simon Nicholson, Elizabeth Keyishian, Elizabeth Keyishian, Jeff Sweeney, Jeff Sweeney, Jason McKenzie, Phillip Bastien, Phillip Bastien, Sean Jara, Allen Markuze, Kacey Arnold, Amy Keating Rogers, Tom Berger, Bia Crespo, Philip Ross McKie, Peter Gaffney, Patrick Rieger, Amir Agoora, Morgan Von Ancken, Nabeel Arshad, Scott Gray, Mark Purdy, Jeff Sager","https://m.media-amazon.com/images/M/MV5BMGM5OTM3NzgtODQ4My00OTk3LWI5MmMtODU3NDIyMzc3MzgyXkEyXkFqcGdeQXVyODUwNjEzMzg@._V1_QL75_UY281_CR5,0,190,281_.jpg"
https://www.imdb.com/title/tt7670568/?ref_=sr_t_81,The Masked Singer,5.8,"Family, Music, Reality-TV","Jenny McCarthy-Wahlberg, Nick Cannon, Robin Thicke, Ken Jeong, Nicole Scherzinger, Jesse McCartney, Donnie Wahlberg, Shad Moss, Kandi Burruss, Cheyenne Jackson, Teyana Taylor, Rita Ora, Joey Fatone, Jewel, Faith Evans, Nick Lachey, Todrick Hall, Hayley Orrantia","January 2, 2019 (United States)",1 hour,United States,English,"Smart Dog Media, Fox Alternative Entertainment, Endemol Shine North America",A singing competition guessing game based on Korean format King of Mask Singer. 12 celebrity performers wear costumes to conceal identities. One singer is eliminated each week and unmasked. Small hints are given for the viewer guess along.,,,TV-PG,"Alex Rudzinski, Alex Van Wagner, Brad Duns, Jason Shwartz, Marty Walker, Lexi Shoemaker","Jensen Karp, Brian Strickland, Brian Strickland","https://m.media-amazon.com/images/M/MV5BMmUxYmZmZjktMzU1YS00OGVlLWJkMjYtMjZiZmRlZTlmZjU2XkEyXkFqcGdeQXVyMTE3MTMwODEy._V1_QL75_UX190_CR0,0,190,281_.jpg"
https://www.imdb.com/title/tt21275544/?ref_=sr_t_82,Marmalade,6.1,"Comedy, Crime, Drama","Joe Keery, Camila Morrone, Aldis Hodge, Ozioma Akagha, Susan Brava, Hans Christopher, Wayne Duvall, Phoenicia Gamble, Jane Hammill, Justen Jones, Malik Jubal, Jim Lichtscheidl, Kevin Lokey, Toussaint Morrison, Dane Stauffer, Amy Warner, Andrew E. Wheeler, Tyler Borresch","February 12, 2024 (United Kingdom)",1 hour 39 minutes,United Kingdom,,"Signature Films, Tea Shop Productions",Follows a man in jail who narrates the colorful tale of a romantic bank heist to his cunning cellmate to escape and reunite with the alluring love of his life.,,,,Keir O'Donnell,Keir O'Donnell,"https://m.media-amazon.com/images/M/MV5BZjI0ZDZkMDktMDlkYi00YjhkLWFmMGEtZWUzYTc3ZmEwZmMyXkEyXkFqcGdeQXVyMTM1NjM2ODg1._V1_QL75_UX190_CR0,2,190,281_.jpg"
https://www.imdb.com/title/tt2403021/?ref_=sr_t_83,The Green Inferno,5.4,"Adventure, Horror","Lorenza Izzo, Ariel Levy, Aaron Burns, Kirby Bliss Blanton, Daryl Sabara, Magda Apanowicz, Sky Ferreira, Nicolás Martínez, Ignacia Allamand, Ramón Llao, Richard Burgi, Matías López, Antonieta Pari, Tatiana Panaifo, Percy Chumbe, Clara Vázquez, Eusebio Arenas, Sally Rose","September 25, 2015 (United States)",1 hour 40 minutes,United States,Spanish,"Worldview Entertainment, Dragonfly Entertainment, Sobras International Pictures","A group of student activists travels to the Amazon to save the rain forest and soon discover that they are not alone, and that no good deed goes unpunished.","$5,000,000 (estimated)","$12,666,449",R,Eli Roth,"Eli Roth, Guillermo Amoedo, Eli Roth","https://m.media-amazon.com/images/M/MV5BN2IyYjc0ZmQtZGRlZC00MzBkLWI0MGQtZTM5Y2U2OWVhYmQ5XkEyXkFqcGdeQXVyMjQwMjk0NjI@._V1_QL75_UX190_CR0,0,190,281_.jpg"
https://www.imdb.com/title/tt5613484/?ref_=sr_t_84,Mid90s,7.3,"Comedy, Drama","Sunny Suljic, Katherine Waterston, Lucas Hedges, Na-kel Smith, Olan Prenatt, Gio Galicia, Ryder McLaughlin, Alexa Demie, Fig Camila Abner, Liana Perlich, Ama Elsesser, Judah Estrella Borunda, Mecca Allen, Aramis Hudson, Sonny Greenback, Del the Funky Homosapien, Chad Muska, Donovon Piscopo","October 26, 2018 (United States)",1 hour 25 minutes,United States,English,"A24, IAC Films, Illegal Civ","Follows Stevie, a thirteen-year-old in 1990s-era Los Angeles who spends his summer navigating between his troubled home life and a group of new friends that he meets at a Motor Avenue skate shop.","$1,700,000 (estimated)","$9,303,022",R,Jonah Hill,Jonah Hill,"https://m.media-amazon.com/images/M/MV5BZDhjNDQ0MjEtNWZhMy00ZTY1LWFkYmQtMWYwNDliNGQ1MWU2XkEyXkFqcGdeQXVyNTAzMTY4MDA@._V1_QL75_UX190_CR0,7,190,281_.jpg"
https://www.imdb.com/title/tt13899250/?ref_=sr_t_85,Bloodline Killer,4.0,"Horror, Thriller","Shawnee Smith, Taryn Manning, Drew Moerlein, Tyrese Gibson, Bruce Dern, James Gaudioso, Montanna Gillis, Kresh Novakovic, Sal Rendino, Adam Shippey, Daniel Cosgrove, Jennifer King, John D. Hickman, Anthony Gaudioso, Caroline DeGrave, Anthony Aquilino, Christine Altan, Byron Clohessy","April 26, 2024 (United States)",1 hour 45 minutes,United States,English,"Future Proof Films, BondIt Media Capital, Gaudioso Twins Films",Bloodline Killer is a terrifying horror-thriller that follows Moira Cole who endeavors to rebuild her shattered life after the murder of her family at the hands of her deranged and obsessed cousin.,,,,Ante Novakovic,"Anthony Gaudioso, James Gaudioso","https://m.media-amazon.com/images/M/MV5BOWNlYzk1ZDYtZmRjMS00ZWIxLThjYWItMjhiNDAwZDVlMTE2XkEyXkFqcGdeQXVyNTQ3MjE4NTU@._V1_QL75_UX190_CR0,0,190,281_.jpg"
https://www.imdb.com/title/tt3551096/?ref_=sr_t_86,Fresh Off the Boat,7.8,Comedy,"Randall Park, Constance Wu, Hudson Yang, Forrest Wheeler, Ian Chen, Lucille Soong, Chelsey Crisp, Ray Wise, Trevor Larcom, Evan Hannemann, Prophet Bolden, Dash Williams, Rachel Cannon, Paul Scheer, Stacey Scowley, Luna Blaise, David Goldman, Jillian Armenante","February 4, 2015 (United States)",22 minutes,United States,English,"Fierce Baby Productions, The Detective Agency, 20th Century Fox Television",A Taiwanese family makes their way in America during the 1990s.,,,TV-PG,"Bill Purple, Lynn Shelton, Alisa Statman, Sean Kavanagh, Phil Traill, Claire Scanlon, Jude Weng, Anya Adams, Angela C. Tortu, Chris Koch, Josh Greenbaum, Jay Chandrasekhar, Erin O'Malley, Amy York Rubin, Kristin Rapinchuk, Matt Sohn, Gail Mancuso, Nahnatchka Khan, Ken Whittingham, Kevin Bray, Kyle Weber, Henry Chan, Robert Cohen, Alex Hardcastle, Jake Kasdan, Tristram Shapeero, Max Winkler, Christine Gernon, Chris Addison, Nisha Ganatra, Geeta Vasant Patel, Fred Savage, Sasie Sealy, Jeffrey Walker, Michael Spiller, Kourtney Kang, Steven J. Kung, Kim O. Nguyen, Randall Park","Eddie Huang, Nahnatchka Khan, Nahnatchka Khan, Nahnatchka Khan, Nahnatchka Khan, Sheng Wang, Sheng Wang, Sheng Wang, Sheng Wang, David Smithyman, David Smithyman, David Smithyman, David Smithyman, Camilla Blackett, Camilla Blackett, Camilla Blackett, Abbey Caldwell, Abbey Caldwell, Abbey Caldwell, Cindy Fang, Cindy Fang, Cindy Fang, Josh Kirby, Josh Kirby, Josh Kirby, Jon Veles, Jon Veles, Jon Veles, Rachna Fruchbom, Rachna Fruchbom, Ali Wong, Ali Wong, Ali Wong, Eric Ziobrowski, Eric Ziobrowski, Jamie Block, Jamie Block, Cory Caplan, Cory Caplan, Talia Bernstein, Talia Bernstein, Kyle Lau, Kyle Lau, Samantha Riley, Samantha Riley, Jeff Chiang, Jeff Chiang, Matt Kuhn, Keith Heisler, Sanjay Shah, Rich Blomquist, Laura McCreary, Kourtney Kang, Amelie Gillette, Erica Oyama, Daniel Carter, Jeff Chlebus, Emily Cutler, Aaron Ho, Teresa Hsiao, Ria Sardana","https://m.media-amazon.com/images/M/MV5BYjA1NWQyNzYtZTlmNy00YjYzLWJlNDUtMjA5ZWY2YTM2M2ZlXkEyXkFqcGdeQXVyMTkxNjUyNQ@@._V1_QL75_UX190_CR0,0,190,281_.jpg"
https://www.imdb.com/title/tt0120647/?ref_=sr_t_87,Deep Impact,6.2,"Action, Drama, Sci-Fi","Robert Duvall, Téa Leoni, Elijah Wood, Morgan Freeman, Vanessa Redgrave, Maximilian Schell, James Cromwell, Ron Eldard, Jon Favreau, Laura Innes, Mary McCormack, Richard Schiff, Leelee Sobieski, Blair Underwood, Dougray Scott, Gary Werntz, Bruce Weitz, Betsy Brantley","May 8, 1998 (United States)",2 hours,United States,English,"Paramount Pictures, Dreamworks Pictures, Zanuck/Brown Productions","A comet is discovered to be on a collision course with Earth. As doomsday nears, the human race prepares for the worst.","$75,000,000 (estimated)","$349,464,664",PG-13,Mimi Leder,"Bruce Joel Rubin, Michael Tolkin","https://m.media-amazon.com/images/M/MV5BYTUwMTY1YmMtN2U5NC00YjkzLTg0YWQtZmEwNTEzZjdkNzQ2XkEyXkFqcGdeQXVyMTQxNzMzNDI@._V1_QL75_UX190_CR0,2,190,281_.jpg"
https://www.imdb.com/title/tt3007640/?ref_=sr_t_88,Naked and Afraid,6.6,"Adventure, Game-Show, Horror","Michael Brown, Amanda Kaye, Laura Zerra, Matt Wright, Fernando Calderon, Steven Lee Hall Jr., Mathilde Bittner, Amber Hargrove, E.J. Snyder, Jim Morton, Justin Bullard, Kylie Furneaux, Dani Julien, Samantha Pearson, David Story, Nicklas Lautakoski, Laura Thompson, Wes Harper","June 23, 2013 (United States)",43 minutes,United States,English,Renegade 83,"Reality show where two strangers (typically 1 male, 1 female) try to survive in the wild for up to 21 days, naked.",,,TV-14,"Robert Michael Kelly, Kyle Hunter, Ariel Shaffir","Robert Michael Kelly, Joshua Taylor","https://m.media-amazon.com/images/M/MV5BNGFiNDllNjQtNjBkMy00ZWQxLThlNDktNDBmOWU2MmFlNzExXkEyXkFqcGdeQXVyMTAwMzM3NDI3._V1_QL75_UX190_CR0,2,190,281_.jpg"
https://www.imdb.com/title/tt7979142/?ref_=sr_t_89,The Night Clerk,5.6,"Crime, Drama, Mystery","Tye Sheridan, Ana de Armas, Helen Hunt, John Leguizamo, Johnathon Schaech, Jacque Gray, Joey Miyashima, Austin Archer, Ibrahim Quraishi, Frantz Louizia, D.L. Walker, Pam Eichner, Walter Platz, Maria Julian, Ivey Lloyd Mitchell, Brandice Brown, Isaac Akers, Cindy Perez","February 21, 2020 (United States)",1 hour 30 minutes,United States,English,"Convergent Media., Highland Film Group (HFG), WulfPak Productions",A voyeuristic hotel clerk becomes the subject of a murder investigation.,,,R,Michael Cristofer,Michael Cristofer,"https://m.media-amazon.com/images/M/MV5BNTVjZGM0NTQtMDcyYi00Mzk5LTkyN2MtNWQxZjczMGIwOTAyXkEyXkFqcGdeQXVyMTkxNjUyNQ@@._V1_QL75_UX190_CR0,2,190,281_.jpg"
https://www.imdb.com/title/tt1409024/?ref_=sr_t_90,Men in Black³,6.8,"Action, Adventure, Comedy","Will Smith, Tommy Lee Jones, Josh Brolin, Jemaine Clement, Emma Thompson, Michael Stuhlbarg, Mike Colter, Nicole Scherzinger, Michael Chernus, Alice Eve, David Rasche, Keone Young, Bill Hader, Cayen Martin, Clarke Thorell, Adam Mucci, Tom McComas, Douglas Crosby","May 25, 2012 (United States)",1 hour 46 minutes,United States,English,"Columbia Pictures, Hemisphere Media Capital, Amblin Entertainment",Agent J travels in time to M.I.B.'s early days in 1969 to stop an alien from assassinating his friend Agent K and changing history.,"$225,000,000 (estimated)","$654,213,485",PG-13,Barry Sonnenfeld,"Etan Cohen, Lowell Cunningham","https://m.media-amazon.com/images/M/MV5BMTU2NTYxODcwMF5BMl5BanBnXkFtZTcwNDk1NDY0Nw@@._V1_QL75_UX190_CR0,0,190,281_.jpg"
https://www.imdb.com/title/tt0120744/?ref_=sr_t_91,The Man in the Iron Mask,6.5,"Action, Adventure, Drama","Leonardo DiCaprio, Jeremy Irons, John Malkovich, Gérard Depardieu, Gabriel Byrne, Anne Parillaud, Judith Godrèche, Edward Atterton, Peter Sarsgaard, Hugh Laurie, David Lowe, Brigitte Boucher, Matthew Jocelyn, Karine Belly, Emmanuel Guttierez, Christian Erickson, François Montagut, Andrew Wallace","March 13, 1998 (United States)",2 hours 12 minutes,United States,English,United Artists,The cruel King Louis XIV of France has a secret twin brother whom he keeps imprisoned. Can the twin be substituted for the real king?,"$35,000,000 (estimated)","$182,968,902",PG-13,Randall Wallace,"Alexandre Dumas, Randall Wallace","https://m.media-amazon.com/images/M/MV5BZjM2YzcxMmQtOTc2Mi00YjdhLWFlZjUtNmFmMDQzYzU2YTk5L2ltYWdlXkEyXkFqcGdeQXVyNTAyODkwOQ@@._V1_QL75_UX190_CR0,2,190,281_.jpg"
https://www.imdb.com/title/tt8201852/?ref_=sr_t_92,You Should Have Left,5.4,"Horror, Mystery, Thriller","Kevin Bacon, Amanda Seyfried, Avery Tiiu Essex, Colin Blumenau, Lowri Ann Richards, Joshua C Jackson, Eli Powers","June 18, 2020 (United States)",1 hour 33 minutes,United States,English,Blumhouse Productions,"A former banker, his actress wife, and their spirited daughter book a vacation at an isolated modern home in the Welsh countryside where nothing is quite as it seems.",,,R,David Koepp,"David Koepp, Daniel Kehlmann","https://m.media-amazon.com/images/M/MV5BYTMxMTJhNWQtYzQwMC00MThhLTkzNjMtMDljMGE1MmE1NWM2XkEyXkFqcGdeQXVyODkxMzcxOTY@._V1_QL75_UX190_CR0,9,190,281_.jpg"
https://www.imdb.com/title/tt0257044/?ref_=sr_t_93,Road to Perdition,7.7,"Crime, Drama, Thriller","Tom Hanks, Tyler Hoechlin, Paul Newman, Rob Maxey, Liam Aiken, Jennifer Jason Leigh, Daniel Craig, Ciarán Hinds, Craig Spidle, Ian Barford, Stephen P. Dunn, Paul Turner, Kathleen Keane, Brendan McKinney, Jackie Moran, Kieran O'Hare, John M. Williams, Nicolas Cade","July 12, 2002 (United States)",1 hour 57 minutes,United States,English,"Dreamworks Pictures, Twentieth Century Fox, The Zanuck Company","A mob enforcer's son in 1930s Illinois witnesses a murder, forcing him and his father to take to the road, and his father down a path of redemption and revenge.","$80,000,000 (estimated)","$181,001,478",R,Sam Mendes,"Max Allan Collins, Richard Piers Rayner, David Self","https://m.media-amazon.com/images/M/MV5BNjcxMmQ0MmItYTkzYy00MmUyLTlhOTQtMmJmNjE3MDMwYjdlXkEyXkFqcGdeQXVyNzkwMjQ5NzM@._V1_QL75_UX190_CR0,0,190,281_.jpg"
https://www.imdb.com/title/tt9110170/?ref_=sr_t_94,Wrong Turn,5.6,"Horror, Thriller","Charlotte Vega, Adain Bradley, Bill Sage, Emma Dumont, Dylan McTee, Daisy Head, Matthew Modine, Vardaan Arora, Adrian Favela, Tim DeZarn, Rhyan Elizabeth Hanavan, Chaney Morrow, Cory Scott Allen, Amy Warner, Richard Hagerman, Damian Maffei, Mark Mench, David Hutchison","February 26, 2021 (United States)",1 hour 49 minutes,United States,English,Constantin Film,"Friends hiking the Appalachian Trail are confronted by 'The Foundation', a community of people who have lived in the mountains for hundreds of years.",,,R,Mike P. Nelson,Alan B. McElroy,"https://m.media-amazon.com/images/M/MV5BM2Y5ZWE2MTMtODE3ZC00NWQ4LWJkNzctNGY4Njg5NDY5MzNlXkEyXkFqcGdeQXVyNjUxMjc1OTM@._V1_QL75_UX190_CR0,0,190,281_.jpg"
https://www.imdb.com/title/tt0377309/?ref_=sr_t_95,Survival Island,4.9,"Drama, Thriller","Billy Zane, Kelly Brook, Juan Pablo Di Pace, Todd Collins, Gabrielle Jourdan, Gary Brockette, Isabelle Constantini, Roy Rivera, Maria Victoria Di Pace, Summer Davis, Keera Ann Davis, Kennedy Rolle, Myesha Pinder, Lashandra Burrows, Stephen LiGambi","May 5, 2006 (United Kingdom)",1 hour 35 minutes,United States,English,"Thema Production, T Films, Future Films",Three people - a rich couple and a crew member - are shipwrecked on a tropical island and their subsequent fight for survival becomes even tougher when they begin to turn on each other.,"$9,000,000 (estimated)","$558,764",TV-MA,Stewart Raffill,Stewart Raffill,"https://m.media-amazon.com/images/M/MV5BZTA4ZWQwMDQtOTM4Yy00MjdhLThlY2MtMDU2ZTQyZTlkOGUyXkEyXkFqcGdeQXVyNjQ2MjQ5NzM@._V1_QL75_UY281_CR2,0,190,281_.jpg"
https://www.imdb.com/title/tt0988818/?ref_=sr_t_96,Gintama,8.7,"Animation, Action, Comedy","Tomokazu Sugita, Daisuke Sakaguchi, Rie Kugimiya, Kazuya Nakai, Susumu Chiba, Ken'ichi Suzumura, Satsuki Yukino, Akira Ishida, Tetsuharu Ôta, Fumihiko Tachiki, Kujira, Yû Kobayashi, Mikako Takahashi, Fumiko Orikasa, Kôichi Sakaguchi, Yû Sugimoto, Michael Daingerfield, Janyse Jaud",2006 (United States),25 minutes,Japan,English,"Bandai Namco Pictures (BNP), Bandai Namco, Dentsu","In an era where aliens have invaded and taken over feudal Tokyo, an unemployed samurai finds work however he can.",,,TV-14,"Chizuru Miyawaki, Yôichi Fujita, Shinji Takamatsu, Migmi, Kei Umabiki","Hideaki Sorachi, Taku Kishimoto, Tomoharu Fujita, Tomohiko Osuki","https://m.media-amazon.com/images/M/MV5BMDhmNjUxM2UtZTY2Zi00OTQ0LWExNjgtNDhkNTUyMjQ3MmU5XkEyXkFqcGdeQXVyNjAwNDUxODI@._V1_QL75_UY281_CR4,0,190,281_.jpg"
https://www.imdb.com/title/tt14124236/?ref_=sr_t_97,Frasier,6.8,Comedy,"Kelsey Grammer, Jack Cutmore-Scott, Toks Olagundoye, Jess Salgueiro, Anders Keith, Nicholas Lyndhurst, Jimmy Dunn, Kevin Daniels, Renee Pezzotta, Parvesh Cheena, Cheyenne Perez, Owen Lloyd, Amy L. Workman, John Bucy, Nike Doukas, June Diane Raphael, Bebe Neuwirth, Peri Gilpin","October 12, 2023 (Canada)",27 minutes,United States,English,"Shiny Brass Lamp Productions, Floral & Flannel, Grammnet Productions","Frasier is off to a different city with new challenges to face, new relationships to forge, and an old dream or two to finally fulfill. Frasier has re-entered the building.",,,TV-14,"Kelsey Grammer, James Burrows, Kelly Park, Victor Gonzalez, Phill Lewis","David Angell, Peter Casey, Glen Charles, Les Charles, Joe Cristalli, Joe Cristalli, Chris Harris, Chris Harris, David Lee, Janene Lin, Janene Lin, Jenna Martin, Jenna Martin, Naima Pearce, Naima Pearce, Farhan Arshad, Robb Chavis, Bob Daily, Lauren Houseman, Stephen Lloyd, Sasha Stroman, Miles Woods","https://m.media-amazon.com/images/M/MV5BNDA1MjEwM2QtZWYxZC00OGFkLTgzYjQtZTUyNTUwYjIwZDgxXkEyXkFqcGdeQXVyMTM1NjM2ODg1._V1_QL75_UX190_CR0,0,190,281_.jpg"
https://www.imdb.com/title/tt11003218/?ref_=sr_t_98,Pig,6.9,"Drama, Mystery","Nicolas Cage, Alex Wolff, Adam Arkin, Cassandra Violet, Julia Bray, Elijah Ungvary, Beth Harper, Brian Sutherland, David Shaughnessy, Gretchen Corbett, Sean Tarjyoto, Darius Pierce, Kevin Michael Moore, Tom Walton, Davis King, Nina Belforte, David Knell, Dana Millican","July 16, 2021 (United States)",1 hour 32 minutes,United States,English,"AI-Film, Altitude Film, BlockBox Entertainment",A truffle hunter who lives alone in the Oregon wilderness must return to his past in Portland in search of his beloved foraging pig after she is kidnapped.,,,R,Michael Sarnoski,"Vanessa Block, Michael Sarnoski, Michael Sarnoski","https://m.media-amazon.com/images/M/MV5BOTc2NjRmN2QtMGY1Ny00MTc2LWJmMWUtZmViOTkyNjk2NGExXkEyXkFqcGdeQXVyNzg5MzIyOA@@._V1_QL75_UX190_CR0,0,190,281_.jpg"
https://www.imdb.com/title/tt0265666/?ref_=sr_t_99,The Royal Tenenbaums,7.6,"Comedy, Drama","Gene Hackman, Gwyneth Paltrow, Anjelica Huston, Ben Stiller, Luke Wilson, Owen Wilson, Bill Murray, Danny Glover, Seymour Cassel, Kumar Pallana, Alec Baldwin, Grant Rosenmeyer, Jonah Meyerson, Aram Aslanian-Persico, Irina Gorovaia, Arianna Turturro, Stephen Lea Sheppard, James Fitzgerald","January 4, 2002 (United States)",1 hour 50 minutes,United States,English,"Touchstone Pictures, American Empirical Pictures",The eccentric members of a dysfunctional family reluctantly gather under the same roof for various reasons.,"$21,000,000 (estimated)","$71,442,210",R,Wes Anderson,"Wes Anderson, Owen Wilson","https://m.media-amazon.com/images/M/MV5BYmUzODQ5MGItZTZlNy00MDBhLWIxMmItMjg4Y2QyNDFlMWQ2XkEyXkFqcGdeQXVyMTMxODk2OTU@._V1_QL75_UX190_CR0,12,190,281_.jpg"
https://www.imdb.com/title/tt0200465/?ref_=sr_t_100,The Bank Job,7.2,"Crime, Drama, Thriller","Jason Statham, Saffron Burrows, Stephen Campbell Moore, Daniel Mays, James Faulkner, Alki David, Michael Jibson, Georgia Taylor, Richard Lintern, Peter Bowles, Alistair Petrie, Hattie Morahan, Julian Lewis Jones, Andrew Brooke, Rupert Frazer, Christopher Owen, Keeley Hawes, Taelor Samways","March 7, 2008 (United States)",1 hour 51 minutes,United Kingdom,English,"Mosaic, Relativity Media, Omnilab Media",Martine offers Terry a lead on a foolproof bank hit on London's Baker Street. She targets a roomful of safe deposit boxes worth millions in cash and jewelry along with a treasure trove of dirty secrets.,"$20,000,000 (estimated)","$64,828,421",R,Roger Donaldson,"Dick Clement, Ian La Frenais","https://m.media-amazon.com/images/M/MV5BMmE2NzEyOWItYjI1ZC00YWZhLWI2MjEtZmU1NjIyNjliOTkyXkEyXkFqcGdeQXVyMTYzMDM0NTU@._V1_QL75_UX190_CR0,0,190,281_.jpg"
https://www.imdb.com/title/tt0056193/?ref_=sr_t_101,Lolita,7.5,"Crime, Drama, Romance","James Mason, Shelley Winters, Sue Lyon, Gary Cockrell, Jerry Stovin, Diana Decker, Lois Maxwell, Cec Linder, Bill Greene, Shirley Douglas, Marianne Stone, Marion Mathie, James Dyrenforth, Maxine Holden, John Harrison, Colin Maitland, Terry Kilburn, C. Denier Warren","June 21, 1962 (West Germany)",2 hours 33 minutes,United Kingdom,English,"A.A. Productions Ltd., Anya, Harris-Kubrick Productions",A middle-aged college professor becomes infatuated with a 14-year-old girl.,"$2,000,000 (estimated)","$4,631",Approved,Stanley Kubrick,"Vladimir Nabokov, Vladimir Nabokov, Stanley Kubrick, James B. Harris","https://m.media-amazon.com/images/M/MV5BZTlmODM0ZTgtY2NkZS00Y2ZmLTkxMzktMTE4ZDg2NzNmNDkwXkEyXkFqcGdeQXVyMjUzOTY1NTc@._V1_QL75_UX190_CR0,4,190,281_.jpg"
https://www.imdb.com/title/tt31499750/?ref_=sr_t_102,Lowlifes,6.4,Horror,"Amanda Fix, Matthew MacCaull, Brenna Llewellyn, Elyse Levesque, Josh Zaharia, Cassandra Sawtell, Richard Harmon, Kevin McNulty, Ben Sullivan, Alexander Calvert, Dayleigh Nelson, Todd Masters","April 11, 2024 (United States)",1 hour 30 minutes,Canada,English,"Front Street Pictures, Lowlifes Productions",The survival instincts of a road-tripping family are put to the test when they have no other choice but to stay the night at a remote homestead.,,,,"Tesh Guttikonda, Mitch Oliver",Al Kaplan,"https://m.media-amazon.com/images/M/MV5BOWY4ZTkzNzMtNzRlMS00ZjdlLWI1NmEtN2MwYWJmMDVhZTY5XkEyXkFqcGdeQXVyMTUyNzgxOTI1._V1_QL75_UX190_CR0,2,190,281_.jpg"
https://www.imdb.com/title/tt0337978/?ref_=sr_t_103,Live Free or Die Hard,7.1,"Action, Thriller","Bruce Willis, Justin Long, Timothy Olyphant, Maggie Q, Cliff Curtis, Jonathan Sadowski, Andrew Friedman, Kevin Smith, Yorgo Constantine, Cyril Raffaelli, Chris Palermo, Mary Elizabeth Winstead, Sung Kang, Zeljko Ivanek, Christina Chang, Jake McDorman, Rosemary Knower, Gerald Downey","June 27, 2007 (United States)",2 hours 8 minutes,United States,English,"Twentieth Century Fox, Dune Entertainment, Ingenious Film Partners",John McClane and a young hacker join forces to take down master cyber-terrorist Thomas Gabriel in Washington D.C.,"$110,000,000 (estimated)","$388,156,011",PG-13,Len Wiseman,"John Carlin, Roderick Thorp, Mark Bomback, David Marconi, Mark Bomback","https://m.media-amazon.com/images/M/MV5BNDQxMDE1OTg4NV5BMl5BanBnXkFtZTcwMTMzOTQzMw@@._V1_QL75_UY281_CR1,0,190,281_.jpg"
https://www.imdb.com/title/tt1428538/?ref_=sr_t_104,Hansel & Gretel: Witch Hunters,6.1,"Action, Fantasy, Horror","Jeremy Renner, Gemma Arterton, Peter Stormare, Famke Janssen, Pihla Viitala, Derek Mears, Robin Atkin Downes, Ingrid Bolsø Berdal, Joanna Kulig, Thomas Mann, Bjørn Sundquist, Rainer Bock, Thomas Scharff, Kathrin Kühnel, Cedric Eich, Alea Sophia Boudodimos, Matthias Ziesing, Sebastian Hülk","January 25, 2013 (United States)",1 hour 28 minutes,United States,English,"Paramount Pictures, Metro-Goldwyn-Mayer (MGM), MTV Films",Brother/sister duo Hansel and Gretel are professional witch-hunters who help innocent villagers. One day they stumble upon a case that could hold the key to their past.,"$50,000,000 (estimated)","$226,349,749",R,Tommy Wirkola,"Tommy Wirkola, Jacob Grimm, Wilhelm Grimm","https://m.media-amazon.com/images/M/MV5BMjA4MDQwODg2NV5BMl5BanBnXkFtZTcwNTc5ODc2OA@@._V1_QL75_UX190_CR0,8,190,281_.jpg"
