Movie_Link,Movie_Name,Ratings,Movie_category,Film_Actor,Release_Date,Duration,Country,Original_Language,Companies,Description,Budget,Box Office,Certificate (MPAA),Directors,Writing_Credits,poster_path
https://www.imdb.com/title/tt6906292/?ref_=sr_t_150,Retribution,5.3,"Action, Thriller","Liam Neeson, Noma Dumezweni, Lilly Aspell, Jack Champion, Arian Moayed, Embeth Davidtz, Matthew Modine, Emily Kusche, Luca Márkus, Bernhard Piesk, Michael S. Ruscheinsky, Antonije Stankovic, Christian Koerner, Gerhard Elfers, Tina Gerhäusser, Peter Miklusz, Luc Etienne, Nedy John Cross","August 25, 2023 (United States)",1 hour 31 minutes,France,English,"StudioCanal, The Picture Company, Ombra Films",A bank executive receives a bomb threat while driving his children to school that his car will explode if they stop and get out.,"$20,000,000 (estimated)","$18,685,751",R,Nimród Antal,"Alberto Marini, Christopher Salmanpour","https://m.media-amazon.com/images/M/MV5BNTEwYTMyNmUtNmU5OS00NTg2LTk4ZjEtOGJlZWViMWFlMjY1XkEyXkFqcGdeQXVyMDM2NDM2MQ@@._V1_QL75_UX190_CR0,0,190,281_.jpg"
https://www.imdb.com/title/tt9620288/?ref_=sr_t_151,King Richard,7.5,"Biography, Drama, Sport","Will Smith, Aunjanue Ellis-Taylor, Jon Bernthal, Saniyya Sidney, Demi Singleton, Tony Goldwyn, Mikayla Lashae Bartholomew, Daniele Lawson, Layla Crawford, Erika Ringor, Noah Bean, Craig Tate, Josiah Cross, Calvin Clausell Jr., Vaughn W. Hebron, Jimmy Walker Jr., Kevin Dunn, Brad Greenquist","November 19, 2021 (United States)",2 hours 24 minutes,United States,English,"Warner Bros., Star Thrower Entertainment, Westbrook Studios",A look at how tennis superstars Venus and Serena Williams became who they are after the coaching from their father Richard.,"$50,000,000 (estimated)","$39,429,285",PG-13,Reinaldo Marcus Green,Zach Baylin,"https://m.media-amazon.com/images/M/MV5BYTcyNmY4ZGEtYmE4Zi00ZDViLTlmYzMtMmQ4ZTM4OWNmZjQxXkEyXkFqcGdeQXVyMTkxNjUyNQ@@._V1_QL75_UX190_CR0,0,190,281_.jpg"
https://www.imdb.com/title/tt0095678/?ref_=sr_t_152,The Murder of Mary Phagan,7.4,"Crime, Drama, History","Jack Lemmon, Richard Jordan, Robert Prosky, Peter Gallagher, Kathryn Walker, Rebecca Miller, Paul Dooley, Charles S. Dutton, Kevin Spacey, Cynthia Nixon, Kenneth Welsh, Thomas Anderson, Dylan Baker, Daniel Benzali, Nesbitt Blaisdell, Beeson Carroll, William C. Crawford, David Cromwell","January 24, 1988 (United States)",4 hours 11 minutes,United States,English,Orion Television,"In early twentieth-century Atlanta, the murder of a young girl prompts strong reactions from the community, and ultimately leads to the arrest of a man who may actually be innocent.",,,PG,William Hale,"Jeffrey Lane, Larry McMurtry, George Stevens Jr.","https://m.media-amazon.com/images/M/MV5BMTkzODg3Njk3Ml5BMl5BanBnXkFtZTgwNTk1ODk1MDE@._V1_QL75_UX190_CR0,24,190,281_.jpg"
https://www.imdb.com/title/tt0088680/?ref_=sr_t_153,After Hours,7.6,"Comedy, Crime, Drama","Griffin Dunne, Rosanna Arquette, Verna Bloom, Tommy Chong, Linda Fiorentino, Teri Garr, John Heard, Cheech Marin, Catherine O'Hara, Dick Miller, Will Patton, Robert Plunket, Bronson Pinchot, Rocco Sisto, Larry Block, Victor Argo, Murray Moston, John P. Codiglia","October 11, 1985 (United States)",1 hour 37 minutes,United States,English,"The Geffen Company, Double Play",An ordinary word processor has the worst night of his life after he agrees to visit a girl in Soho he met that evening at a coffee shop.,"$4,500,000 (estimated)","$10,627,372",R,Martin Scorsese,Joseph Minion,"https://m.media-amazon.com/images/M/MV5BMTUxMjEzMzI2MV5BMl5BanBnXkFtZTgwNTU3ODAxMDE@._V1_QL75_UX190_CR0,0,190,281_.jpg"
https://www.imdb.com/title/tt11540468/?ref_=sr_t_154,Breathe,3.8,"Action, Thriller","Jennifer Hudson, Milla Jovovich, Quvenzhané Wallis, Sam Worthington, Common, Raúl Castillo, Dan Martin, Kaliswa Brewster, James Saito, Sonya Giddings, Kimberly L. Jackson, John Xavier Lambert, Madison Latham","April 26, 2024 (United States)",1 hour 33 minutes,United States,English,"Capstone Global, Thunder Road Pictures, Capstone Studios","An East Flatbush mother and daughter, barely surviving in an oxygen-less world, must band together to protect each other when intruders arrive claiming to know their missing father.",,,PG-13,Stefon Bristol,Doug Simon,"https://m.media-amazon.com/images/M/MV5BZmM4NGMyMjYtNmQwZC00YmU2LWExZDEtOWFhZWNhYjlmNzAxXkEyXkFqcGdeQXVyMzQwMTY2Nzk@._V1_QL75_UX190_CR0,0,190,281_.jpg"
https://www.imdb.com/title/tt2960144/?ref_=sr_t_155,Seaside Hotel,8.0,"Comedy, Drama","Amalie Dollerup, Lars Ranthe, Anne Louise Hassing, Jens Jacob Tychsen, Merete Mærkedahl, Ulla Vejby, Anette Støvelbæk, Birthe Neumann, Bodil Jørgensen, Cecilie Stenspil, Peter Hesse Overgaard, Sonja Oppenhagen, Mads Wille, Sigurd Holmen le Dous, Morten Hemmingsen, Ena Spottag, Rosalinde Mynster, Kristian Halken","December 29, 2013 (United States)",50 minutes,Denmark,Danish,,"The seaside hotel ""Badehotellet"" in NW Denmark opens for its wealthy guests each summer. We follow the guests and staff at the hotel from 1928 and into the 1940s.",,,TV-MA,"Fabian Wullenweber, Jesper W. Nielsen","Hanna Lundblad, Hanna Lundblad, Hanna Lundblad, Hanna Lundblad, Hanna Lundblad, Stig Thorsboe, Stig Thorsboe, Stig Thorsboe, Stig Thorsboe, Stig Thorsboe","https://m.media-amazon.com/images/M/MV5BM2YwZjYyMDctZDRjMS00OTIyLTkyMzMtNjQxYmU2NGFhNjg4XkEyXkFqcGdeQXVyNjc3MjQzNTI@._V1_QL75_UY281_CR4,0,190,281_.jpg"
https://www.imdb.com/title/tt10092698/?ref_=sr_t_156,All Fun and Games,4.3,"Horror, Thriller","Asa Butterfield, Natalia Dyer, Benjamin Evan Ainsworth, Laurel Marsden, Annabeth Gish, Marina Stephenson Kerr, Kolton Stewart, Erik Athavale, Matthew Lupu, Sydney Sabiston, Summer H. Howell, Keishon Joseph, Logan Creran, Zoe Fish, Annelise Pollmann, Maclean Fish, Shylo Molina, Eva Ariel Binder","September 1, 2023 (United States)",1 hour 16 minutes,United States,English,"AGBO, Anton, Goldenberg & Co.","A group of Salem teens discover a cursed knife that unleashes a demon that forces them to play gruesome, deadly versions of childhood games where there can be no winners, only survivors.",,,,"Eren Celeboglu, Ari Costa","J.J. Braider, Eren Celeboglu, Ari Costa","https://m.media-amazon.com/images/M/MV5BYjg2NDM1MmMtNmM0Zi00OTdiLTlmNDctOTFhMTAwNmM1ZmNmXkEyXkFqcGdeQXVyMDc5ODIzMw@@._V1_QL75_UX190_CR0,2,190,281_.jpg"
https://www.imdb.com/title/tt2582846/?ref_=sr_t_157,The Fault in Our Stars,7.7,"Drama, Romance","Shailene Woodley, Ansel Elgort, Nat Wolff, Laura Dern, Sam Trammell, Willem Dafoe, Lotte Verbeek, Ana Dela Cruz, Randy Kovitz, Toni Saladna, David Whalen, Milica Govich, Allegra Carpenter, Emily Peachey, Emily Bach, Tim Hartman, Mike Birbiglia, Bethany Leo","June 6, 2014 (United States)",2 hours 6 minutes,United States,English,"Fox 2000 Pictures, Temple Hill Entertainment, TSG Entertainment","Hazel and Gus are teenagers who meet at a cancer support group and fall in love. They both share the same acerbic wit and a love of books, especially ""An Imperial Affliction"", so they embark on a journey to visit an author in Amsterdam.","$12,000,000 (estimated)","$307,168,169",PG-13,Josh Boone,"Scott Neustadter, Michael H. Weber, John Green","https://m.media-amazon.com/images/M/MV5BNTVkMTFiZWItOTFkOC00YTc3LWFhYzQtZTg3NzAxZjJlNTAyXkEyXkFqcGdeQXVyODE5NzE3OTE@._V1_QL75_UY281_CR0,0,190,281_.jpg"
https://www.imdb.com/title/tt0461770/?ref_=sr_t_158,Enchanted,7.1,"Animation, Adventure, Comedy","Amy Adams, Susan Sarandon, James Marsden, Patrick Dempsey, Timothy Spall, Idina Menzel, Rachel Covey, Julie Andrews, Jeff Bennett, Kevin Lima, Emma Rose Lima, Teala Dunn, Fred Tatasciore, Courtney Williams, William Huntley, Samantha Ivers, Lizzy Mathis, Edmund Lyndeck","November 21, 2007 (United States)",1 hour 47 minutes,United States,English,"Walt Disney Pictures, Josephson Entertainment, Andalasia Productions","A young maiden in a land called Andalasia, who is prepared to be wed, is sent away to New York City by an evil Queen, where she falls in love with a lawyer.","$85,000,000 (estimated)","$340,487,869",PG,Kevin Lima,Bill Kelly,"https://m.media-amazon.com/images/M/MV5BMjE4NDQ2Mjc0OF5BMl5BanBnXkFtZTcwNzQ2NDE1MQ@@._V1_QL75_UY281_CR0,0,190,281_.jpg"
https://www.imdb.com/title/tt0358273/?ref_=sr_t_159,Walk the Line,7.8,"Biography, Drama, Music","Joaquin Phoenix, Reese Witherspoon, Ginnifer Goodwin, Robert Patrick, Dallas Roberts, Dan John Miller, Larry Bagby, Shelby Lynne, Tyler Hilton, Waylon Payne, Shooter Jennings, Sandra Ellis Lafferty, Dan Beene, Clay Steakley, Johnathan Rice, John Holiday, Ridge Canipe, Lucas Till","November 18, 2005 (United States)",2 hours 16 minutes,Germany,English,"Fox 2000 Pictures, Tree Line Film, Konrad Pictures","A chronicle of country music legend Johnny Cash's life, from his early days on an Arkansas cotton farm to his rise to fame with Sun Records in Memphis, where he recorded alongside Elvis Presley, Jerry Lee Lewis, and Carl Perkins.","$28,000,000 (estimated)","$186,797,986",PG-13,James Mangold,"Johnny Cash, Gill Dennis, James Mangold, Patrick Carr","https://m.media-amazon.com/images/M/MV5BMjIyOTU3MjUxOF5BMl5BanBnXkFtZTcwMTQ0NjYzMw@@._V1_QL75_UX190_CR0,0,190,281_.jpg"
https://www.imdb.com/title/tt2184339/?ref_=sr_t_160,The Purge,5.7,"Horror, Sci-Fi, Thriller","Ethan Hawke, Lena Headey, Max Burkholder, Adelaide Kane, Edwin Hodge, Rhys Wakefield, Tony Oller, Arija Bareikis, Tom Yi, Chris Mulkey, Tisha French, Dana Bunch, Peter Gvozdas, John Weselcouch, Alicia Vela-Bailey, David Basila, Boima Blake, Nathan Clarkson","June 7, 2013 (United States)",1 hour 25 minutes,United States,English,"Universal Pictures, Platinum Dunes, Blumhouse Productions","A wealthy family is held hostage for harboring the target of a murderous syndicate during the Purge, a 12-hour period in which any and all crime is legal.","$3,000,000 (estimated)","$89,328,627",R,James DeMonaco,James DeMonaco,"https://m.media-amazon.com/images/M/MV5BMTQzNTcwODEyM15BMl5BanBnXkFtZTcwMjM1MDI0OQ@@._V1_QL75_UX190_CR0,10,190,281_.jpg"
https://www.imdb.com/title/tt0443272/?ref_=sr_t_161,Lincoln,7.3,"Biography, Drama, History","Daniel Day-Lewis, Sally Field, David Strathairn, Joseph Gordon-Levitt, James Spader, Hal Holbrook, Tommy Lee Jones, John Hawkes, Jackie Earle Haley, Bruce McGill, Tim Blake Nelson, Joseph Cross, Jared Harris, Lee Pace, Peter McRobbie, Gulliver McGrath, Gloria Reuben, Jeremy Strong","November 16, 2012 (United States)",2 hours 30 minutes,United States,English,"Dreamworks Pictures, Twentieth Century Fox, Reliance Entertainment","As the Civil War rages on, U.S President Abraham Lincoln struggles with continuing carnage on the battlefield as he fights with many inside his own cabinet on his decision to emancipate the slaves.","$65,000,000 (estimated)","$275,293,450",PG-13,Steven Spielberg,"Tony Kushner, Doris Kearns Goodwin","https://m.media-amazon.com/images/M/MV5BMTQzNzczMDUyNV5BMl5BanBnXkFtZTcwNjM2ODEzOA@@._V1_QL75_UX190_CR0,0,190,281_.jpg"
https://www.imdb.com/title/tt0076786/?ref_=sr_t_162,Suspiria,7.3,Horror,"Jessica Harper, Stefania Casini, Flavio Bucci, Miguel Bosé, Barbara Magnolfi, Susanna Javicoli, Eva Axén, Alida Valli, Joan Bennett, Margherita Horowitz, Jacopo Mariani, Fulvio Mingozzi, Franca Scagnetti, Renato Scarpa, Serafina Scorceletti, Giuseppe Transocchi, Renata Zamengo, Alessandra Capozzi","August 12, 1977 (United States)",1 hour 32 minutes,Italy,Italian,Seda Spettacoli,An American newcomer to a prestigious German ballet academy comes to realize that the school is a front for something sinister amid a series of grisly murders.,,,R,Dario Argento,"Dario Argento, Daria Nicolodi, Thomas De Quincey","https://m.media-amazon.com/images/M/MV5BZGRjNjljOGEtZjFmMi00YzU1LWIxOWYtZTQzODMzNDQzMzY1XkEyXkFqcGdeQXVyNDE5MTU2MDE@._V1_QL75_UY281_CR4,0,190,281_.jpg"
https://www.imdb.com/title/tt0086859/?ref_=sr_t_163,Against All Odds,5.9,"Action, Adventure, Crime","Rachel Ward, Jeff Bridges, James Woods, Alex Karras, Jane Greer, Richard Widmark, Dorian Harewood, Swoosie Kurtz, Saul Rubinek, Pat Corley, Bill McKinney, Allen Williams, Sam Scarber, Jon St. Elwood, Tamara Stafford, Jonathan Terry, Paul Valentine, Ted White","March 2, 1984 (United States)",2 hours 8 minutes,United States,English,"Columbia Pictures, New Visions, Columbia-Delphi Productions","A gangster hires an ex-football player to find his girlfriend. When he finds her, they fall in love, and the twists start to appear.","$13,000,000 (estimated)","$21,689,062",R,Taylor Hackford,"Eric Hughes, Daniel Mainwaring, Daniel Mainwaring","https://m.media-amazon.com/images/M/MV5BNDI4OWY0NjEtMzg2ZS00MTAwLWFmMGEtM2JlOWIxMGZmOTZiXkEyXkFqcGdeQXVyMTUzMDUzNTI3._V1_QL75_UX190_CR0,4,190,281_.jpg"
https://www.imdb.com/title/tt6479178/?ref_=sr_t_164,Picture of Beauty,3.5,"Drama, Romance","Taylor Sands, Danielle Rose, Pawel Hajnos, Magdalena Bochan-Jachimek, Joanna Mazewska, Ernestyna Winnicka, Joanna Sobocinska, Marek Dmoch, Amer Riad El-Muafy, Elen Moore, Frantisek Smejkal, Justyna Swierczynska, Sylwia Kaczmarek, Marek Zimakiewicz, Lidia Banach, Misha Czumaczenko, Tatiana Kot, Aleksandra Dzierzawska","April 2, 2021 (Australia)",1 hour 10 minutes,United Kingdom,English,La Femme Erotic,"In an early 20th century village, a painter with an unusual commission finds two pretty girls to model for him. The girls slowly come of age while exploring their sexuality and finding liberation in a repressed society.","£100,000 (estimated)",,,Maxim Ford,"Maxim Ford, Pau Ros","https://m.media-amazon.com/images/M/MV5BMWM2OGIyZTctODBmMi00NDYyLWIxMzAtODMzODVhMzliOGVkXkEyXkFqcGdeQXVyNTAzMTc1NjE@._V1_QL75_UY281_CR11,0,190,281_.jpg"
https://www.imdb.com/title/tt0048283/?ref_=sr_t_165,Land of the Pharaohs,6.6,"Adventure, Drama, History","Jack Hawkins, Joan Collins, Dewey Martin, Alexis Minotis, James Robertson Justice, Luisella Boni, Sydney Chaplin, James Hayter, Kerima, Piero Giagnoni, Ferruccio Amendola, Gianfranco Bellini, Valérie Camille, Diego Carlisi, Carlo D'Angelo, Cyril Delevanti, Vittoria Febbi, David Muss","June 24, 1955 (United States)",1 hour 46 minutes,United States,English,Continental Company,"A captured architect designs an ingenious plan to ensure the impregnability of the tomb of a self-absorbed Pharaoh, obsessed with the security of his next life.","$2,900,000 (estimated)",,Approved,Howard Hawks,"William Faulkner, Harry Kurnitz, Harold Jack Bloom","https://m.media-amazon.com/images/M/MV5BZmE5M2ExZTEtN2Q4Mi00NTMwLWE1YTctNGRhNTYyMmRlM2ExL2ltYWdlXkEyXkFqcGdeQXVyNjc1NTYyMjg@._V1_QL75_UX190_CR0,5,190,281_.jpg"
https://www.imdb.com/title/tt6519410/?ref_=sr_t_166,Black Spot,7.4,"Crime, Drama, Horror","Suliane Brahim, Hubert Delattre, Laurent Capelluto, Samuel Jouy, Camille Aguilar, Renaud Rutten, Brigitte Sy, Naidra Ayadi, Anne Suarez, Dan Herzberg, Kit Sheehan, Laura Richardson, Olivier Bonjour, Thomas Doret, Tiphaine Daviot, Samir Boitard, Théo Costa-Marini, Cyrielle Debreuil","May 31, 2019 (United States)",52 minutes,France,French,"Ego Productions, BE-FILMS, France Télévisions",A police chief and an eccentric new prosecutor investigate a string of grisly crimes and eerie phenomena in an isolated town at the edge of a forest.,,,TV-MA,"Julien Despaux, Thierry Poiraud","Mathieu Missoffe, Mathieu Missoffe, Mathieu Missoffe, Mathieu Missoffe, Antonin Martin-Hilbert, Antonin Martin-Hilbert, Florent Meyer, Florent Meyer, Sylvie Chanteux, Juliette Soubrier","https://m.media-amazon.com/images/M/MV5BOTI3Y2VlNjItNzIxMy00OTI4LTkxMWItYzFiY2Q3ODBiOWU2XkEyXkFqcGdeQXVyMTMxODk2OTU@._V1_QL75_UY281_CR6,0,190,281_.jpg"
https://www.imdb.com/title/tt0098084/?ref_=sr_t_167,Pet Sematary,6.5,"Fantasy, Horror, Thriller","Dale Midkiff, Denise Crosby, Fred Gwynne, Brad Greenquist, Michael Lombard, Miko Hughes, Blaze Berdahl, Susan Blommaert, Mara Clark, Kavi Raz, Mary Louise Wilson, Andrew Hubatsek, Liz Davies, Kara Dalke, Matthew August Ferrell, Lisa Stathoplos, Stephen King, Elizabeth Ureneck","April 21, 1989 (United States)",1 hour 43 minutes,United States,English,"Paramount Pictures, Laurel Productions","After tragedy strikes, a grieving father discovers an ancient burial ground behind his home with the power to raise the dead.","$11,500,000 (estimated)","$57,470,138",R,Mary Lambert,"Stephen King, Stephen King","https://m.media-amazon.com/images/M/MV5BYjBlNTBhYWQtMzg5Yi00NDA2LWJmMjYtZmM0ODhiYzkwYmY5XkEyXkFqcGdeQXVyMTQxNzMzNDI@._V1_QL75_UX190_CR0,4,190,281_.jpg"
https://www.imdb.com/title/tt0302640/?ref_=sr_t_168,The Hot Chick,5.6,"Comedy, Fantasy","Rob Schneider, Rachel McAdams, Anna Faris, Matthew Lawrence, Eric Christian Olsen, Robert Davi, Melora Hardin, Alexandra Holden, Maritza Murray, Fay Hauser, Jodi Long, Tia Mowry, Tamera Mowry-Housley, Lee Garlington, Angie Stone, Matt Weinberg, Leila Kenzle, Michelle Branch","December 13, 2002 (United States)",1 hour 44 minutes,United States,English,"Touchstone Pictures, Happy Madison Productions","An attractive and popular teenager, who is mean-spirited toward others, finds herself in the body of an older man, and must find a way to get back to her original body.",,,PG-13,Tom Brady,"Tom Brady, Rob Schneider","https://m.media-amazon.com/images/M/MV5BMzY1NTAzNTA3Ml5BMl5BanBnXkFtZTYwMDA5Mzc3._V1_QL75_UX190_CR0,0,190,281_.jpg"
https://www.imdb.com/title/tt0111756/?ref_=sr_t_169,Wyatt Earp,6.7,"Action, Adventure, Biography","Kevin Costner, Dennis Quaid, Gene Hackman, David Andrews, Linden Ashby, Jeff Fahey, Joanna Going, Mark Harmon, Michael Madsen, Catherine O'Hara, Bill Pullman, Isabella Rossellini, Tom Sizemore, JoBeth Williams, Mare Winningham, James Gammon, Rex Linn, Randle Mell","June 24, 1994 (United States)",3 hours 11 minutes,United States,English,"Warner Bros., Tig Productions, Kasdan Pictures","From Wichita to Dodge City, to the O.K. Corral in Tombstone, a man becomes a myth in this thrilling journey of romance, adventure, and desperate heroic action.","$63,000,000 (estimated)","$25,052,000",PG-13,Lawrence Kasdan,"Dan Gordon, Lawrence Kasdan","https://m.media-amazon.com/images/M/MV5BZTY2NDVhZGUtZTY2MC00MTBhLTg4YTQtN2ZiODU4OWM2YTNjXkEyXkFqcGdeQXVyNTAyODkwOQ@@._V1_QL75_UX190_CR0,1,190,281_.jpg"
https://www.imdb.com/title/tt0072472/?ref_=sr_t_170,Barney Miller,8.3,"Comedy, Drama","Hal Linden, Abe Vigoda, Max Gail, Steve Landesberg, Ron Glass, Ron Carey, Jack Soo, James Gregory, Barbara Barrie, Gregory Sierra, George Murdock, John Dullaghan, Stanley Brock, Jack DeLeon, Alex Henteloff, J.J. Barry, Don Calfa, Phil Leeds","August 22, 1974 (United States)",30 minutes,United States,English,,The Captain of the NYPD 12th Precinct and his staff handle the various local troubles and characters that come into the squad room.,,,TV-PG,"Noam Pitlik, Danny Arnold, Bruce Bilson, Lee Bernhardi, Max Gail, Alex March, Gennaro Montanino, Hal Linden, Jeremiah Morris, David Swift, Lee Lochhead, Homer Powell, Alan Bergmann, Tony Sheehan, Theodore J. Flicker, Allen Baron, Bill Davis, Bob Finkel, Richard Kinon, John Rich, Stan Lathan, Dennis Steinmetz, Mark Warren","Danny Arnold, Danny Arnold, Danny Arnold, Danny Arnold, Theodore J. Flicker, Theodore J. Flicker, Tony Sheehan, Tony Sheehan, Tony Sheehan, Tony Sheehan, Frank Dungan, Frank Dungan, Frank Dungan, Frank Dungan, Jeff Stein, Jeff Stein, Jeff Stein, Jeff Stein, Reinhold Weege, Reinhold Weege, Reinhold Weege, Chris Hayward, Chris Hayward, Chris Hayward, Tom Reeder, Tom Reeder, Tom Reeder, Jeff Stein, Jeff Stein, Jeff Stein, Jeff Stein, Arne Sultan, Arne Sultan, Arne Sultan, Dennis Koenig, Dennis Koenig, Dennis Koenig, Nat Mauldin, Nat Mauldin, Nat Mauldin, Larry Balmagia, Larry Balmagia, Larry Balmagia, Wally Dalton, Wally Dalton, Wally Dalton, Shelley Zellman, Shelley Zellman, Shelley Zellman, Jordan Moffet, Jordan Moffet, Jordan Moffet, Lee H. Grant, Lee H. Grant, Lee H. Grant, Richard Beban, Richard Beban, Judith Anne Nielsen, Judith Anne Nielsen, Jerry Ross, Jerry Ross, Roland Kibbee, Roland Kibbee, Roland Kibbee, Bob Colleary, Bob Colleary, Bob Colleary, Calvin Kelly, Calvin Kelly, Jim Tisdale, Jim Tisdale, Sandy Krinski, Douglas Wyman, Douglas Wyman, Michael Russnow, Michael Russnow, Michael Russnow, Carol Gary, Carol Gary, Rich Reinhart, Rich Reinhart, Rich Reinhart, Jaie Brashar, Jaie Brashar, Sybil Adelman, Howard Albrecht, Richard Baer, Herbert Baker, Jerry Davis, Jerry Davis, Ron Friedman, Lila Garrett, Lila Garrett, Steve Gordon, Howard Leeds, Ronny Pearlman, Bill Taub, Sol Weinstein, Seymour Blicker, Seymour Blicker, Gregory Teifer, Winston Moss, Mario Roccuzzo, James Bonnet, James Bonnet, Mark Brull, Greg Giangregorio, Paul Robinson Hunter, Phillip Jayson Lasker, Stephen Neigher, Sam Simon, Dick Wesson","https://m.media-amazon.com/images/M/MV5BNmM0YzcwZWQtYTIxMC00NTlmLThlMmItOGRjNWI5MTk5YmJkXkEyXkFqcGdeQXVyMTUyNjc3NDQ4._V1_QL75_UY281_CR11,0,190,281_.jpg"
https://www.imdb.com/title/tt26861992/?ref_=sr_t_171,Mea Culpa,4.1,"Crime, Drama, Thriller","Kelly Rowland, Trevante Rhodes, Nick Sagar, Sean Sagar, RonReaco Lee, Shannon Thornton, Kerry O'Malley, Arianna Barron, Connor Weil, Angela Robinson, María Gabriela González, Gene Weygandt, Paul Ryden, Candice Fawcett, Cory Hardin, Ava Hill, Callie Johnson, Avery Bigelow","February 23, 2024 (United States)",2 hours,United States,English,Tyler Perry Studios,"A criminal defense attorney, unhappy in her marriage, finds herself seduced by her mysterious new client, an artist accused of murdering his girlfriend.",,,R,Tyler Perry,Tyler Perry,"https://m.media-amazon.com/images/M/MV5BYTJlMDQxOWUtMWM0NC00YjI2LTk0ZmEtYmU0MWYzMjU1NTgyXkEyXkFqcGdeQXVyMTUzMTg2ODkz._V1_QL75_UX190_CR0,0,190,281_.jpg"
https://www.imdb.com/title/tt8550054/?ref_=sr_t_172,Pleasure,6.4,Drama,"Sofia Kappel, Zelda Morrison, Evelyn Claire, Chris Cock, Dana DeArmond, Kendra Spade, Jason Toler, Mark Spiegler, Lucy Hart, John Strong, Reza Azar, Aiden Starr, Small Hands, Axel Braun, Bill Bailey, Derrick Pierce, Nathan Bronson, Aramis Sartorio","October 8, 2021 (Sweden)",1 hour 49 minutes,Sweden,English,"Plattform Produktion, Film i Väst, Sveriges Television (SVT)","Bella Cherry arrives in Los Angeles with dreams of becoming an adult film star, but she soon learns that fame won't come easy as she harnesses her ambition and cunning to rise to the top of this mesmerizing and singular world.","SEK 19,000,000 (estimated)","$393,824",R,Ninja Thyberg,"Ninja Thyberg, Peter Modestij","https://m.media-amazon.com/images/M/MV5BNmU3ZTJjMTEtYzc2Ny00YjVhLTkyYmQtZTFhYWY0N2MxMzkxXkEyXkFqcGdeQXVyMTM1MTE1NDMx._V1_QL75_UX190_CR0,0,190,281_.jpg"
https://www.imdb.com/title/tt2400463/?ref_=sr_t_173,The Invitation,6.6,"Drama, Horror, Mystery","Logan Marshall-Green, Emayatzy Corinealdi, Michiel Huisman, Tammy Blanchard, Aiden Lovekamp, Michelle Krusiec, Mike Doyle, Jordi Vilasuso, Jay Larson, Marieh Delfino, Lindsay Burdge, John Carroll Lynch, Toby Huss, Danielle Camastra, Trish Gates, Karl Yune","April 8, 2016 (United States)",1 hour 40 minutes,United States,English,"Gamechanger Films, Lege Artis, The Invitation","When a man accepts an invitation to a dinner party hosted by his ex-wife, the unsettling past reopens old wounds and creates new tensions.",,,Not Rated,Karyn Kusama,"Phil Hay, Matt Manfredi","https://m.media-amazon.com/images/M/MV5BMTkzODMwNDkzOF5BMl5BanBnXkFtZTgwNDA4NzA1ODE@._V1_QL75_UY281_CR2,0,190,281_.jpg"
https://www.imdb.com/title/tt0433035/?ref_=sr_t_174,Real Steel,7.1,"Action, Drama, Sci-Fi","Hugh Jackman, Evangeline Lilly, Dakota Goyo, Anthony Mackie, Kevin Durand, Hope Davis, James Rebhorn, Karl Yune, Olga Fonda, John Gatins, Sophie Levy, Tess Levy, Charlie Levy, Gregory Sims, Torey Adkins, Tom Carlson, John Hawkinson, David Alan Basche","October 7, 2011 (United States)",2 hours 7 minutes,United States,English,"Dreamworks Pictures, Touchstone Pictures, Reliance Entertainment","In the near future, robot boxing is a top sport. A struggling ex-boxer feels he's found a champion in a discarded robot.","$110,000,000 (estimated)","$299,268,508",PG-13,Shawn Levy,"John Gatins, Dan Gilroy, Jeremy Leven, Richard Matheson","https://m.media-amazon.com/images/M/MV5BMjEzMzEzNjg0N15BMl5BanBnXkFtZTcwMzg4NDk0Ng@@._V1_QL75_UX190_CR0,0,190,281_.jpg"
https://www.imdb.com/title/tt6645582/?ref_=sr_t_175,Summer House,6.3,Reality-TV,"Kyle Cooke, Lindsay Hubbard, Carl Radke, Amanda Batula, Danielle Olivera, Paige DeSorbo, Ciara Miller, Luke Gulbranson, Hannah Berner, Mya Allen, Gabby Prescod, Craig Conover, Robert Sieber, Andrea Denver, Lauren Wirkus, Stephen McGee, Jordan Verroi, Chris Leoni","January 9, 2017 (United States)",43 minutes,United States,English,"Left Hook Media, True Entertainment, Truly Original","For years, this group of friends has been spending their weekends, from Memorial Day to Labour Day, at one of the most exclusive beaches on the East Coast. As soon as they arrive, they throw themselves into this luxury lifestyle.",,,TV-14,,Janie Stolar,"https://m.media-amazon.com/images/M/MV5BNGQxNDI3ZjctNTc0Mi00NTAyLTg3ZTItNzAyMTE5NmIwODAzXkEyXkFqcGdeQXVyMTQxNzMzNDI@._V1_QL75_UY281_CR1,0,190,281_.jpg"
https://www.imdb.com/title/tt0068699/?ref_=sr_t_176,High Plains Drifter,7.4,"Drama, Mystery, Western","Clint Eastwood, Verna Bloom, Marianna Hill, Mitchell Ryan, Jack Ging, Stefan Gierasch, Ted Hartley, Billy Curtis, Geoffrey Lewis, Scott Walker, Walter Barnes, Paul Brinegar, Richard Bull, Robert Donner, John Hillerman, Anthony James, William O'Connell, John Quade","April 7, 1973 (United States)",1 hour 45 minutes,United States,English,"The Malpaso Company, Polyphony Digital",A gun-fighting stranger comes to the small settlement of Lago and is hired to bring the townsfolk together in an attempt to hold off three outlaws who are on their way.,"$5,500,000 (estimated)","$15,706,540",R,Clint Eastwood,"Ernest Tidyman, Dean Riesner","https://m.media-amazon.com/images/M/MV5BNGI3YjIyZjYtYzJiNy00NTM4LWEzMmEtMmZiY2VjMjU5MzliXkEyXkFqcGdeQXVyMTUzMDUzNTI3._V1_QL75_UX190_CR0,2,190,281_.jpg"
