Movie_Link,Movie_Name,Ratings,Taglines,Movie_category,Film_Actor,Release_Date,Duration,Country,Original_Language,Companies,Description,Budget,Box Office,Certificate (MPAA),Directors,Writing_Credits,poster_path
https://www.imdb.com/title/tt17677860/?ref_=sr_t_372,Presumed Innocent,,,"Crime, Drama, Mystery","Jake Gyllenhaal, Ruth Negga, Kingston Rumi Southwick, Tate Birchmore, Roberta Bassin, Matthew Alan, James Hiroyuki Liao, MARS, Peter Lawrence Singer, Lily Rabe, Peter Sarsgaard, Bill Camp, O-T Fagbenle, Elizabeth Marvel, Renate Reinsve, Taylor Clark, Eileen Álvarez, Grace Rowe","June 12, 2024 (United States)",,United States,,"Apple Studios, Bad Robot, David E. Kelley Productions",It tells the story of a horrific murder that upends the Chicago Prosecuting Attorneys' office when one of its own is suspected of the crime.,,,,"Anne Sewitsky, Greg Yaitanes","David E. Kelley, Miki Johnson, Sharr White, Scott Turow",posters2/poster_372.jpg
https://www.imdb.com/title/tt0101540/?ref_=sr_t_373,Cape Fear,7.3,The Bowden family has moved to New Essex.,"Crime, Thriller","Robert De Niro, Nick Nolte, Jessica Lange, Juliette Lewis, Joe Don Baker, Robert Mitchum, Gregory Peck, Martin Balsam, Illeana Douglas, Fred Thompson, Zully Montero, Craig Henne, Forest Burton, Edgar Allan Poe IV, Rod Ball, W. Paul Bodie, Joel Kolker, Antoni Corone","November 15, 1991 (United States)",2 hours 8 minutes,United States,English,"Amblin Entertainment, Cappa Films, Tribeca Productions","A convicted rapist, released from prison after serving a fourteen-year sentence, stalks the family of the lawyer who originally defended him.","$35,000,000 (estimated)","$182,291,969 ",Rated R,Martin Scorsese,"John D. MacDonald, James R. Webb, Wesley Strick",posters2/poster_373.jpg
https://www.imdb.com/title/tt0113497/?ref_=sr_t_374,Jumanji,7.1,Roll the dice and unleash the excitement!,"Adventure, Comedy, Family","Robin Williams, Kirsten Dunst, Bonnie Hunt, Jonathan Hyde, Bradley Pierce, Bebe Neuwirth, David Alan Grier, Patricia Clarkson, Adam Hann-Byrd, Laura Bell Bundy, James Handy, Gillian Barber, Brandon Obray, Cyrus Thiedeke, Gary Joseph Thorup, Leonard Zola, Lloyd Berry, Malcolm Stewart","December 15, 1995 (United States)",1 hour 44 minutes,United States,English,"TriStar Pictures, Interscope Communications, Teitler Film","When two kids find and play a magical board game, they release a man trapped in it for decades - and a host of dangers that can only be stopped by finishing the game.","$65,000,000 (estimated)","$262,821,940 ",Rated PG,Joe Johnston,"Jonathan Hensleigh, Greg Taylor, Jim Strain, Greg Taylor, Jim Strain, Chris Van Allsburg, Chris Van Allsburg",posters2/poster_374.jpg
https://www.imdb.com/title/tt21051906/?ref_=sr_t_375,A Family Affair,,,"Comedy, Romance","Joey King, Nicole Kidman, Zac Efron, Kathy Bates, Liza Koshy, Sherry Cola, Gissette Valentin, Olivia Macklin, Bailey MB, Melissa Kennemore, Seoum Tylor Aun, Ian Gregg, Zele Avradopoulos, Agnes Mayasari, Cora Maple Lindell, Wes Jetton, Kannon, J Boone Smith Jr.","June 28, 2024 (United States)",,United States,English,Roth/Kirschenbaum Films,"An unexpected romance triggers comic consequences for a young woman, her mother, and her boss, grappling with the complications of love, sex, and identity.",,,Rated PG-13,Richard LaGravenese,Carrie Solomon,posters2/poster_375.jpg
https://www.imdb.com/title/tt26745657/?ref_=sr_t_376,Madgaon Express,7.5,,"Comedy, Drama","Divyendu Sharma, Pratik Gandhi, Avinash Tiwary, Nora Fatehi, Upendra Limaye, Chhaya Kadam, Vipul Deshpande, Umesh Jagtap, Aaryan Prajapati, Jewel Narigara, Yash Bhojwani, Sameer Patlil, Alpana Buch, Sonali Desai, Shiv Narayan, Remo D'Souza, Loanna Aleksandrova, Marcel D'souza","March 22, 2024 (India)",2 hours 23 minutes,India,Hindi,Excel Entertainment,The journey of three childhood friends who embark on a trip to Goa that goes completely off-track,,,,Kunal Kemmu,Kunal Kemmu,posters2/poster_376.jpg
https://www.imdb.com/title/tt1727776/?ref_=sr_t_377,Scouts Guide to the Zombie Apocalypse,6.3,Always Bring Protection,"Action, Comedy, Horror","Tye Sheridan, Logan Miller, Joey Morgan, Sarah Dumont, David Koechner, Halston Sage, Cloris Leachman, Niki Koss, Hiram A. Murray, Lukas Gage, Drew Droege, Patrick Schwarzenegger, Blake Anderson, Elle Evans, Matty Cardarople, Missy Martinez, Cameron Mitchell Elmore, Zale Kessler","October 30, 2015 (United States)",1 hour 33 minutes,United States,English,"Paramount Pictures, Broken Road Productions, Brucks Entertainment","Three scouts, on the eve of their last camp-out, discover the true meaning of friendship when they attempt to save their town from a zombie outbreak.","$15,000,000 (estimated)","$16,137,046 ",Rated R,Christopher Landon,"Carrie Lee Wilson, Emi Mochizuki, Christopher Landon, Lona Williams, Carrie Lee Wilson, Emi Mochizuki",posters2/poster_377.jpg
https://www.imdb.com/title/tt0293429/?ref_=sr_t_378,Mortal Kombat,6,Get over here.,"Action, Adventure, Fantasy","Lewis Tan, Jessica McNamee, Josh Lawson, Joe Taslim, Mehcad Brooks, Matilda Kimber, Laura Brent, Tadanobu Asano, Hiroyuki Sanada, Chin Han, Ludi Lin, Max Huang, Sisi Stringer, Mel Jarnson, Nathan Jones, Daniel Nelson, Ian Streetz, Yukiko Shinohara","April 23, 2021 (United States)",1 hour 50 minutes,United States,English,"New Line Cinema, Atomic Monster, Broken Road Productions",MMA fighter Cole Young seeks out Earth's greatest champions in order to stand against the enemies of Outworld in a high stakes battle for the universe.,"$55,000,000 (estimated)","$84,426,031 ",Rated R,Simon McQuoid,"Greg Russo, Dave Callaham, Oren Uziel, Greg Russo, Ed Boon, John Tobias",posters2/poster_378.jpg
https://www.imdb.com/title/tt20102596/?ref_=sr_t_379,"LaRoy, Texas",6.4,,"Comedy, Crime, Thriller","Steve Zahn, John Magaro, Dylan Baker, Galadriel Stineman, Matthew Del Negro, Megan Stevenson, Brad Leland, Emily Pendergast, Bob Clendenin, Marion Birdsall, Versai Knight, Alex Knight, Darcy Shean, Brannon Cross, Rio Alexander, Vic Browder, Brooks Hall, Alen Kolenovic","April 12, 2024 (United States)",1 hour 52 minutes,United States,English,"Adastra Films, FLOTE Entertainment, Ellly Films","When Ray discovers that his wife is cheating on him, he decides he's going to kill himself. His plans suddenly change when a stranger mistakes him for a low-rent hitman.","€2,000,000 (estimated)","$442,445 ",,Shane Atkinson,Shane Atkinson,posters2/poster_379.jpg
https://www.imdb.com/title/tt3704428/?ref_=sr_t_380,Elvis,7.3,The Man. The Legend. The King of Rock & Roll.,"Biography, Drama, Music","Tom Hanks, Austin Butler, Olivia DeJonge, Helen Thomson, Richard Roxburgh, Kelvin Harrison Jr., David Wenham, Kodi Smit-McPhee, Luke Bracey, Dacre Montgomery, Leon Ford, Gary Clark Jr., Yola, Natasha Bassett, Xavier Samuel, Adam Dunn, Alton Mason, Shonka Dukureh","June 24, 2022 (United States)",2 hours 39 minutes,United States,English,"Warner Bros., Bazmark Films, Roadshow Entertainment","The life of American music icon Elvis Presley, from his childhood to becoming a rock and movie star in the 1950s while maintaining a complex relationship with his manager, Colonel Tom Parker.","$85,000,000 (estimated)","$288,670,284 ",Rated PG-13,Baz Luhrmann,"Baz Luhrmann, Sam Bromell, Craig Pearce, Jeremy Doner, Baz Luhrmann, Jeremy Doner",posters2/poster_380.jpg
https://www.imdb.com/title/tt11245972/?ref_=sr_t_381,Scream,6.3,It's always someone you know.,"Horror, Mystery, Thriller","Neve Campbell, Courteney Cox, David Arquette, Melissa Barrera, Jack Quaid, Mikey Madison, Jenna Ortega, Dylan Minnette, Jasmin Savoy Brown, Mason Gooding, Sonia Ammar, Marley Shelton, Skeet Ulrich, Kyle Gallner, Chester Tam, Reggie Conquest, Heather Matarazzo, Brooke Barnhill","January 14, 2022 (United States)",1 hour 54 minutes,United States,English,"Paramount Pictures, Spyglass Media Group, Project X Entertainment","25 years after a streak of brutal murders shocked the quiet town of Woodsboro, Calif., a new killer dons the Ghostface mask and begins targeting a group of teenagers to resurrect secrets from the town's deadly past.","$24,000,000 (estimated)","$137,743,924 ",Rated R,"Matt Bettinelli-Olpin, Tyler Gillett","James Vanderbilt, Guy Busick, Kevin Williamson",posters2/poster_381.jpg
https://www.imdb.com/title/tt0072251/?ref_=sr_t_382,The Taking of Pelham One Two Three,7.6,Before this train reaches the next station it will become the scene of the most spectacular hijack ever attempted,"Action, Crime, Thriller","Walter Matthau, Robert Shaw, Martin Balsam, Hector Elizondo, Earl Hindman, James Broderick, Dick O'Neill, Lee Wallace, Tom Pedi, Beatrice Winde, Jerry Stiller, Nathan George, Rudy Bond, Kenneth McMillan, Doris Roberts, Julius Harris, Cynthia Belgrave, Anna Berger","November 14, 1974 (West Germany)",1 hour 44 minutes,United States,English,"Palomar Pictures International, Palladium Productions","Four armed men hijack a New York City subway car and demand a ransom for the passengers. The city's police are faced with a conundrum: Even if it's paid, how could they get away?","$5,000,000 (estimated)",$357 ,R,Joseph Sargent,"John Godey, Peter Stone",posters2/poster_382.jpg
https://www.imdb.com/title/tt7441658/?ref_=sr_t_383,Black Clover,8.2,,"Animation, Action, Adventure","Dallas Reid, Jill Harris, Cris George, Christopher Sabat, Micah Solusod, Brandon McInnis, Justin Briner, Sarah Wiedenheft, Bryn Apprill, Lydia Mackay, Mike McFarland, Ian Sinclair, Monica Rial, Dave Trosko, Gakuto Kajiwara, Megan Shipman, Kana Yûki, Robert McCollum","October 3, 2017 (United States)",24 minutes,Japan,Portuguese,Pierrot,"Asta and Yuno were abandoned together at the same church and have been inseparable since. As children, they promised that they would compete against each other to see who would become the next Emperor Magus.",,,TV-PG,"Tatsuya Yoshihara, Rokô Ogiwara, Ayataka Tanemura, Yoshizo Tsuda, Matsuo Asami, Akira Shimizu, Yûji Tokuno, Daisuke Chiba, Takashi Asami, Yoshito Hata, Shintarô Itoga, Takeyuki Sadohara, Kenichi Maejima, Shinji Morita","Katelyn Barr, Katelyn Barr, Kazuyuki Fudeyasu, Kazuyuki Fudeyasu, Kazuyuki Fudeyasu, Kan'ichi Katô, Yuuki Tabata, Yuuki Tabata",posters2/poster_383.jpg
https://www.imdb.com/title/tt5971474/?ref_=sr_t_384,The Little Mermaid,7.2,Be a part of her world.,"Adventure, Family, Fantasy","Halle Bailey, Jonah Hauer-King, Melissa McCarthy, Javier Bardem, Noma Dumezweni, Art Malik, Daveed Diggs, Jacob Tremblay, Awkwafina, Jessica Alexander, Martina Laird, Emily Coates, Christopher Fairbank, John Dagleish, Matt Carver, Jude Akuwudike, Lorena Andrea, Simone Ashley","May 26, 2023 (United States)",2 hours 15 minutes,United States,English,"Walt Disney Pictures, Lucamar Productions, Marc Platt Productions",A young mermaid makes a deal with a sea witch to trade her beautiful voice for human legs so she can discover the world above water and impress a prince.,"$250,000,000 (estimated)","$569,626,289 ",Rated PG,Rob Marshall,"David Magee, Hans Christian Andersen, John Musker, Ron Clements",posters2/poster_384.jpg
https://www.imdb.com/title/tt0246578/?ref_=sr_t_385,Donnie Darko,8,Life is one long insane trip. Some people just have better directions.,"Drama, Mystery, Sci-Fi","Jake Gyllenhaal, Jena Malone, Mary McDonnell, Holmes Osborne, Maggie Gyllenhaal, Daveigh Chase, James Duval, Arthur Taxier, Patrick Swayze, Mark Hoffman, David St. James, Tom Tangen, Jazzie Mahannah, Jolene Purdy, Stuart Stone, Gary Lundy, Alex Greenwald, Beth Grant","January 19, 2001 (Mexico)",1 hour 53 minutes,United States,English,"Pandora Cinema, Flower Films (II), Adam Fields Productions","After narrowly escaping a bizarre accident, a troubled teenager is plagued by visions of a man in a large rabbit suit who manipulates him to commit a series of crimes.","$6,000,000 (estimated)","$7,088,397 ",Rated R,Richard Kelly,Richard Kelly,posters2/poster_385.jpg
https://www.imdb.com/title/tt10676048/?ref_=sr_t_386,The Marvels,5.5,Higher. Further. Faster. Together.,"Action, Adventure, Fantasy","Brie Larson, Teyonah Parris, Iman Vellani, Samuel L. Jackson, Zawe Ashton, Gary Lewis, Park Seo-joon, Zenobia Shroff, Mohan Kapur, Saagar Shaikh, Leila Farzad, Abraham Popoola, Lashana Lynch, Tessa Thompson, Daniel Ings, Alex Hughes, Shardiah Ssagala, Cecily Cleeve","November 10, 2023 (United States)",1 hour 45 minutes,United States,English,"Marvel Studios, The Walt Disney Company","Carol Danvers gets her powers entangled with those of Kamala Khan and Monica Rambeau, forcing them to work together to save the universe.","$220,000,000 (estimated)","$206,136,557 ",Rated PG-13,Nia DaCosta,"Nia DaCosta, Megan McDonnell, Elissa Karasik",posters2/poster_386.jpg
https://www.imdb.com/title/tt0106080/?ref_=sr_t_387,The Nanny,7.1,,"Comedy, Family, Romance","Fran Drescher, Charles Shaughnessy, Daniel Davis, Lauren Lane, Nicholle Tom, Benjamin Salisbury, Madeline Zima, Renée Taylor, Rachel Chagall, Ann Morgan Guilbert, Chester Drescher, Spalding Gray, Mort Drescher, Nora Dunn, Sue Goodman, James Edson, DeeDee Rescher, Lawrence A. Mandley","November 3, 1993 (United States)",22 minutes,United States,English,"CBS, Echelon Productions, Inc., Highschool Sweethearts","After being fired from her job and dumped by her boyfriend, a cosmetics saleswoman becomes the nanny to the three children of a rich English widower. As time passes, the two fall for each other.",,,TV-PG,"Dorothy Lyman, Lee Shallat Chemel, Peter Marc Jacobson, Gail Mancuso, Paul Miller, Linda Day, Will Mackenzie, Fran Drescher, Randy Bennett, Lauren MacMullan, Steve Posner, Jennifer Reed","Fran Drescher, Fran Drescher, Fran Drescher, Fran Drescher, Fran Drescher, Fran Drescher, Prudence Fraser, Prudence Fraser, Peter Marc Jacobson, Peter Marc Jacobson, Peter Marc Jacobson, Peter Marc Jacobson, Peter Marc Jacobson, Peter Marc Jacobson, Robert Sternin, Robert Sternin, Robert Sternin, Frank Lombardi, Frank Lombardi, Frank Lombardi, Frank Lombardi, Frank Lombardi, Diane Wilk, Rick Shaw, Rick Shaw, Rick Shaw, Rick Shaw, Jayne Hamil, Jayne Hamil, Jayne Hamil, Caryn Lucas, Dana Reston, Dana Reston, Dana Reston, Ivan Menchell, Ivan Menchell, Ivan Menchell, Ivan Menchell, Ivan Menchell, Sally Lapiduss, Eileen O'Hare, Eileen O'Hare, Eileen O'Hare, Eileen O'Hare, Robbie Schwartz, Robbie Schwartz, Robbie Schwartz, Dan Amernick, Dan Amernick, Dan Amernick, Dan Amernick, Dan Amernick, Jay Amernick, Jay Amernick, Jay Amernick, Jay Amernick, Jay Amernick, Nastaran Dibai, Jeffrey B. Hodes, Suzanne Gangursky, Suzanne Gangursky, Suzanne Gangursky, Suzanne Gangursky, Pamela Eells, Howard Meyers, Eric Cohen, Janis Hirsch, Sean Hanley, Sean Hanley, Cody Farley, Cody Farley, Suzanne Myers, Suzanne Myers, Eve Ahlert, Dennis Drake, Bill Lawrence, Bill Lawrence, David M. Matthews, David M. Matthews, Erik Mintz, Chandler Evans, Andy Goodman, Michael Rowe, Alan R. Cohen, Alan Eisenstock, Alan Freedland, Lila Garrett, Sandy Krinski, Lisa Medway, Larry Mintz, Tracy Newman, Jonathan Stark, Ellen Idelson, Rob Lotterstein, Bill Marich, Jerry Perzigian, Rich Ross, Elliot Stern, Kirsten Vensel, Chris Alberghini, Mike Chessler, Jean Ford, Flo Cameron, Sarah McMullen, Matthew J. Berman, Allen J. Zipper, Rachel Chagall, Michael Dow, Harriet Goldman, Mary Lindes, Camelia Lynne, James Nelson, Dan Passman, Howard Preiser, Michael Scalisi, Bernard Vyzga",posters2/poster_387.jpg
https://www.imdb.com/title/tt2235759/?ref_=sr_t_388,The Great,8.1,If the crown fits... take it.,"Biography, Comedy, Drama","Elle Fanning, Phoebe Fox, Gwilym Lee, Adam Godley, Douglas Hodge, Belinda Bromilow, Bayo Gbadamosi, Florence Keith-Roach, Nicholas Hoult, Charity Wakefield, Sacha Dhawan, Danusia Samal, Jane Mahady, Alistair Green, Julian Barratt, Freddie Fox, Grace Molony, Henry Meredith","May 15, 2020 (United States)",,United States,English,"Thruline Entertainment, Civic Center Media, Echo Lake Entertainment","A royal woman living in rural Russia during the 18th century is forced to choose between her own personal happiness and the future of Russia, when she marries an Emperor.",,,TV-MA,"Colin Bucksey, Matthew Moore, Ben Chessell, Bertie Ellwood, Geeta Vasant Patel, Amber Templemore, Zetna Fuentes, Ally Pankiw, Tricia Brock, Sheree Folkson, Jaffar Mahmood, Matt Shakman","Tony McNamara, Tony McNamara, Tony McNamara, Tony McNamara, Tony McNamara, Tony McNamara, Tony McNamara, Vanessa Alexander, Vanessa Alexander, Gretel Vella, Gretel Vella, Matthew Moore, Constance Cheng, Maisie Parker, Ava Pickett, Ava Pickett, Fiona Seres, Tess Morris, Amelia Roper, James Wood, Tami Sagher",posters2/poster_388.jpg
https://www.imdb.com/title/tt15677150/?ref_=sr_t_389,Shrinking,8,,"Comedy, Drama","Jason Segel, Jessica Williams, Harrison Ford, Luke Tennie, Michael Urie, Lukita Maxwell, Christa Miller, Ted McGinley, Heidi Gardner, Devin Kawaoka, Lily Rabe, Lilan Bowden, Kimberly Condict, Rachel Stubington, Wendie Malick, Sawyer Jones, Tilky Jones, Asif Ali","January 27, 2023 (United States)",33 minutes,United States,English,"Doozer Productions, Warner Bros. Television","A grieving therapist starts to tell his clients exactly what he thinks. Ignoring his training and ethics, he finds himself making huge changes to people's lives - including his own.",,,TV-MA,"James Ponsoldt, Randall Keenan Winston, Ry Russo-Young, Zach Braff","Brett Goldstein, Brett Goldstein, Bill Lawrence, Bill Lawrence, Jason Segel, Jason Segel, Sofi Selig, Sofi Selig, Wally Baram, Rachna Fruchbom, Brian Gallivan, Neil Goldman, Annie Mebane, Bill Posley",posters2/poster_389.jpg
https://www.imdb.com/title/tt11646832/?ref_=sr_t_390,The Outlaws,7.7,,"Comedy, Crime, Drama","Rhianne Barreto, Darren Boyd, Gamba Cole, Jessica Gunning, Clare Perkins, Eleanor Tomlinson, Grace Calder, Stephen Merchant, Kojo Kamara, Charles Babalola, Christopher Walken, Tom Hanson, Ian McElhinney, Aiyana Goodfellow, Dolly Wells, Amanda Drew, Nina Wadia, Claes Bang","March 18, 2022 (United States)",58 minutes,United Kingdom,English,"Amazon Studios, BBC Studios, Big Talk Productions",Seven strangers from different walks of life forced together to complete a community payback sentence in Bristol.,,,TV-MA,"John Butler, Alicia MacDonald, Stephen Merchant, Curtis Vowell","Elgin James, Elgin James, Stephen Merchant, Stephen Merchant, Geoff Norcott, Fraser Steele, R. Paul Wilson, John Butler, Nikita Lalwani, Nathaniel Price, Emma Jane Unsworth, Claire Downes, Jess Bray, Jessica Gunning",posters2/poster_390.jpg
https://www.imdb.com/title/tt0840196/?ref_=sr_t_391,Skins,8.2,,Drama,"Kaya Scodelario, Nicholas Hoult, Joe Dempsie, Hannah Murray, Mike Bailey, April Pearson, Kathryn Prescott, Lily Loveless, Will Merrick, Freya Mavor, Jack O'Connell, Laya Lewis, Ollie Barbieri, Dakota Blue Richards, Sean Teale, Larissa Wilson, Dev Patel, Giles Thomas","January 17, 2011 (United States)",46 minutes,United Kingdom,English,"Company Pictures, E4, Echelon Productions, Inc.",The story of a group of British teens who are trying to grow up and find love and happiness despite questionable parenting and teachers who would rather be friends (and lovers) than authority figures.,,,TV-MA,"Charles Martin, Simon Massey, Jack Clough, Paul Gay, Adam Smith, Philippa Langdale, Ian Barnes, Benjamin Caron, Minkie Spiro, Harry Enfield, Aysha Rafaele, Neil Biswas, Esther May Campbell, Daniel O'Hara, Amanda Boyle, Dominic Leclerc, Samuel Donovan, Chris Clough, Tom Marshall","Jamie Brittain, Jamie Brittain, Jamie Brittain, Bryan Elsley, Bryan Elsley, Bryan Elsley, Bryan Elsley, Peter Bakare, Chris Hill, Ben Schiffer, Ben Schiffer, Jack Thorne, Georgia Lester, Georgia Lester, Sean Buckley, Jess Brittain, Lucy Kirkwood, Daniel Kaluuya, Isy Suttie, Ed Hime, Geoff Bussetil, Daniel Lovett, Simon Amstell, Sally Tatchell, Malcolm Campbell, Atiha Sen Gupta, Ben Bond, Laura Hunter, Jack Lothian, Megan Prescott, Camilla Blackett, Andrew Dawson, Steve Dawson, Tim Inman, Josie Long",posters2/poster_391.jpg
https://www.imdb.com/title/tt8550054/?ref_=sr_t_392,Pleasure,6.4,,Drama,"Sofia Kappel, Zelda Morrison, Evelyn Claire, Chris Cock, Dana DeArmond, Kendra Spade, Jason Toler, Mark Spiegler, Lucy Hart, John Strong, Reza Azar, Aiden Starr, Small Hands, Axel Braun, Bill Bailey, Derrick Pierce, Nathan Bronson, Aramis Sartorio","October 8, 2021 (Sweden)",1 hour 49 minutes,Sweden,English,"Plattform Produktion, Film i Väst, Sveriges Television (SVT)","Bella Cherry arrives in Los Angeles with dreams of becoming an adult film star, but she soon learns that fame won't come easy as she harnesses her ambition and cunning to rise to the top of this mesmerizing and singular world.","SEK 19,000,000 (estimated)","$393,824 ",Rated R,Ninja Thyberg,"Ninja Thyberg, Peter Modestij",posters2/poster_392.jpg
https://www.imdb.com/title/tt16139258/?ref_=sr_t_393,Yodha,5.9,One Commando. One Hijack. Countless Secrets.,"Action, Drama, Thriller","Sidharth Malhotra, Raashi Khanna, Disha Patani, Mridul Raj Anand, Kritika Bharadwaj, Shivangi Bhardwaj, Bhuvan Chopra, Pawan Chopra, Rahuul Chwudhary, Kenneth Desai, Sadiq Farooqui, Prashanth Goswami, Sanjay Gurbaxani, Sunny Hinduja, Hari Om Kalra, Pankaj Kalra, Vikram Kapadia, Abhishek Mishra","March 15, 2024 (India)",2 hours 10 minutes,India,Hindi,"Amazon Prime Video, Dharma Productions, Mentor Disciple Films","After terrorists hijack a passenger plane, an off-duty soldier aboard devises a strategy to defeat the hijackers and ensure the passengers' survival when the engine fails.",,,R,"Sagar Ambre, Pushkar Ojha",Sagar Ambre,posters2/poster_393.jpg
https://www.imdb.com/title/tt1255953/?ref_=sr_t_394,Incendies,8.3,The search began at the opening of their mother's will.,"Drama, Mystery, War","Lubna Azabal, Mélissa Désormeaux-Poulin, Maxim Gaudette, Mustafa Kamel, Hussein Sami, Rémy Girard, Dominique Briand, Frédéric Paquet, Hamed Najem, Ahmad Massad, Bader Alami, Majida Hussein, Asriah Nijres, John Dunn-Hill, Nadia Essadiqi, Chaouki Charbel, Axel Garbi, Amine Benzenine","January 12, 2011 (France)",2 hours 11 minutes,Canada,French,"micro_scope, TS Productions, Phi Group",Twins journey to the Middle East to discover their family history and fulfill their mother's last wishes.,"$6,800,000 (estimated)","$6,797,861 ",Rated R,Denis Villeneuve,"Denis Villeneuve, Wajdi Mouawad, Valérie Beaugrand-Champagne, Denis Villeneuve",posters2/poster_394.jpg
https://www.imdb.com/title/tt1285016/?ref_=sr_t_395,The Social Network,7.8,You don't get to 500 million friends without making a few enemies,"Biography, Drama","Jesse Eisenberg, Andrew Garfield, Justin Timberlake, Rooney Mara, Bryan Barter, Dustin Fitzsimons, Joseph Mazzello, Patrick Mapel, Toby Meuli, Alecia Svensen, Jami Owen, James Dastoli, Robert Dastoli, Scotty Crowe, Jayk Gallagher, Marcella Lentz-Pope, Trevor Wright, Barry Livingston","October 1, 2010 (United States)",2 hours,United States,English,"Columbia Pictures, Relativity Media, Scott Rudin Productions","As Harvard student Mark Zuckerberg creates the social networking site that would become known as Facebook, he is sued by the twins who claimed he stole their idea and by the co-founder who was later squeezed out of the business.","$40,000,000 (estimated)","$224,927,749 ",Rated PG-13,David Fincher,"Aaron Sorkin, Ben Mezrich",posters2/poster_395.jpg
https://www.imdb.com/title/tt8323628/?ref_=sr_t_396,My Life with the Walter Boys,6.9,,"Drama, Romance","Nikki Rodriguez, Noah LaLonde, Ashby Gentry, Johnny Link, Corey Fogelmanis, Connor Stanhope, Zoë Soul, Jaylan Evans, Sarah Rafferty, Marc Blucas, Alisha Newton, Mya Lowe, Isaac Arellanes, Ashley Holliday Tavares, Myles Perez, Ellie O'Brien, Gabrielle Jacinto, Moheb Jindran","December 7, 2023 (United States)",50 minutes,United Kingdom,English,"Nomadic Pictures, Sony Pictures Television, iGeneration Studios","Jackie Howard's life is disrupted by a freak accident, she is ripped from her home and has to start over on a ranch in Colorado, with her guardian and a family of 9 boys, and 1 girl.",,,TV-14,"Jerry Ciccoritti, Winnifred Jong, Nimisha Mukerji, Jason Priestley","Kelsey Barry, Kelsey Barry, Melanie Halsall, Melanie Halsall, Melanie Halsall, Ali Novak, Jonathon Roessler, Jonathon Roessler, Jesikah Suggs, Jesikah Suggs, Tawnya Bhattacharya, Ali Laventhol, Jordan Ross Schindler, Jordan Ross Schindler, Grace Condon, Jonathan Roessler",posters2/poster_396.jpg
https://www.imdb.com/title/tt0096754/?ref_=sr_t_397,The Abyss,7.5,Believe your eyes.,"Adventure, Drama, Mystery","Ed Harris, Mary Elizabeth Mastrantonio, Michael Biehn, Leo Burmester, Todd Graff, John Bedford Lloyd, J.C. Quinn, Kimberly Scott, Captain Kidd Brewer Jr., George Robert Klek, Christopher Murphy, Adam Nelson, Dick Warlock, Jimmie Ray Weeks, J. Kenneth Campbell, Ken Jenkins, Chris Elliott, Peter Ratray","August 9, 1989 (United States)",2 hours 20 minutes,United States,English,"Twentieth Century Fox, Pacific Western, Lightstorm Entertainment",A civilian diving team is enlisted to search for a lost nuclear submarine and faces danger while encountering an alien aquatic species.,"$70,000,000 (estimated)","$90,520,202 ",PG-13,James Cameron,James Cameron,posters2/poster_397.jpg
https://www.imdb.com/title/tt14403178/?ref_=sr_t_398,Beef,8,"One incident, two lives consumed.","Comedy, Drama","Steven Yeun, Ali Wong, Joseph Lee, Young Mazino, Remy Holt, David Choe, Patti Yasutake, Ashley Park, Maria Bello, Justin H. Min, Andrew Santino, Mia Serafino, Rekstizzy, Alyssa Gihee Kim, Andie Ju, Gina Lee, Jerry Hanjoo Kim, Eddie Shin","April 6, 2023 (United States)",,United States,English,"A24 Television, A24, Universal Remote",Two people let a road rage incident burrow into their minds and slowly consume their every thought and action.,,,TV-MA,"Jake Schreier, Hikari, Lee Sung Jin","Lee Sung Jin, Lee Sung Jin, Jean Kyoung Frazier, Jean Kyoung Frazier, Marie Hanhnhon Nguyen, Marie Hanhnhon Nguyen, Kevin Rosen, Kevin Rosen, Joanna Calo, Niko Gutierrez-Kovner, Alice Ju, Carrie Kemper, Alex Russell",posters2/poster_398.jpg
