Movie_Link,Movie_Name,Ratings,Taglines,Movie_category,Film_Actor,Release_Date,Duration,Country,Original_Language,Companies,Description,Budget,Box Office,Certificate (MPAA),Directors,Writing_Credits,poster_path
https://www.imdb.com/title/tt0482571/?ref_=sr_t_1,The Prestige,8.5,A Friendship That Became a Rivalry.,"Drama, Mystery, Sci-Fi","Christian Bale, Hugh Jackman, Scarlett Johansson, Michael Caine, Piper Perabo, Rebecca Hall, Samantha Mahurin, David Bowie, Andy Serkis, Daniel Davis, Jim Piddock, Christopher Neame, Mark Ryan, Roger Rees, Jamie Harris, Monty Stuart, Ron Perkins, Ricky Jay","October 20, 2006 (United States)",2 hours 10 minutes,United Kingdom,English,"Touchstone Pictures, Warner Bros., Newmarket Films","After a tragic accident, two stage magicians in 1890s London engage in a battle to create the ultimate illusion while sacrificing everything they have to outwit each other.","$40,000,000 (estimated)","$109,676,311 ",Rated PG-13,Christopher Nolan,"Jonathan Nolan, Christopher Nolan, Christopher Priest",posters2/poster_1.jpg
https://www.imdb.com/title/tt0106145/?ref_=sr_t_2,Star Trek: Deep Space Nine,8.1,"At the edge of the Final Frontier, the Universe's greatest mystery is about to unfold!","Action, Adventure, Drama","Avery Brooks, Rene Auberjonois, Cirroc Lofton, Alexander Siddig, Colm Meaney, Nana Visitor, Armin Shimerman, Terry Farrell, Michael Dorn, Randy James, Judi M. Durand, Aron Eisenberg, David B. Levinson, Andrew Robinson, Max Grodénchik, Marc Alaimo, Tom Morga, Majel Barrett","January 3, 1993 (United States)",45 minutes,United States,English,Paramount Television,"In the vicinity of the liberated planet of Bajor, the Federation space station Deep Space Nine guards the opening of a stable wormhole to the far side of the galaxy.",,,TV-PG,"David Livingston, Les Landau, Winrich Kolbe, Allan Kroeker, LeVar Burton, Avery Brooks, Rene Auberjonois, James L. Conway, Cliff Bole, Michael Vejar, Alexander Singer, Kim Friedman, Reza Badiyi, Jonathan West, Paul Lynch, Corey Allen, David Carson, Victor Lobl, Stephen L. Posey, Jonathan Frakes, Michael Dorn, Jesús Salvador Treviño, John T. Kretchmer, Alexander Siddig, Anson Williams, Chip Chalmers, Robert Legato, Robert Scheerer, Robert Wiemer, Andrew Robinson, Gabrielle Beaumont, Allan Eastman, Tony Dow","Rick Berman, Rick Berman, Michael Piller, Michael Piller, Michael Piller, Michael Piller, Michael Piller, Michael Piller, Gene Roddenberry, Robert Hewitt Wolfe, Robert Hewitt Wolfe, Robert Hewitt Wolfe, Robert Hewitt Wolfe, Robert Hewitt Wolfe, Robert Hewitt Wolfe, Bradley Thompson, Bradley Thompson, Bradley Thompson, Bradley Thompson, Bradley Thompson, Bradley Thompson, David Weddle, David Weddle, David Weddle, David Weddle, David Weddle, David Weddle, Ira Steven Behr, Ira Steven Behr, Ira Steven Behr, Ira Steven Behr, Ronald D. Moore, Ronald D. Moore, Ronald D. Moore, Hans Beimler, Hans Beimler, Hans Beimler, René Echevarria, René Echevarria, René Echevarria, René Echevarria, Peter Allan Fields, Peter Allan Fields, Peter Allan Fields, Peter Allan Fields, James Crocker, James Crocker, Jim Trombetta, Jim Trombetta, Joe Menosky, Joe Menosky, Joe Menosky, Mark O'Connell, Mark O'Connell, Mark O'Connell, Hilary Bader, Michael Taylor, Michael Taylor, Evan Somers, Evan Somers, Jeri Taylor, Naren Shankar, Naren Shankar, Richard Danus, Richard Danus, Morgan Gendel, Morgan Gendel, Morgan Gendel, Jeanne Carrigan-Fauci, Jeanne Carrigan-Fauci, Frederick Rappaport, Lisa Rich, Lisa Rich, Gary Holland, Gary Holland, Tom Benko, Gordon T. Dawson, Gordon T. Dawson, Bill Dial, Bill Dial, Bill Dial, David Mack, David Mack, John J. Ordover, John J. Ordover, Ethan H. Calk, Robert Lederman, David R. Long, Nicholas Corea, Nicholas Corea, Toni Marberry, Jack Treviño, Pam Pietroforte, Bryan Fuller, Philip Kim, Steven Baum, Kurt Michael Bensmiller, Kurt Michael Bensmiller, Sally Caves, Nell McCue Crawford, Nell McCue Crawford, William Crawford, William Crawford, Jill Donner, Jill Donner, Don Carlos Dunaway, Gabe Essoe, D.C. Fontana, David Livingston, Michael McGreevey, Kelley Miles, Katharyn Powers, Sam Rolfe, Gerald Sanford, Hannah Louise Shearer, John Whelpley, John Whelpley, Gene Wolande, John Wright, Andrea Moore Alton, Paul Robert Coyle, Jeff King, Flip Kobler, Mike Krohn, Philip LaZebnik, D. Thomas Maio, Richard Manning, Cindy Marcus, Christopher Teague, Steve Warnek, David S. Cohen, Christian Ford, Bob Gillan, Lisa Klink, Lisa Klink, John Shirley, Roger Soffer, Martin A. Winer, Lynn Barker, Majel Barrett, Robert J. Bolivar, George A. Brozak, Rick Cason, Louis P. DeSantis, Jane Espenson, David Gerrold, Barbara J. Lee, Jenifer A. Lee, Daniel Keys Moran, Brice Parker, L.J. Strom, Pam Wigginton, Truly Barr Clark, Jimmy Diggs, Scott J. Neal, Edmund Newton, Robbin L. Slocum, Gabrielle G. Stanton, Harry Werksman, Marc Scott Zicree, Spike Steingasser, Jose Molina, William N. Stape",posters2/poster_2.jpg
https://www.imdb.com/title/tt13911628/?ref_=sr_t_3,Lessons in Chemistry,8.2,Life rarely follows a formula.,Drama,"Brie Larson, Lewis Pullman, Aja Naomi King, Stephanie Koenig, Patrick Walker, Marc Evan Jackson, Derek Cecil, Kevin Sussman, Thomas Mann, Paul James, Alice Halsey, Rainn Wilson, Andy Daly, Amentii Sledge, Joshua Hoover, Yasir Hashim Lafond, Beau Bridges, Adam Bartley","October 13, 2023 (United States)",,United States,English,"Aggregate Films, Apple Studios, Apple","Set in the 1950s, Elizabeth Zott's dream of being a chemist is put on hold when she finds herself pregnant, alone, and fired from her lab.",,,TV-MA,"Bertie Ellwood, Tara Miele, Millicent Shelton, Sarah Adina Smith, Amber Templemore","Victoria Bata, Lee Eisenberg, Lee Eisenberg, Bonnie Garmus, Elissa Karasik, Emily Jane Fox",posters2/poster_3.jpg
https://www.imdb.com/title/tt5726616/?ref_=sr_t_4,Call Me by Your Name,7.8,Is it better to speak or die?,"Drama, Romance","Timothée Chalamet, Armie Hammer, Michael Stuhlbarg, Amira Casar, Esther Garrel, Victoire Du Bois, Vanda Capriolo, Antonio Rimoldi, Elena Bucci, Marco Sgrosso, André Aciman, Peter Spears, Andrew Duncan Hinojosa, Maria Caggianelli Villani, Krystal Ellsworth","January 19, 2018 (United States)",2 hours 12 minutes,Italy,English,"Frenesy Film Company, La Cinéfacture, RT Features","In 1980s Italy, romance blossoms between a seventeen-year-old student and the older man hired as his father's research assistant.","€4,000,000 (estimated)","$43,368,603 ",Rated R,Luca Guadagnino,"James Ivory, André Aciman",posters2/poster_4.jpg
https://www.imdb.com/title/tt0114369/?ref_=sr_t_5,Se7en,8.6,"Long is the way, and hard, that out of hell leads up to light.","Crime, Drama, Mystery","Morgan Freeman, Brad Pitt, Kevin Spacey, Andrew Kevin Walker, Daniel Zacapa, Gwyneth Paltrow, John Cassini, Bob Mack, Peter Crombie, Reg E. Cathey, R. Lee Ermey, George Christy, Endre Hules, Hawthorne James, William Davidson, Bob Collins, Jimmy Dale Hartsell, Richard Roundtree","September 22, 1995 (United States)",2 hours 7 minutes,United States,English,"Cecchi Gori Pictures, Juno Pix, New Line Cinema","Two detectives, a rookie and a veteran, hunt a serial killer who uses the seven deadly sins as his motives.","$33,000,000 (estimated)","$327,333,559 ",Rated R,David Fincher,Andrew Kevin Walker,posters2/poster_5.jpg
https://www.imdb.com/title/tt10016180/?ref_=sr_t_6,The Little Things,6.3,Some things never let us go.,"Crime, Drama, Mystery","Denzel Washington, Rami Malek, Jared Leto, Chris Bauer, Michael Hyatt, Terry Kinney, Natalie Morales, Isabel Arraiza, Joris Jarsky, Glenn Morshower, Sofia Vassilieva, Jason James Richter, John Harlan Kim, Frederick Koehler, Judith Scott, Maya Kazan, Tiffany Gonzalez, Anna McKitrick","January 29, 2021 (United States)",2 hours 8 minutes,United States,English,"Gran Via Productions, Warner Bros.","Kern County Deputy Sheriff Joe Deacon is sent to Los Angeles for what should have been a quick evidence-gathering assignment. Instead, he becomes embroiled in the search for a serial killer who is terrorizing the city.","$30,000,000 (estimated)","$30,842,746 ",Rated R,John Lee Hancock,John Lee Hancock,posters2/poster_6.jpg
https://www.imdb.com/title/tt6473344/?ref_=sr_t_7,SEAL Team,7.8,,"Action, Drama, War","David Boreanaz, Neil Brown Jr., A.J. Buckley, Toni Trucks, Justin Melnick, Max Thieriot, Tyler Grey, Judd Lormand, Jessica Paré, Dita The Hair Missile Dog, Scott Foxx, Alona Tal, Parisa Fakhri, Kerri Medders, Jamie McShane, Mike Wade, Emily Swallow, Kaliayh Rhambo","September 27, 2017 (United States)",43 minutes,United States,English,"East 25C, Chulack Productions, Timberman-Beverly Productions","The lives of the elite Navy SEALs as they train, plan, and execute the most dangerous, high-stakes missions the United States of America can ask.",,,TV-14,"Christopher Chulack, Ruben Garcia, J. Michael Muro, David Boreanaz, Gonzalo Amat, Larry Teng, Allison Liddi-Brown, Michael W. Watkins, Jessica Paré, Holly Dale, Tyler Grey, Félix Enríquez Alcalá, John Dahl, Ian Toynton, Max Thieriot, Melanie Mayron, Thomas Carter, Kenneth Fink, Nelson McCormick, Silver Tree, Jann Turner, Andy Wolk, Guy Ferland, Alexis Ostrander, David C. Cook, Christine Moore, Jason Cabell, Cherie Nowlan, Loren Yaconelli, SJ Main Muñoz, Mark Semos, Lionel Coleman","Benjamin Cavell, Benjamin Cavell, Kenny Ryan, Kenny Ryan, Kenny Ryan, Kenny Ryan, Kenny Ryan, Kenny Ryan, Jacob Roman, Jacob Roman, Jacob Roman, Jacob Roman, Jacob Roman, Jacob Roman, Stephen Gasper, Stephen Gasper, Stephen Gasper, Stephen Gasper, Reiss Clauson-Wolf, Reiss Clauson-Wolf, Reiss Clauson-Wolf, Julian Silver, Julian Silver, Julian Silver, Rashaan Dozier-Escalante, Rashaan Dozier-Escalante, Rashaan Dozier-Escalante, Rashaan Dozier-Escalante, Teresa Huang, Teresa Huang, Teresa Huang, Mark Semos, Mark Semos, Spencer Hudnut, Ariel Endacott, Ariel Endacott, Ariel Endacott, Sabrina Almeida, Sabrina Almeida, Brian Horiuchi, Brian Horiuchi, Josef Sawyer, Josef Sawyer, Josef Sawyer, Tom Mularz, Tom Mularz, Dana Greenblatt, Dana Greenblatt, Kenny Sheard, Kenny Sheard, Kenny Sheard, Leanne Koch, Leanne Koch, Leanne Koch, Madalyn Lawson, Madalyn Lawson, John Glenn, Valerie Armstrong, Valerie Armstrong, Holly Harold, Corinne Marrinan, Kinan Copen, Beth Schacter, Jon Worley, John Bellucci, Matt Bosack, Brian Beneker, Daniele Nathanson, Sam Sheridan, Ed Redlich, Becky Mode, Duppy Demetrius, McKinley Mac Bundick Jr., Tyler Grey, Peter Rudolph, Maggie Stabile",posters2/poster_7.jpg
https://www.imdb.com/title/tt0113277/?ref_=sr_t_8,Heat,8.3,An L.A. Redemption,"Action, Crime, Drama","Al Pacino, Robert De Niro, Val Kilmer, Jon Voight, Tom Sizemore, Diane Venora, Amy Brenneman, Ashley Judd, Mykelti Williamson, Wes Studi, Ted Levine, Dennis Haysbert, William Fichtner, Natalie Portman, Tom Noonan, Kevin Gage, Hank Azaria, Susan Traylor","December 15, 1995 (United States)",2 hours 50 minutes,United States,English,"Warner Bros., New Regency Productions, Forward Pass",A group of high-end professional thieves start to feel the heat from the LAPD when they unknowingly leave a verbal clue at their latest heist.,"$60,000,000 (estimated)","$187,436,818 ",Rated R,Michael Mann,Michael Mann,posters2/poster_8.jpg
https://www.imdb.com/title/tt1094229/?ref_=sr_t_9,Heartland,8.5,,"Drama, Family","Amber Marshall, Shaun Johnston, Michelle Morgan, Chris Potter, Graham Wardle, Alisha Newton, Kerry James, Jessica Steen, Gabriel Hogan, Jessica Amlee, Nathaniel Arcand, Ruby Spencer, Emmanuella Spencer, Julia Maren Baker, Cindy Busby, Greta Onieogou, Kevin McGarry, Wanda Cannon","October 14, 2007 (United States)",45 minutes,Canada,English,"Bell Broadcast and New Media Fund, Rescued Horse Season One, Seven24 Films","A multi-generational saga set in Alberta, Canada and centered on a family getting through life together in both happy and trying times.",,,TV-PG,"Dean Bennett, Chris Potter, Grant Harvey, Eleanore Lindo, T.W. Peacocke, Stefan Scaini, Bruce McDonald, Ken Filewych, Steve DiMarco, Ron Murphy, Don McBrearty, Pierre Tremblay, Kristin Lehman, Gail Harvey, Michelle Morgan, Megan Follows, Rachel Leiterman, John Fawcett, Jim Donovan, Stephen Reynolds, Norma Bailey, Alison Reid, Gloria Kim, Madison Thomas, Sudz Sutherland, Tim Southam, Francis Damberger, Tina Grewal, David Frazee, Anne Wheeler, Dawn Wilkinson, Jill Carter, Winnifred Jong, Melanie Scrofano","Lauren Brooke, Heather Conkie, Heather Conkie, Heather Conkie, Mark Haroun, Mark Haroun, Mark Haroun, Mark Haroun, Mark Haroun, Mark Haroun, Ken Craw, Ken Craw, Ken Craw, Ken Craw, Ken Craw, Ken Craw, Ken Craw, David Preston, David Preston, David Preston, Leila Basen, Leila Basen, Pamela Pinch, Pamela Pinch, Pamela Pinch, Murray Shostak, Alexandra Clarke, Alexandra Clarke, James Nadler, Sheila Prescott, Susin Nielsen, Susin Nielsen, Bonnie Fairweather, Penny Gummerson, Caitlin D. Fryers, Adam Hussein, Adam Hussein, Andrew Wreggitt, Kate Melville, David Moses, Alex Pugsley, Will Pascoe, Jessalyn Dennis, Katherine Schlemmer",posters2/poster_9.jpg
https://www.imdb.com/title/tt8595140/?ref_=sr_t_10,The Conners,5.8,,Comedy,"John Goodman, Laurie Metcalf, Sara Gilbert, Alicia Goranson, Emma Kenney, Ames McNamara, Jay R. Ferguson, Jayden Rey, Michael Fishman, Katey Sagal, Charlotte Sanchez, Nat Faxon, Rene Rosado, Maya Lynne Robinson, Stephen Monroe Taylor, Estelle Parsons, James Pickens Jr., Alexandra Billings","October 16, 2018 (United States)",30 minutes,United States,English,"Jax Media, Gilbert Films, Mohawk Productions","Follow-up to the comedy series Roseanne (1988), centering on the family members of the matriarch after her sudden death.",,,TV-PG,"Jody Margolin Hahn, Lynda Tarryk, Robbie Countryman, Gail Mancuso, Fred Savage, Michael Arden, Michael Fishman, Bob Koherr, Kimberly McCullough, Andy Ackerman, Don Scardino, Jude Weng, Rebecca Asher, Timothy Busfield, Jean Sagal, Trevor Kirschner","Dave Caplan, Dave Caplan, Dave Caplan, Dave Caplan, Bruce Helford, Bruce Helford, Bruce Helford, Bruce Helford, Bruce Rasmussen, Bruce Rasmussen, Bruce Rasmussen, Bruce Rasmussen, Matt Williams, Cory Caplan, Cory Caplan, Cory Caplan, Shelley Dennis, Shelley Dennis, Shelley Dennis, Amy Fox, Amy Fox, Amy Fox, Jana Hunter, Jana Hunter, Jana Hunter, Mitch Hunter, Mitch Hunter, Mitch Hunter, Daniel Talbott, Daniel Talbott, Emily R. Wilson, Emily R. Wilson, Emily R. Wilson, Simone Finch, Simone Finch, Jena Friedman, Sid Youngers, Debby Wolfe, Erica Montolfo-Bura, Kimberly Altamirano, Alicia Goranson, Alicia Goranson, Darlene Hunt, Cindy Caponera, Molly Kiernan, Daniel Spector, Susan McMartin, Liz Astrof, Ali Liebegott, Mark Kunerth, Cameron Griggs-Posey, Hunter Rasmussen",posters2/poster_10.jpg
https://www.imdb.com/title/tt1340094/?ref_=sr_t_11,The Crow,,,"Action, Crime, Fantasy","Bill Skarsgård, FKA twigs, Danny Huston, Laura Birn, Jordan Bolger, Karel Dobrý, Isabella Wei, Sami Bouajila, David Bowles, Jim High, Dukagjin Podrimaj, Paul A Maynard, Sebastian Orozco, Kim Girschner, Baha Chbani","August 23, 2024 (United States)",,United States,English,"Hassell Free Productions, Davis-Films, The Electric Shadow Company","When soulmates Eric and Shelly are brutally murdered, Eric is given the chance to save his true love by sacrificing himself and sets out to seek revenge, traversing the worlds of the living and the dead to put the wrong things right.","$50,000,000 (estimated)",,,Rupert Sanders,"James O'Barr, Zach Baylin, William Josef Schneider",posters2/poster_11.jpg
https://www.imdb.com/title/tt12677870/?ref_=sr_t_12,Law & Order: Organized Crime,7.7,Find Strength In Justice (Season 4),"Crime, Drama, Mystery","Christopher Meloni, Danielle Moné Truitt, Ainsley Seiger, Rick Gonzalez, Nicky Torchia, Brent Antonello, Ellen Burstyn, Mike Cannon, Rachel Lin, Nona Parker Johnson, Keren Dukes, Tamara Taylor, Dylan McDermott, Mariska Hargitay, Guillermo Diaz, Allison Siko, Tate Ellington, Wesam Keesh","April 1, 2021 (United States)",42 minutes,United States,English,"Wolf Entertainment, Universal Television",Elliot Stabler returns to the NYPD to battle organized crime after a devastating personal loss.,,,TV-14,"John Polson, Jean de Segonzac, Fred Berner, Jon Cassar, Jonathan Brown, Stephen Surjik, Ken Girotti, Alex Hall, Bethany Rooney, Simon Brand, Sharon Lewis, Gonzalo Amat, Milena Govich, Tess Malone, John David Coles, Eriq La Salle, Terry Miller, Monica Raymund, Sarah Boyd, Anna Dokoza, Rob Greenlea, Jim McKay, Cherie Nowlan, Kate Woods, Brenna Malloy, Oz Scott, Alex Zakrzewski, Carlos Bernard, Juan José Campanella, Leslie Hope, Nelson McCormick","Ilene Chaiken, Ilene Chaiken, Ilene Chaiken, Ilene Chaiken, Warren Leight, Julie Martin, Julie Martin, Matt Olmstead, Matt Olmstead, Dick Wolf, Dick Wolf, Candice Sanchez McFarlane, Candice Sanchez McFarlane, Candice Sanchez McFarlane, Nick Culbertson, Nick Culbertson, Nick Culbertson, Christina Piña, Christina Piña, Emmy Higgins, Emmy Higgins, Alec Wells, Alec Wells, Juliet Lashinsky-Revene, Rick Marin, Kimberly A. Harrison, Zachary Reiter, Amy Berg, John Shiban, Nichole Beattie, Eric Haywood, Barry O'Brien, Barry O'Brien, Barry O'Brien, Jorge Zamacona, David Graziano, David Graziano, Will Pascoe, Liz Sagal, Josh Fagin, Michael Konyves, Brendan Feeney, Brendan Feeney, Davon Briggs, Davon Briggs, Katrina Cabrera Ortega, Bridget Tyler, Marcus J. Guillory, Jean Kyoung Frazier, Daniel Beaty, Erica Michelle Butler, Rick Eid, Bryan Goluboff, Sean Jablonski, Gwen Sigan, Nicholas Evangelista, John A. McCormack, Katie Letien",posters2/poster_12.jpg
https://www.imdb.com/title/tt2582802/?ref_=sr_t_13,Whiplash,8.5,The road to greatness can take you to the edge,"Drama, Music","Miles Teller, J.K. Simmons, Melissa Benoist, Paul Reiser, Austin Stowell, Nate Lang, Chris Mulkey, Damon Gupton, Suanne Spoke, Max Kasch, Charlie Ian, Jayson Blair, Kofi Siriboe, Kavita Patil, C.J. Vana, Tarik Lowe, Tyler Kimball, Rogelio Douglas Jr.","October 15, 2014 (Philippines)",1 hour 46 minutes,United States,English,"Bold Films, Blumhouse Productions, Right of Way Films",A promising young drummer enrolls at a cut-throat music conservatory where his dreams of greatness are mentored by an instructor who will stop at nothing to realize a student's potential.,"$3,300,000 (estimated)","$49,449,489 ",Rated R,Damien Chazelle,Damien Chazelle,posters2/poster_13.jpg
https://www.imdb.com/title/tt1655441/?ref_=sr_t_14,The Age of Adaline,7.2,The world has changed in the last century. Adaline has not.,"Drama, Fantasy, Romance","Blake Lively, Michiel Huisman, Harrison Ford, Kathy Baker, Ellen Burstyn, Amanda Crew, Lynda Boyd, Hugh Ross, Richard Harmon, Fulvio Cecere, Anjali Jay, Hiro Kanagawa, Peter J. Gray, Izabel Pearce, Cate Richardson, Jane Craven, Noel Johansen, Aaron Craven","April 24, 2015 (United States)",1 hour 52 minutes,United States,English,"Lakeshore Entertainment, Lionsgate Films, Sidney Kimmel Entertainment","A young woman, born at the turn of the 20th century, is rendered ageless after an accident. After many solitary years, she meets a man who complicates the eternal life she has settled into.","$25,000,000 (estimated)","$65,663,276 ",Rated PG-13,Lee Toland Krieger,"J. Mills Goodloe, Salvador Paskowitz, J. Mills Goodloe, Salvador Paskowitz",posters2/poster_14.jpg
https://www.imdb.com/title/tt15153532/?ref_=sr_t_15,Strays,6.3,,"Adventure, Comedy","Will Ferrell, Jamie Foxx, Isla Fisher, Randall Park, Will Forte, Brett Gelman, Rob Riggle, Josh Gad, Sofía Vergara, Jamie Demetriou, Greta Lee, Jimmy Tatro, Harvey Guillén, Jack De Sanz, Phil Morris, David Herman, Jaquita Ta'le, Charity Cervantes","August 18, 2023 (United States)",1 hour 33 minutes,United States,English,"Universal Pictures, Lord Miller, Picturestart",An abandoned dog teams up with other strays to get revenge on his former owner.,,,Rated R,Josh Greenbaum,Dan Perrault,posters2/poster_15.jpg
https://www.imdb.com/title/tt11737520/?ref_=sr_t_16,One Piece,8.4,Come on board and bring along all your hopes and dreams,"Action, Adventure, Comedy","Iñaki Godoy, Emily Rudd, Mackenyu, Morgan Davies, Vincent Regan, Aidan Scott, Armand Aucamp, Jacob Romero, Jeff Ward, Taz Skylar, McKinley Belcher III, Craig Fairbrass, Jandre le Roux, Peter Gadiot, Colton Osorio, Steven John Ward, Celeste Loots, Kathleen Stephens","August 31, 2023 (United States)",1 hour,United Kingdom,English,"Tomorrow Studios, Film Afrika Worldwide, Kaji Productions","In a seafaring world, a young pirate captain sets out with his crew to attain the title of Pirate King, and to discover the mythical treasure known as 'One Piece.'",,,TV-14,"Marc Jobst, Tim Southam, Emma Sullivan, Josef Kubota Wladyka","Lindsay Gelfand, Lindsay Gelfand, Tom Hyndman, Tom Hyndman, Steven Maeda, Steven Maeda, Steven Maeda, Steven Maeda, Eiichirô Oda, Matt Owens, Matt Owens, Matt Owens, Allison Weintraub, Allison Weintraub, Tiffany Greshler, Ian Stokes, Diego Gutierrez, Laura Jacqmin, Damani Johnson, Joe Tracz",posters2/poster_16.jpg
https://www.imdb.com/title/tt16358384/?ref_=sr_t_17,Tulsa King,8,,"Crime, Drama","Sylvester Stallone, Andrea Savage, Martin Starr, Dashiell Connery, Chris Caldovino, Neal McDonough, Rich Ting, Jay Will, Max Casella, Domenick Lombardozzi, Vincent Piazza, A.C. Peterson, Garrett Hedlund, Dana Delany, Tatiana Zappardino, Ritchie Coster, Emily Davis, McKenna Quigley Harrington","November 13, 2022 (United States)",40 minutes,United States,English,"101 Studios, Bosque Ranch Productions, Cold Front Productions","Following his release from prison, Mafia capo Dwight ""The General"" Manfredi is exiled to Tulsa, Oklahoma, where he builds a new criminal empire with a group of unlikely characters.",,,TV-MA,"Craig Zisk, Allen Coulter, Guy Ferland, Ben Semanoff, Lodge Kerrigan, Ben Richardson","Terence Winter, Terence Winter, Terence Winter, Joseph Riccobene, Joseph Riccobene, Taylor Sheridan, Taylor Sheridan, Taylor Sheridan, David Flebotte, Regina Corrado, Tom Sierchio",posters2/poster_17.jpg
https://www.imdb.com/title/tt27415863/?ref_=sr_t_18,Fiasco,6.4,,Comedy,"Pierre Niney, Géraldine Nakache, Pascal Demolon, Leslie Medina, Louise Coldefy, Djimo, Juliette Gasquet, Igor Gotesman, François Civil, Soraya Garlenq, François De Brauer, Michaël Perez, Antoine Berry Roger, Jessy Salomée Ugolin, Evelyne El Garby Klaï, Marie-Christine Barrault, Vincent Cassel, Alexis Brami","April 30, 2024 (United States)",40 minutes,France,French,"Five Dogs, Ninety Films",Raphaël Valande is shooting his first feature film to pay tribute to the heroic life of his resistant grandmother. The shooting gradually turns into a nightmare due to a member of the team who does everything to sabotage it.,,,,Igor Gotesman,"Sylvain Caron, Igor Gotesman, Igor Gotesman, Tania Gotesman, Pierre Niney, Pierre Niney, Hadrien Rol, Nicolas Slomka, François Uzan",posters2/poster_18.jpg
https://www.imdb.com/title/tt0102926/?ref_=sr_t_19,The Silence of the Lambs,8.6,"Dr. Hannibal Lecter. Brilliant. Cunning. Psychotic. In his mind lies the clue to a ruthless killer. - Clarice Starling, FBI. Brilliant. Vulnerable. Alone. She must trust him to stop the killer.","Crime, Drama, Thriller","Jodie Foster, Anthony Hopkins, Scott Glenn, Ted Levine, Anthony Heald, Brooke Smith, Diane Baker, Kasi Lemmons, Charles Napier, Tracey Walter, Roger Corman, Ron Vawter, Danny Darst, Jeffrie Lane, Frankie Faison, Paul Lazar, Dan Butler, Chris Isaak","February 14, 1991 (United States)",1 hour 58 minutes,United States,English,"Strong Heart/Demme Production, Orion Pictures","A young F.B.I. cadet must receive the help of an incarcerated and manipulative cannibal killer to help catch another serial killer, a madman who skins his victims.","$19,000,000 (estimated)","$272,742,922 ",R,Jonathan Demme,"Thomas Harris, Ted Tally",posters2/poster_19.jpg
https://www.imdb.com/title/tt27790101/?ref_=sr_t_20,Conan O'Brien Must Go,8.5,"When the world needed help, he came instead.","Documentary, Comedy","Conan O'Brien, Jarle Wallevik, Sebastian, Kai, Bruno, Catrin Sagen, Santiago, Martina, Jordan Schlansky, Matías, Carolina, Cassandra, Mario, Cammy, Pablo, Juan Pablo Cairo, Maximiliano Bagnasco, Kevin Hussey","April 18, 2024 (United States)",,United States,English,Conaco,"Follows Conan O'Brien as he visits new friends he made through his podcast Conan O'Brien Needs a Friend (2018), and engages in in-depth discussions with viewers from all around the nation and the globe.",,,,Mike Sweeney,"Jessie Gaskell, Conan O'Brien, Matt O'Brien, Mike Sweeney",posters2/poster_20.jpg
https://www.imdb.com/title/tt32019314/?ref_=sr_t_21,Star Wars: Tales of the Empire,7.2,Long live the Empire.,"Animation, Short, Action","Meredith Salenger, Diana Lee Inosanto, Rya Kihlstedt, Steve Blum, Shelby Young, Suzie McGrath, Wing T. Chao, Meg Marchand, Katee Sackhoff, Lars Mikkelsen, Zeno Robinson, Matthew Wood, Xander Berkeley, Keith Ferguson, Lydia Look, Anna Graves, Dee Bradley Baker, Cathy Ang","May 4, 2024 (United States)",,United States,English,"Lucasfilm Animation, Lucasfilm","A vengeful young woman and a former Jedi navigate the ruthless Galactic Empire during different eras, their divergent choices shaping their fates in a rapidly changing galaxy.",,,TV-PG,"Dave Filoni, Nathaniel Villanueva, Steward Lee, Saul Ruiz","Dave Filoni, Dave Filoni, George Lucas, Amanda Rose Muñoz, Matt Michnovetz, Nicolas Anastassiou",posters2/poster_21.jpg
