Movie_Link,Movie_Name,Ratings,Taglines,Movie_category,Film_Actor,Release_Date,Duration,Country,Original_Language,Companies,Description,Budget,Box Office,Certificate (MPAA),Directors,Writing_Credits,poster_path
https://www.imdb.com/title/tt3397884/?ref_=sr_t_222,Sicario,7.7,The border is just another line to cross.,"Action, Crime, Drama","Emily Blunt, Josh Brolin, Benicio Del Toro, Jon Bernthal, Victor Garber, Daniel Kaluuya, Jeffrey Donovan, Raoul Max Trujillo, Julio Cesar Cedillo, Hank Rogerson, Bernardo Saracino, Maximiliano Hernández, Kevin Wiggins, Edgar Arreola, Kim Larrichio, Jesus Nevarez-Castillo, Dylan Kenin, John Trejo","October 2, 2015 (United States)",2 hours 1 minute,United States,English,"Lionsgate Films, Black Label Media, Thunder Road Pictures",An idealistic FBI agent is enlisted by a government task force to aid in the escalating war against drugs at the border area between the U.S. and Mexico.,"$30,000,000 (estimated)","$84,997,446 ",Rated R,Denis Villeneuve,Taylor Sheridan,posters2/poster_222.jpg
https://www.imdb.com/title/tt1649418/?ref_=sr_t_223,The Gray Man,6.5,,"Action, Thriller","Ryan Gosling, Chris Evans, Ana de Armas, Billy Bob Thornton, Jessica Henwick, Dhanush, Alfre Woodard, Regé-Jean Page, Wagner Moura, Julia Butters, Shea Whigham, Deobia Oparei, Robert Kazinsky, Daz Crawford, Callan Mulvey, Charlit Dae, Cameron Crovetti, Chris Castaldi","July 22, 2022 (United States)",2 hours 2 minutes,United States,English,"AGBO, Netflix, Roth Films","When the CIA's most skilled operative, whose true identity is known to none, accidentally uncovers dark agency secrets, a psychopathic former colleague puts a bounty on his head, setting off a global manhunt by international assassins.","$200,000,000 (estimated)","$454,023 ",Rated PG-13,"Joe Russo, Anthony Russo","Joe Russo, Christopher Markus, Stephen McFeely, Mark Greaney",posters2/poster_223.jpg
https://www.imdb.com/title/tt1396484/?ref_=sr_t_224,It,7.3,You'll float too.,"Fantasy, Horror","Bill Skarsgård, Jaeden Martell, Finn Wolfhard, Sophia Lillis, Jeremy Ray Taylor, Chosen Jacobs, Jack Dylan Grazer, Wyatt Oleff, Nicholas Hamilton, Jake Sim, Logan Thompson, Owen Teague, Jackson Robert Scott, Stephen Bogaert, Stuart Hughes, Geoffrey Pounsett, Pip Dwyer, Molly Atkinson","September 8, 2017 (United States)",2 hours 15 minutes,United States,English,"New Line Cinema, RatPac-Dune Entertainment, Vertigo Entertainment","In the summer of 1989, a group of bullied kids band together to destroy a shape-shifting monster, which disguises itself as a clown and preys on the children of Derry, their small Maine town.","$35,000,000 (estimated)","$704,242,888 ",Rated R,Andy Muschietti,"Chase Palmer, Cary Joji Fukunaga, Gary Dauberman, Stephen King",posters2/poster_224.jpg
https://www.imdb.com/title/tt5040012/?ref_=sr_t_225,Nosferatu,,,"Fantasy, Horror, Mystery","Aaron Taylor-Johnson, Emma Corrin, Bill Skarsgård, Nicholas Hoult, Willem Dafoe, Lily-Rose Depp, Ralph Ineson, Simon McBurney, Stacy Thunes, Paul A Maynard","December 25, 2024 (United States)",,Czech Republic,English,"Focus Features, Stillking Films, Studio 8","A gothic tale of obsession between a haunted young woman and the terrifying vampire infatuated with her, causing untold horror in its wake.",,,,Robert Eggers,Robert Eggers,posters2/poster_225.jpg
https://www.imdb.com/title/tt9561862/?ref_=sr_t_226,"Love, Death & Robots",8.4,The threesome you've been waiting for.,"Animation, Short, Action","Fred Tatasciore, Scott Whyte, Nolan North, Noshir Dalal, Caitlin McKenna, Josh Brener, Steven Pacey, Gary Anthony Williams, Emily O'Brien, Matthew Yang King, Michelle C. Bonilla, Chris Parnell, Stanton Lee, Chris Cox, Time Winters, Ike Amadi, Elodie Yung, Jeff Schine","March 15, 2019 (United States)",15 minutes,United States,English,"Blur Studio, Netflix Studios, Netflix","A collection of animated short stories that span various genres including science fiction, fantasy, horror and comedy.",,,TV-MA,"Gabriele Pennacchioli, Jennifer Yuh Nelson, Jerome Denjean, Franck Balson, Tim Miller, Víctor Maldonado, Alfredo Torres, Jerome Chen, Alberto Mielgo, Dominique Boidin, Léon Bérelle, Rémi Kozyra, Maxime Luère, Robert Valley, Ki-Yong Bae, Dae Woo Lee, Damian Nenow, Javier Recio Gracia, Vitaliy Shushko, Owen Sullivan, Oliver Thomas, Dave Wilson, Jon Yeo, István Zorkóczy, Alex Beaty, Elliot Dear, Meat Dept, Simon Otto, Robert Bisi, Emily Dean, David Fincher, Andy Lyon, Patrick Osborne, Carlos Stevens","Tim Miller, Tim Miller, Tim Miller, Philip Gelatt, John Scalzi, John Scalzi, Joe R. Lansdale, Neal Asher, Alberto Mielgo, Michael Swanwick, Marko Kloos, Alastair Reynolds, David W. Amendola, Kirsten Cross, Claudine Griggs, Peter F. Hamilton, Steven Lewis, Ken Liu, Janis Robertson, Vitaliy Shushko, Paolo Bacigalupi, J.G. Ballard, Meat Dept, Harlan Ellison, Joachim Heijndermans, Rich Larson, Joe Abercrombie, Alan Baxter, Robert Bisi, Justin Coates, Jeff Fowler, Andy Lyon, Bruce Sterling, Andrew Kevin Walker, Kevin Van Der Meiren",posters2/poster_226.jpg
https://www.imdb.com/title/tt31100872/?ref_=sr_t_227,Dange,5.5,,"Action, Drama","Harshvardhan Rane, Ehan Bhat, T.J. Bhanu, Nikita Dutta, Taniya Kalrra, Insane Ashraf, Paavani Atrey, Mridul Das, Surjyasikha Das, Omna Harjani, Athul Prabhakaran, Pratham Rathod, Kabir Shah, Jeeva Subramanian","March 1, 2024 (India)",2 hours 34 minutes,India,Hindi,"Getaway Pictures Presentation, T-Series Films","Journey that delves deep into the complexities of friends. Set against the backdrop of a vibrant college festival, the movie explores the intricate dynamics between two friends whose paths diverge and ignite a fierce competition.",,,,Bejoy Nambiar,"Neil Julian Balthazar, Mithila Hegde, Bejoy Nambiar, Punit Sheth, Francis Thomas",posters2/poster_227.jpg
https://www.imdb.com/title/tt20115766/?ref_=sr_t_228,Knox Goes Away,6.9,,Thriller,"Michael Keaton, Ray McKinnon, Cassie Moronez, Paul Perri, Joanna Kulig, Edwin Garcia II, Nicole Reddinger, Suzy Nakamura, John Hoogenakker, Dennis Dugan, Kristofer Gordon, James Marsden, Charles Bisset, Jimmy Ortega, Lela Loren, Jay Paulson, Sasha Neboga, Al Pacino","March 15, 2024 (United States)",1 hour 54 minutes,United States,English,"Brookstreet Pictures, Sugar23, Three Point Capital (TPC)","When a contract killer has a rapidly evolving form of dementia, he is offered an opportunity to redeem himself by saving the life of his estranged adult son.",,,Rated R,Michael Keaton,Gregory Poirier,posters2/poster_228.jpg
https://www.imdb.com/title/tt11981644/?ref_=sr_t_229,Professor T,7.2,,"Crime, Drama, Mystery","Barney White, Ben Miller, Frances de la Tour, Emma Naomi, Sarah Woodward, Andy Gathergood, Douglas Reith, Juliet Aubrey, Rupert Turnbull, Ben Onwukwe, Juliet Stevenson, Tayla Kovacevic-Ebong, Keith Dunphy, Lucy Anna Richardson, Alastair Mackenzie, Sunetra Sarker, Martin Swabey, Phil McKee","July 11, 2021 (United States)",46 minutes,United Kingdom,English,"Eagle Eye Drama, ITV - Independent Television, Beta Film","Professor Jasper Tempest, a genius Cambridge University criminologist with OCD and an overbearing mother, assists the police in solving crime.",,,,"Dries Vos, Maarten Moerkerke, Kaat Beels","Matt Baker, Stephen Brady, Malin-Sarah Gozin, Paul Piedfort, Paul Piedfort, Paul Piedfort, Paul Piedfort",posters2/poster_229.jpg
https://www.imdb.com/title/tt0047880/?ref_=sr_t_230,The Big Knife,6.8,The hottest hunk of film Hollywood ever shot !,"Crime, Drama, Film-Noir","Jack Palance, Ida Lupino, Wendell Corey, Jean Hagen, Rod Steiger, Ilka Chase, Everett Sloane, Wesley Addy, Paul Langton, Nick Dennis, Bill Walker, Michael Winkelman, Shelley Winters, Richard Boone, Nick Cravat, Robert Emhardt, Michael Fox, Paula Kyle","November 24, 1955 (Canada)",1 hour 51 minutes,United States,English,The Associates & Aldrich Company,Hollywood actor Charles Castle is pressured by his studio boss into a criminal cover-up to protect his valuable career.,"$423,000 (estimated)",,,Robert Aldrich,"James Poe, Clifford Odets",posters2/poster_230.jpg
https://www.imdb.com/title/tt17663992/?ref_=sr_t_231,Scream VI,6.5,New York. New rules.,"Horror, Mystery, Thriller","Courteney Cox, Melissa Barrera, Jenna Ortega, Jasmin Savoy Brown, Mason Gooding, Skeet Ulrich, Roger Jackson, Dermot Mulroney, Jack Champion, Josh Segarra, Liana Liberato, Devyn Nekoda, Hayden Panettiere, Tony Revolori, Samara Weaving, Matthew Giuffrida, Andre Anthony, Henry Czerny","March 10, 2023 (United States)",2 hours 2 minutes,United States,English,"Paramount Pictures, Spyglass Media Group, Project X Entertainment","In the next installment, the survivors of the Ghostface killings leave Woodsboro behind and start a fresh chapter in New York City.","$35,000,000 (estimated)","$168,961,389 ",Rated R,"Matt Bettinelli-Olpin, Tyler Gillett","James Vanderbilt, Guy Busick, Kevin Williamson",posters2/poster_231.jpg
https://www.imdb.com/title/tt0286486/?ref_=sr_t_232,The Shield,8.7,Conscience is a killer (Season 5),"Crime, Drama, Thriller","Michael Chiklis, Catherine Dent, Walton Goggins, Michael Jace, Jay Karnes, Benito Martinez, CCH Pounder, Cathy Cahlin Ryan, David Rees Snell, Kenny Johnson, David Marciano, Autumn Chiklis, Paula Garcés, Michele Hicks, Melanie Myers, Joel Rosenthal, Matt Corboy, Chaney Kley","March 12, 2002 (United States)",45 minutes,United States,English,"Fox Television Studios, Sony Pictures Television, The Barn Productions",Drama series following the lives and cases of dirty cop Vic Mackey and the corrupt LAPD unit under his command.,,,TV-MA,"Guy Ferland, Scott Brazil, Clark Johnson, Dean White, Stephen Kay, Gwyneth Horder-Payton, D.J. Caruso, Michael Chiklis, Nick Gomez, Paris Barclay, Peter Horton, Terrence O'Hara, Félix Enríquez Alcalá, Philip G. Atwell, Rohn Schmidt, Gary Fleder, Stephen Gyllenhaal, Leslie Libman, Brad Anderson, John Badham, Davis Guggenheim, Scott Winant, David Mamet, Vondie Curtis-Hall, David Von Ancken, Kurt Sutter, Frank Darabont, Michael Fields, Craig Brewer, Billy Gierhart","Shawn Ryan, Shawn Ryan, Shawn Ryan, Shawn Ryan, Kurt Sutter, Kurt Sutter, Kurt Sutter, Kurt Sutter, Scott Rosenbaum, Scott Rosenbaum, Scott Rosenbaum, Kim Clements, Kim Clements, Kim Clements, Kim Clements, Kim Clements, Glen Mazzara, Glen Mazzara, Glen Mazzara, Charles H. Eglee, Charles H. Eglee, Adam Fierro, Adam Fierro, Elizabeth Craft, Elizabeth Craft, Sarah Fain, Sarah Fain, Kevin Arkadie, Kevin Arkadie, Lisa Randolph, Lisa Randolph, James Manos Jr., Reed Steiner, Elizabeth A. Hansen, John Hlavin, Gary Lennon, Angela Russo-Otstot, Diego Gutierrez, Randy Huggins, Lia Langworthy, Jennifer R. Richmond, Ted Griffin, Emily Lewis, Renee Palyo, Tony Soltis, Evan Bleiweiss, Jameal Turner",posters2/poster_232.jpg
https://www.imdb.com/title/tt0303461/?ref_=sr_t_233,Firefly,8.9,Meet the most spaced-out crew in the galaxy.,"Adventure, Drama, Sci-Fi","Nathan Fillion, Gina Torres, Alan Tudyk, Morena Baccarin, Adam Baldwin, Jewel Staite, Sean Maher, Summer Glau, Ron Glass, Christina Hendricks, Mark Sheppard, Michael Fairman, Jeff Ricketts, Dennis Cockrum, Zac Efron, Doug Savant, Richard Brooks, Gregory Itzin","September 20, 2002 (United States)",45 minutes,United States,English,"Mutant Enemy, 20th Century Fox Television","Five hundred years in the future, a renegade crew aboard a small spacecraft tries to survive as they travel the unknown parts of the galaxy and evade warring factions as well as authority agents out to get them.",,,TV-14,"Joss Whedon, Vern Gillum, Tim Minear, James A. Contner, Vondie Curtis-Hall, Marita Grabiak, Michael Grossman, Allan Kroeker, David Solomon, Thomas J. Wright","Joss Whedon, Joss Whedon, Cheryl Cain, Cheryl Cain, Jose Molina, Jose Molina, Tim Minear, Ben Edlund, Jane Espenson, Drew Z. Greenberg, Brett Matthews",posters2/poster_233.jpg
https://www.imdb.com/title/tt10970364/?ref_=sr_t_234,The Girls on the Bus,6.6,Their Story is About to Break,Drama,"Melissa Benoist, Carla Gugino, Christina Elmore, Natasha Behnam, Griffin Dunne, Brandon Scott, Adam Kaplan, Rose Jackson Smith, Scott Foley, Hettienne Park, Mark Consuelos, Scott Cohen, Kyle Vincent Terry, P.J. Sosko, Tala Ashe, Terry Hu, Lipica Shah, Peter Jacobson","March 14, 2024 (United States)",47 minutes,United States,English,"Berlanti Productions, Factory Underground, My So-Called Company","Four female journalists who follow the every move of a parade of flawed presidential candidates, finding friendship, love, and a scandal that could take down not just the presidency but our entire democracy along the way.",,,TV-MA,"Marcos Siega, Erica Dunton, Maggie Carey, Marta Cunningham, DeMane Davis, Jesse Peretz, Kyra Sedgwick","Amy Chozick, Amy Chozick, Amy Chozick, Amy Chozick, Amy Chozick, Tawal Panyacosit Jr., Tawal Panyacosit Jr., Julie Plec, Julie Plec, Julie Plec, Kevin Garnett, Rina Mimoun, Jenna Richman, Candace Jackson, Tim Stack",posters2/poster_234.jpg
https://www.imdb.com/title/tt9140554/?ref_=sr_t_235,Loki,8.2,I'm working on myself.,"Action, Adventure, Fantasy","Tom Hiddleston, Owen Wilson, Sophia Di Martino, Wunmi Mosaku, Gugu Mbatha-Raw, Eugene Cordero, Neil Ellice, Tara Strong, Ke Huy Quan, Lauren Revard, Jonathan Majors, Rafael Casal, Sarafina King, Ilan Muallem, Sasha Lane, Kate Dickie, Liz Carr, Philip Fornah","June 9, 2021 (United States)",,United States,English,Marvel Studios,The mercurial villain Loki resumes his role as the God of Mischief in a new series that takes place after the events of “Avengers: Endgame.”,,,TV-14,"Kate Herron, Justin Benson, Aaron Moorhead, Dan DeLeeuw, Kasra Farahani","Eric Martin, Eric Martin, Eric Martin, Eric Martin, Michael Waldron, Michael Waldron, Stan Lee, Bisha K. Ali, Bisha K. Ali, Bisha K. Ali, Elissa Karasik, Elissa Karasik, Elissa Karasik, Katharyn Blair, Katharyn Blair, Amber Dupre, Amber Dupre, Kasra Farahani, Kasra Farahani, Jack Kirby, Larry Lieber, Brett Maline, Tom Kauffman, Jason O'Leary",posters2/poster_235.jpg
https://www.imdb.com/title/tt0088526/?ref_=sr_t_236,The Golden Girls,8.2,"Meet four outrageous women who know when it comes to a good laugh, there's nothing like experience! (season 1)","Comedy, Drama","Bea Arthur, Betty White, Rue McClanahan, Estelle Getty, Herb Edelman, Harold Gould, Sid Melton, Bill Dana, Bear the Dog, Meg Wyllie, Lynnie Greene, Jonathan Schmock, David Jay Willis, Debra Engle, Scott Jacoby, Chick Vennera, Tony Carreiro, Ellen Albertini Dow","September 14, 1985 (United States)",30 minutes,United States,English,"Touchstone Television, Witt/Thomas/Harris Productions","Four previously married women live together in Miami, sharing their various experiences together and enjoying themselves despite hard times.",,,TV-PG,"Terry Hughes, Lex Passaris, Matthew Diamond, Jim Drake, Peter D. Beyt, Paul Bogart, Jay Sandrich, Jack Shea, Gary Shimokawa, David Steinberg, Steve Zuckerman, Robert Berlinger, Zane Buzby, Judy Pioli","Susan Harris, Susan Harris, Susan Harris, Winifred Hervey, Winifred Hervey, Barry Fanaro, Barry Fanaro, Mort Nathan, Mort Nathan, Terry Grossman, Terry Grossman, Kathy Speer, Kathy Speer, Tracy Gamble, Tracy Gamble, Gail Parent, Gail Parent, Richard Vaczy, Richard Vaczy, Christopher Lloyd, Marc Cherry, Jamie Wooten, Robert Bruce, Robert Bruce, Martin Weiss, Martin Weiss, James Vallely, James Vallely, Tom Whedon, Tom Whedon, Jerry Perzigian, Jerry Perzigian, Don Seigel, Don Seigel, Mitchell Hurwitz, Mitchell Hurwitz, Mitchell Hurwitz, Marc Sotkin, Phillip Jayson Lasker, Kevin Abbott, Kevin Abbott, James Berg, Stan Zimmerman, Russell Marcus, Jeffrey Ferro, Jeffrey Ferro, Fredric Weiss, Fredric Weiss, Robert Spina, Liz Sage, Eric Cohen, Harold Apter, Susan Beavers, Bob Colleary, Jeffrey Duteil, Scott Spencer Gorden, Stuart Silverman, Jan Fischer, David Nichols, Bob Rosenfarb, Patt Shea, William Weidner, Harriett Weiss, Jeff Abugov, Rick Copp, David A. Goodman, Harriet B. Helberg, Sandy Helberg, Don Reo, Eugene B. Stein",posters2/poster_236.jpg
https://www.imdb.com/title/tt0083399/?ref_=sr_t_237,Cheers,8,The Laughs Are On The House!,"Comedy, Drama","Ted Danson, Rhea Perlman, John Ratzenberger, George Wendt, Kelsey Grammer, Woody Harrelson, Philip Perlman, Kirstie Alley, Joseph Paz, Rebecca Soladay, Shelley Long, Al Rosen, Bebe Neuwirth, Nicholas Colasanto, Paul Willson, Alan Koss, Peter Schreiner, Tim Cunningham","September 30, 1982 (United States)",22 minutes,United States,English,,"The regulars of the Boston bar ""Cheers"" share their experiences and lives with each other while drinking or working at the bar where everybody knows your name.",,,TV-PG,"James Burrows, Andy Ackerman, Thomas Lofaro, John Ratzenberger, Tim Berry, Tom Moore, Rick Beren, George Wendt, Michael Zinberg","James Burrows, Glen Charles, Glen Charles, Les Charles, Les Charles, Dan O'Shannon, Dan O'Shannon, Tom Anderson, Tom Anderson, David Isaacs, Ken Levine, Rob Long, Rob Long, Dan Staley, Dan Staley, Brian Pollack, Brian Pollack, Mert Rich, Mert Rich, Kathy Ann Stumpe, Kathy Ann Stumpe, David Lloyd, Fred Graver, Fred Graver, Rebecca Parr Cioffi, Rebecca Parr Cioffi, Bill Steinkellner, Bill Steinkellner, Bill Steinkellner, Cheri Steinkellner, Cheri Steinkellner, Phoef Sutton, Phoef Sutton, David Angell, David Angell, Heide Perlman, Peter Casey, David Lee, Tom Reeder, Ken Estin, Sam Simon, Earl Pomerantz, Sue Herring, Andy Cowan, David S. Williger, Tracy Newman, Jonathan Stark, Kimberly Hill, Jeff Abugov, Janet Leahy, Larry Balmagia, Tom Leopold, Katherine Green, Nick Arnold, Michael J. Weithorn, Lissa Levin, Max Tash, Norm Gunzenhauser, Jim Parker, Tom Seeley, Elliot Shoenman, Susan Seeger, Miriam Trogdon, Chris Cluess, Stu Kreisman, Joanne Pagliaro, Jeffrey Duteil, Cecile Alch, Rick Beren, Rod Burton, Elias Davis, Patricia Niedzialek, David Pollock, Eugene B. Stein, Daniel Palladino",posters2/poster_237.jpg
https://www.imdb.com/title/tt0947798/?ref_=sr_t_238,Black Swan,8,I just want to be perfect.,"Drama, Thriller","Natalie Portman, Mila Kunis, Vincent Cassel, Winona Ryder, Barbara Hershey, Benjamin Millepied, Ksenia Solo, Kristina Anapau, Janet Montgomery, Sebastian Stan, Toby Hemingway, Sergio Torrado, Mark Margolis, Tina Sloan, Abraham Aronofsky, Charlotte Aronofsky, Marcia Jean Kurtz, Shaun O'Hagan","December 17, 2010 (United States)",1 hour 48 minutes,United States,English,"Searchlight Pictures, Cross Creek Pictures, Protozoa Pictures","Nina is a talented but unstable ballerina on the verge of stardom. Pushed to the breaking point by her artistic director and a seductive rival, Nina's grip on reality slips, plunging her into a waking nightmare.","$13,000,000 (estimated)","$329,398,046 ",Rated R,Darren Aronofsky,"Mark Heyman, Andres Heinz, John J. McLaughlin, Andres Heinz",posters2/poster_238.jpg
https://www.imdb.com/title/tt1446714/?ref_=sr_t_239,Prometheus,7,The search for our beginning could lead to our end,"Adventure, Mystery, Sci-Fi","Noomi Rapace, Logan Marshall-Green, Michael Fassbender, Charlize Theron, Idris Elba, Guy Pearce, Sean Harris, Rafe Spall, Emun Elliott, Benedict Wong, Kate Dickie, Branwell Donaghey, Vladimir 'Furdo' Furdik, C.C. Smiff, Shane Steyn, Ian Whyte, John Lebar, Daniel James","June 8, 2012 (United States)",2 hours 4 minutes,United Kingdom,English,"Twentieth Century Fox, Dune Entertainment, Scott Free Productions","Following clues to the origin of mankind, a team finds a structure on a distant moon, but they soon realize they are not alone.","$130,000,000 (estimated)","$403,354,469 ",Rated R,Ridley Scott,"Jon Spaihts, Damon Lindelof, Dan O'Bannon, Ronald Shusett",posters2/poster_239.jpg
https://www.imdb.com/title/tt6964748/?ref_=sr_t_240,Alex Rider,7.5,"Ordinary teen, extraordinary spy, reluctant hero.","Action, Adventure, Drama","Otto Farrant, Vicky McClure, Brenock O'Connor, Stephen Dillane, Ronke Adekoluejo, Nyasha Hatendi, Ace Bhatti, Thomas Levin, Marli Siu, Macy Nyman, Jason Wong, Andrew Buzzeo, Rakie Ayola, Haluk Bilginer, Sofia Helin, Daniel Francis-Swaby, Charithra Chandran, Ana Ularu","November 13, 2020 (United States)",,United Kingdom,English,"Eleventh Hour Films, Amazon Studios, ITV - Independent Television","Alex Rider is an ordinary teenager enlisted to work on behalf of MI6, where he uses skills he didn't know he had to become an extraordinary spy.",,,TV-14,"Andreas Prochaska, Christopher Smith, Rebecca Gatward, Jon Jones, Brian O'Malley","Guy Burt, Guy Burt, Anthony Horowitz, Anthony Horowitz, Anthony Horowitz",posters2/poster_240.jpg
https://www.imdb.com/title/tt2191671/?ref_=sr_t_241,Elementary,7.9,New Holmes. New Watson. New York. (season 1),"Crime, Drama, Mystery","Jonny Lee Miller, Lucy Liu, Aidan Quinn, Jon Michael Hill, Jordan Gelber, John Noble, Ophelia Lovibond, Nelsan Ellis, Ato Essandoh, Tim Guinee, Robert Capron, Desmond Harrington, James Frain, Rhys Ifans, Natalie Dormer, Samantha Quan, Liza J. Bennett, Chasten Harmon","September 27, 2012 (United States)",1 hour,United States,English,"Hill of Beans Productions, Timberman-Beverly Productions, CBS Television Studios","A crime-solving duo that cracks the NYPD's most impossible cases. Following his fall from grace in London, eccentric Sherlock escapes to New York where his father forces him to live with his worst nightmare - a sober companion, Dr. Watson.",,,TV-14,"Guy Ferland, Christine Moore, John Polson, Ron Fortunato, Seith Mann, Jerry Levine, Larry Teng, Lucy Liu, Aaron Lipstadt, Andrew Bernstein, Sanaa Hamri, Michael Slovis, Michael Pressman, Alex Chapple, Jonny Lee Miller, John David Coles, Peter Werner, Jeremy Webb, Michael Hekmat, Jennifer Lynch, Phil Abraham, Colin Bucksey, Michael Cuesta, Rod Holcomb, David Platt, Rosemary Rodriguez, Adam Davidson, Jean de Segonzac, Helen Shaver, Aidan Quinn, Maja Vrvilo, Jon Michael Hill, Thomas Carter, Michael Smith, Craig Zisk","Robert Doherty, Robert Doherty, Robert Doherty, Jeffrey Paul King, Jeffrey Paul King, Jeffrey Paul King, Jeffrey Paul King, Jeffrey Paul King, Jeffrey Paul King, Kelly Wheeler, Kelly Wheeler, Kelly Wheeler, Jason Tracey, Jason Tracey, Jason Tracey, Jason Tracey, Bob Goodman, Bob Goodman, Bob Goodman, Bob Goodman, Craig Sweeny, Craig Sweeny, Craig Sweeny, Robert Hewitt Wolfe, Brian Rodenbeck, Brian Rodenbeck, Liz Friedman, Liz Friedman, Liz Friedman, Tamara Jaron, Jordan Rosenberg, Jordan Rosenberg, Corinne Brinkerhoff, Corinne Brinkerhoff, Christopher Silber, Christopher Silber, Christopher Silber, Arika Lisanne Mittman, Peter Ocko, Peter Blake, Mark Hudis, Nick Thiel, Mark Goffman, Christopher Hollier, Cathryn Humphris, Andrew Gettens, Steve Gottfried, Steve Gottfried, Lauren MacKenzie, Celeste Chan Wolfe, Paul Cornell, Richard C. Okie, Sherman Li, Brandon Tanori, Sean Bennett, Arthur Conan Doyle",posters2/poster_241.jpg
https://www.imdb.com/title/tt0149460/?ref_=sr_t_242,Futurama,8.5,The future is here!,"Animation, Adventure, Comedy","Billy West, John DiMaggio, Katey Sagal, Tress MacNeille, Phil LaMarr, Maurice LaMarche, Lauren Tom, David Herman, Frank Welker, Kath Soucie, Dawnn Lewis, Tom Kenny, Dan Castellaneta, Al Gore, George Takei, Nicole St. John, Phil Hendrie, Coolio","March 28, 1999 (United States)",22 minutes,United States,English,"The Curiosity Company, 20th Television Animation, Fox Television Animation","Philip J. Fry, a pizza delivery boy, is accidentally frozen in 1999 and thawed out on New Year's Eve 2999.",,,TV-14,"Peter Avanzino, Bret Haaland, Rich Moore, Gregg Vanzo, Dwayne Carey-Hill, Ron Hughart, Brian Sheesley, Crystal Chesney, Frank Marino, Raymie Muzquiz, Stephen Sandoval, Edmund Fong, Susie Dietter, Mark Ervin, Chris Loudon, James Purdum, Swinton O. Scott III, Chris Sauve, Ray Claffey, Lance Kramer, Jeffrey Lynch, Patty Shinagawa, Wesley Archer, Corey Barnes, James Kim, Carlos Baeza, Ashley Lenz, Kevin O'Brien, Andrew Han, Ira Sherak","David X. Cohen, David X. Cohen, David X. Cohen, David X. Cohen, David X. Cohen, Matt Groening, Matt Groening, Matt Groening, Matt Groening, Jeff Westbrook, Jeff Westbrook, Jeff Westbrook, Jeff Westbrook, Kristin Gore, Kristin Gore, Ken Keeler, Ken Keeler, Ken Keeler, Eric Horsted, Eric Horsted, Eric Horsted, David Mirsky, Patric M. Verrone, Patric M. Verrone, Patric M. Verrone, Aaron Ehasz, Aaron Ehasz, Eric Rogers, Eric Rogers, Eric Kaplan, Eric Kaplan, Eric Kaplan, Lew Morton, Cody Ziglar, Cody Ziglar, Dan Vebber, Shirin Najafi, Shirin Najafi, J. Stewart Burns, Michael Rowe, Michael Rowe, Justin Adler, Matt Karis, Josh Weinstein, Bill Odenkirk, Ron Weiner, David A. Goodman, Maiya Williams, Evan Gore, Brian Kelley, Heather Lombard, Darin Henry, Jason Gorbett, Scott Kirby, Carolyn Premish, Carolyn Premish, Thomas Hart, Robin Kingsland, Brian Trueman, Neil Mukhopadhyay, Michael Saikin, Ari Kaplan, Ariel Ladensohn",posters2/poster_242.jpg
https://www.imdb.com/title/tt14531842/?ref_=sr_t_243,Extraordinary,7.7,What If Everyone Had a Superpower Except You?,"Comedy, Sci-Fi","Máiréad Tyers, Sofia Oxenham, Bilal Hasna, Luke Rollason, Shaun Mason, Ardal O'Hanlon, Siobhán McSweeney, Chris Lew Kum Hoi, Abraham Popoola, Olivia Marcus, Julian Barratt, Darcey Porter-Cassidy, Robbie Gee, Kwaku Mills, Rosa Robson, Sam Haygarth, Ned Porteous, Alfie Harrison","January 25, 2023 (United States)",25 minutes,United Kingdom,English,Sid Gentle Films,Jen is a self-aware young woman who lives in a world where everybody except her has a superpower.,,,TV-MA,"Toby MacDonald, Jennifer Sheridan, Nadira Amrani","Emma Moran, Emma Moran, Emma Moran",posters2/poster_243.jpg
