Movie_Link,Movie_Name,Ratings,Taglines,Movie_category,Film_Actor,Release_Date,Duration,Country,Original_Language,Companies,Description,Budget,Box Office,Certificate (MPAA),Directors,Writing_Credits,poster_path
https://www.imdb.com/title/tt4477976/?ref_=sr_t_113,Superstore,7.9,They're Getting Their Shift Together,Comedy,"Ben Feldman, Lauren Ash, Colton Dunn, Nico Santos, Mark McKinney, Nichole Sakura, Danny Gura, Jon Miyahara, America Ferrera, Kaliko Kauahi, Mariana Tosca, Selisha Shertick, Kelly Schumann, Jon Barinholtz, Irene White, Amir M. Korangy, Linda Porter, Michael Bunin","November 30, 2015 (United States)",22 minutes,United States,English,"Spitzer Holding Company, The District, Universal Television",A look at the lives of employees at a big box store.,,,TV-14,"Victor Nelli Jr., Matt Sohn, Ruben Fleischer, Betsy Thomas, Tristram Shapeero, Geeta Vasant Patel, Todd Biermann, America Ferrera, Ken Whittingham, Ryan Case, Jay Hunter, Rebecca Asher, Jeffrey Blitz, Linda Mendoza, Alex Reid, Michael Spiller, Ben Feldman, Jaime Eliezer Karas, Jackie Clarke, Daniella Eisman, Ross Novie, James Renfroe, Heather Jack, Michael Patrick Jann, Andy Ackerman, Christine Gernon, Alex Hardcastle, Beth McCarthy-Miller, Michael McDonald, Alisa Statman, Jay Chandrasekhar, Bill Purple, Michael Weaver, Jaffar Mahmood, Keith Powell, Phil Traill, Catalina Aguilar Mastretta, Richie Keen, Mark McKinney, Chioke Nassor, Amy York Rubin, Robert Cohen, Kris Lefcoe, Justin Spitzer, Kabir Akhtar, Kim O. Nguyen, Charles Stone III","Justin Spitzer, Justin Spitzer, Justin Spitzer, John Kazlauskas, John Kazlauskas, John Kazlauskas, John Kazlauskas, John Kazlauskas, Hailey Chavez, Hailey Chavez, Hailey Chavez, Justin Shanes, Justin Shanes, Justin Shanes, Bridget Kyle, Bridget Kyle, Bridget Kyle, Vicky Luu, Vicky Luu, Vicky Luu, Dayo Adesokan, Dayo Adesokan, Vanessa Ramos, Vanessa Ramos, Vanessa Ramos, L.E. Correia, L.E. Correia, L.E. Correia, Brianna Brown, Jeny Batten, M. Dickson, Justin Hillian, Jack Kukoda, Jack Kukoda, Jonathan Green, Jonathan Green, Gabe Miller, Gabe Miller, Owen Ellickson, Jackie Clarke, Chiara Atik, Josh Malmuth, Eric Ledgin, Sierra Teller Ornelas, Matt Hubbard, Rene Gube, Laura McCreary, Jen Vierck, Lon Zimmet, Ben Dougan, Brian Gatewood, Brian Gatewood, Matt Lawton, Aaron Lee, Alessandro Tanaka, Alessandro Tanaka, Colton Dunn, Karey Dornetto, Joe Barrasas, Lauren Ash, Sean Lee",posters2/poster_113.jpg
https://www.imdb.com/title/tt14371878/?ref_=sr_t_114,Lift,5.5,"The heist begins at 40,000 ft.","Action, Comedy, Crime","Kevin Hart, Gugu Mbatha-Raw, Sam Worthington, Vincent D'Onofrio, Úrsula Corberó, Billy Magnussen, Yun Jee Kim, Viveik Kalra, Jean Reno, Jacob Batalon, Burn Gorman, Paul Anderson, David Proud, Oli Green, Ross Anderson, Stefano Skalkotos, Martina Avogadri, Jess Liaudin","January 12, 2024 (United States)",1 hour 47 minutes,United States,English,"Netflix, 6th & Idaho Productions, Genre Films",Follows a master thief and his Interpol Agent ex-girlfriend who team up to steal $500 million in gold bullion being transported on an A380 passenger flight.,,,Rated PG-13,F. Gary Gray,Daniel Kunka,posters2/poster_114.jpg
https://www.imdb.com/title/tt21909764/?ref_=sr_t_115,My Fault,6.2,,"Drama, Romance","Nicole Wallace, Gabriel Guevara, Marta Hazas, Iván Sánchez, Eva Ruiz, Víctor Varona, Fran Berenguer, Adriana Ubani, Ivan Massagué, Mariano Venancio, Jaime Ordóñez, Jaime Gutiérrez, Anastasia Russo, Noah Casas, Daniel Martínez, Pablo Riguero, Eve Ryan, Lucas Nabor","June 8, 2023 (United States)",1 hour 57 minutes,Spain,Spanish,"Amazon Studios, Enchantedblue Media, Pokeepsie Films","Noah has to leave her town, boyfriend and friends behind and move into the mansion of her mother's new rich husband. There she meets Nick, her new stepbrother. They fall madly in love in secret.",,,,Domingo González,"Mercedes Ron, Domingo González",posters2/poster_115.jpg
https://www.imdb.com/title/tt4589218/?ref_=sr_t_116,Five Nights at Freddy's,5.5,Can you survive?,"Horror, Mystery, Thriller","Josh Hutcherson, Piper Rubio, Elizabeth Lail, Matthew Lillard, Mary Stuart Masterson, Kat Conner Sterling, David Lind, Christian Stokes, Joseph Poliquin, Grant Feely, Asher Colton Spence, David Huston Doty, Liam Hendrix, Jophielle Love, Tadasay Young, Michael P. Sullivan, Wyatt Parker, Lucas Grant","October 27, 2023 (United States)",1 hour 49 minutes,United States,English,"Universal Pictures, Blumhouse Productions, Scott Cawthon Productions","A troubled security guard begins working at Freddy Fazbear's Pizza. During his first night on the job, he realizes that the night shift won't be so easy to get through. Pretty soon he will unveil what actually happened at Freddy's.","$20,000,000 (estimated)","$291,493,620 ",Rated PG-13,Emma Tammi,"Scott Cawthon, Scott Cawthon, Seth Cuddeback, Emma Tammi, Scott Cawthon, Chris Lee Hill, Tyler MacIntyre",posters2/poster_116.jpg
https://www.imdb.com/title/tt1578873/?ref_=sr_t_117,Pretty Little Liars,7.4,Never trust a pretty girl with an ugly secret. (Season 1),"Drama, Mystery, Romance","Troian Bellisario, Ashley Benson, Lucy Hale, Shay Mitchell, Sasha Pieterse, Ian Harding, Laura Leighton, Janel Parrish, Tyler Blackburn, Keegan Allen, Holly Marie Combs, Chad Lowe, Lesley Fera, Tammin Sursok, Lindsey Shaw, Andrea Parker, Torrey DeVitto, Nia Peeples","June 8, 2010 (United States)",44 minutes,United States,English,"ABC Family, Alloy Entertainment, Warner Horizon Television","Four friends band together against an anonymous foe who threatens to reveal their darkest secrets, while also investigating the disappearance of their best friend.",,,TV-14,"Norman Buckley, Ron Lagomarsino, Chad Lowe, Arlene Sanford, Michael Grossman, Melanie Mayron, I. Marlene King, Wendey Stanzler, Chris Grismer, Roger Kumble, Zetna Fuentes, Patrick R. Norris, Arthur Anderson, Joanna Kerns, Oliver Goldstick, Joseph Dougherty, Lesli Linka Glatter, Elodie Keene, Janice Cooke, Bethany Rooney, Tripp Reed, Larry Reibman, Paula Hunziker, Kimberly McCullough, Jamie Babbit, Liz Friedlander, Dana Gonzales, Paul Lazarus, J. Miller Tobin, Dean White, Tim Hunter, Mick Garris, Joshua Butler, Nzingha Stewart, Michael Goi, Tawnia McKiernan, Troian Bellisario, Marta Cunningham","I. Marlene King, I. Marlene King, I. Marlene King, I. Marlene King, I. Marlene King, Sara Shepard, Sara Shepard, Sara Shepard, Sara Shepard, Maya Goldsmith, Maya Goldsmith, Lijah Barasz, Lijah Barasz, Lijah Barasz, Lijah Barasz, Joseph Dougherty, Oliver Goldstick, Jonell Lennon, Jonell Lennon, Jonell Lennon, Bryan M. Holdman, Francesca Rollins, Charles Grant Craig, Kyle Bown, Kyle Bown, Kyle Bown, Tamar Laddy, Andy Reaser, Kateland Brown, Matt Witten, Michael J. Cinquemani, Kim Turrisi, Jan Oxenberg, Allyson Nelson",posters2/poster_117.jpg
https://www.imdb.com/title/tt5052448/?ref_=sr_t_118,Get Out,7.8,"Just because you're invited, doesn't mean you're welcome.","Horror, Mystery, Thriller","Daniel Kaluuya, Allison Williams, Bradley Whitford, Catherine Keener, Caleb Landry Jones, Marcus Henderson, Betty Gabriel, LaKeith Stanfield, Stephen Root, Lil Rel Howery, Ashley LeConte Campbell, John Wilmot, Caren L. Larkey, Julie Ann Jones, Rutherford Cravens, Geraldine Singer, Yasuhiko Oyama, Richard Herd","February 24, 2017 (United States)",1 hour 44 minutes,United States,English,"Universal Pictures, Blumhouse Productions, QC Entertainment","A young African-American visits his white girlfriend's parents for the weekend, where his simmering uneasiness about their reception of him eventually reaches a boiling point.","$4,500,000 (estimated)","$255,751,443 ",Rated R,Jordan Peele,Jordan Peele,posters2/poster_118.jpg
https://www.imdb.com/title/tt10731256/?ref_=sr_t_119,Don't Worry Darling,6.3,welcome to victory.,"Drama, Mystery, Thriller","Florence Pugh, Harry Styles, Chris Pine, Olivia Wilde, KiKi Layne, Gemma Chan, Nick Kroll, Sydney Chandler, Kate Berlant, Asif Ali, Douglas Smith, Timothy Simons, Ari'el Stachel, Steve Berg, Daisy Sudeikis, Marcello Reyes, Monroe Cline, Angel Mammoliti","September 23, 2022 (United States)",2 hours 3 minutes,United States,English,"New Line Cinema, New Line Productions, Vertigo Entertainment","While her husband leaves home everyday to work in a top secret facility, a young 1950s housewife begins to question her life when she notices strange behavior from the other wives in the neighborhood.","$20,000,000 (estimated)","$87,609,403 ",Rated R,Olivia Wilde,"Katie Silberman, Carey Van Dyke, Shane Van Dyke, Katie Silberman",posters2/poster_119.jpg
https://www.imdb.com/title/tt2303687/?ref_=sr_t_120,Line of Duty,8.7,Lies Cost Lives (Series 6),"Crime, Drama, Mystery","Martin Compston, Vicky McClure, Adrian Dunbar, Craig Parkinson, Gregory Piper, Maya Sondhi, Aiysha Hart, Keeley Hawes, Nigel Boyle, Polly Walker, Paul Higgins, Anneika Rose, Neil Morrissey, Tomi May, Ace Bhatti, Elizabeth Rider, Tony Pitts, Owen Teale","August 21, 2012 (United States)",1 hour,United Kingdom,English,"BBC Drama Productions, World Productions","Drama series following the investigations of AC-12, a controversial police anti-corruption unit.",,,TV-14,"John Strickland, Douglas Mackinnon, Daniel Nettheim, David Caffrey, Michael Keillor, Jennie Darnell, Jed Mercurio, Susan Tully, Gareth Bryn","Jed Mercurio, Jed Mercurio",posters2/poster_120.jpg
https://www.imdb.com/title/tt13940818/?ref_=sr_t_121,The Contestant,7.2,,Documentary,"Tomoaki Hamatsu, Jason Her, Toshio Tsuchiya, June Yoon","May 2, 2024 (United States)",1 hour 30 minutes,United Kingdom,English,Misfits Entertainment,"A Japanese reality TV star left naked in a room for more than a year, tasked with filling out magazine sweepstakes to earn food and clothing.",,,,Clair Titley,Clair Titley,posters2/poster_121.jpg
https://www.imdb.com/title/tt10640346/?ref_=sr_t_122,Babylon,7.1,Always make a scene.,"Comedy, Drama, History","Brad Pitt, Margot Robbie, Jean Smart, Olivia Wilde, J.C. Currais, Diego Calva, Jimmy Ortega, Marcos A. Ferraez, Shane Powers, Phoebe Tonkin, Troy Metcalf, Jovan Adepo, Hansford Prince, Telvin Griffin, Cutty Cuthbert, Albert Hammond Jr., Flea, Bregje Heinen","December 23, 2022 (United States)",3 hours 9 minutes,United States,English,"Paramount Pictures, C2 Motion Picture Group, Marc Platt Productions","A tale of outsized ambition and outrageous excess, it traces the rise and fall of multiple characters during an era of unbridled decadence and depravity in early Hollywood.","$110,000,000 (estimated)","$63,562,440 ",Rated R,Damien Chazelle,Damien Chazelle,posters2/poster_122.jpg
https://www.imdb.com/title/tt0050083/?ref_=sr_t_123,12 Angry Men,9,It explodes like 12 sticks of dynamite!,"Crime, Drama","Henry Fonda, Lee J. Cobb, Martin Balsam, John Fiedler, E.G. Marshall, Jack Klugman, Edward Binns, Jack Warden, Joseph Sweeney, Ed Begley, George Voskovec, Robert Webber, Rudy Bond, Tom Gorman, James Kelly, Billy Nelson, John Savoca, Walter Stocker","April 10, 1957 (United States)",1 hour 36 minutes,United States,English,Orion-Nova Productions,The jury in a New York City murder trial is frustrated by a single member whose skeptical caution forces them to more carefully consider the evidence before jumping to a hasty verdict.,"$350,000 (estimated)","$2,667 ",,Sidney Lumet,"Reginald Rose, Reginald Rose",posters2/poster_123.jpg
https://www.imdb.com/title/tt22041854/?ref_=sr_t_124,Priscilla,6.5,Wife to the King. Icon to the world. Destined for more.,"Biography, Drama, Music","Cailee Spaeny, Jacob Elordi, Ari Cohen, Dagmara Dominczyk, Tim Post, Lynne Griffin, Dan Beirne, Rodrigo Fernandez-Stoll, Dan Abramovici, Matthew Shaw, Tim Dowler-Coltman, R Austin Ball, Olivia Barrett, Stephanie Moore, Luke Humphrey, Deanna Jarvis, Jorja Cadence, Josette Halpert","November 3, 2023 (United States)",1 hour 53 minutes,Italy,English,"American Zoetrope, The Apartment, Fremantle","When teenage Priscilla Beaulieu meets Elvis Presley, the man who is already a meteoric rock-and-roll superstar becomes someone entirely unexpected in private moments: a thrilling crush, an ally in loneliness, a vulnerable best friend.",,,Rated R,Sofia Coppola,"Priscilla Presley, Sandra Harmon, Sofia Coppola",posters2/poster_124.jpg
https://www.imdb.com/title/tt9764362/?ref_=sr_t_125,The Menu,7.2,Wonderful surprises await you all.,"Comedy, Horror, Thriller","Ralph Fiennes, Anya Taylor-Joy, Nicholas Hoult, Hong Chau, Janet McTeer, Paul Adelstein, John Leguizamo, Aimee Carrero, Reed Birney, Judith Light, Rebecca Koon, Rob Yang, Arturo Castro, Mark St. Cyr, Peter Grosz, Christina Brucato, Adam Aalderks, Jon Paul Allyn","November 18, 2022 (United States)",1 hour 47 minutes,United States,English,"Hyperobject Industries, Searchlight Pictures","A young couple travels to a remote island to eat at an exclusive restaurant where the chef has prepared a lavish menu, with some shocking surprises.","$35,000,000 (estimated)","$79,628,200 ",Rated R,Mark Mylod,"Seth Reiss, Will Tracy",posters2/poster_125.jpg
https://www.imdb.com/title/tt0439572/?ref_=sr_t_126,The Flash,6.7,Worlds Collide.,"Action, Adventure, Fantasy","Ezra Miller, Michael Keaton, Sasha Calle, Michael Shannon, Ron Livingston, Maribel Verdú, Kiersey Clemons, Jeremy Irons, Antje Traue, Saoirse-Monica Jackson, Rudy Mancuso, Temuera Morrison, Sanjeev Bhaskar, Sean Rogers, Kieran Hodgson, Luke Brandon Field, Ian Loh, Karl Collins","June 16, 2023 (United States)",2 hours 24 minutes,United States,English,"DC Comics, DC Entertainment, New Zealand Film Commission","Barry Allen uses his super speed to change the past, but his attempt to save his family creates a world without super heroes, forcing him to race for his life in order to save the future.","$200,000,000 (estimated)","$271,333,313 ",Rated PG-13,Andy Muschietti,"Christina Hodson, John Francis Daley, Jonathan Goldstein, Joby Harold, Harry Lampert, Gardner Fox, Robert Kanigher, Carmine Infantino, Jerry Siegel, Joe Shuster, Bob Kane, Bill Finger, William Moulton Marston",posters2/poster_126.jpg
https://www.imdb.com/title/tt6718170/?ref_=sr_t_127,The Super Mario Bros. Movie,7,Let's-a go!,"Animation, Adventure, Comedy","Chris Pratt, Anya Taylor-Joy, Charlie Day, Jack Black, Kevin Michael Richardson, Khary Payton, Charles Martinet, Sebastian Maniscalco, Rino Romano, John DiMaggio, Jessica DiCicco, Keegan-Michael Key, Eric Bauza, Fred Armisen, Seth Rogen, Juliet Jelenic, Scott Menville, Carlos Alazraqui","April 5, 2023 (United States)",1 hour 32 minutes,United States,English,"Universal Pictures, Nintendo, Illumination Entertainment","A plumber named Mario travels through an underground labyrinth with his brother Luigi, trying to save a captured princess.","$100,000,000 (estimated)","$1,362,038,437 ",Rated PG,"Aaron Horvath, Michael Jelenic, Pierre Leduc, Fabien Polack",Matthew Fogel,posters2/poster_127.jpg
https://www.imdb.com/title/tt23845296/?ref_=sr_t_128,After the Party,7.6,,Drama,"Robyn Malcolm, Peter Mullan, Tara Canton, Ian Blackburn, Elz Carrad, Dean O'Gorman, Ziggy O'Reilly, Mia Blake, Catherine Wilkin, Tanea Heke, Peter Hambleton, Kirana Gaeta, Tess Jamieson-Karaha, Tamati Moriarty, Zack Ziogas, Kieran Charnock, Allan Henry, Carmel McGlone","October 29, 2023 (New Zealand)",45 minutes,New Zealand,English,"Lingo Pictures, Luminous Beast",Penny loses everything when she accuses her husband of a sex crime against her daughter's teenage friend and no-one believes her.,,,,Peter Salmon,"Martha Hardy-Ward, Emily Perkins, Samuel E. Shore, Samuel E. Shore, Samuel E. Shore, Dianne Taylor",posters2/poster_128.jpg
https://www.imdb.com/title/tt2699128/?ref_=sr_t_129,The Leftovers,8.3,Grace period is over.,"Drama, Fantasy, Mystery","Justin Theroux, Amy Brenneman, Christopher Eccleston, Liv Tyler, Chris Zylka, Carrie Coon, Margaret Qualley, Ann Dowd, Kevin Carroll, Jovan Adepo, Janel Moloney, Michael Gaston, Regina King, Scott Glenn, Annie Q. Riegel, Emily Meade, Amanda Warren, Max Carver","June 29, 2014 (United States)",1 hour,United States,English,"Film 44, Warner Bros. Television","Three years after the disappearance of 2% of the global human population, a group of people in a small New York community try to continue their lives while coping with the tragedy of the unexplained nature of the event.",,,TV-MA,"Mimi Leder, Carl Franklin, Keith Gordon, Craig Zobel, Daniel Sackheim, Peter Berg, Nicole Kassell, Lesli Linka Glatter, Michelle MacLaren, Tom Shankland","Damon Lindelof, Damon Lindelof, Damon Lindelof, Damon Lindelof, Damon Lindelof, Tom Perrotta, Tom Perrotta, Tom Perrotta, Tom Perrotta, Tom Perrotta, Nick Cuse, Nick Cuse, Jacqueline Hoyt, Patrick Somerville, Kath Lingenfelter, Tom Spezialy, Tom Spezialy, Curtis Gwinn, Elizabeth Peterson, Carlito Rodriguez, Monica Beletsky, Lila Byock, P. Carter, Haley Harris, Carly Wray",posters2/poster_129.jpg
https://www.imdb.com/title/tt2906216/?ref_=sr_t_130,Dungeons & Dragons: Honor Among Thieves,7.2,Who needs heroes when you have thieves?,"Action, Adventure, Comedy","Chris Pine, Michelle Rodriguez, Regé-Jean Page, Justice Smith, Sophia Lillis, Hugh Grant, Chloe Coleman, Daisy Head, Kyle Hixon, Spencer Wilding, Will Irvine, Nicholas Blane, Bryan Larkin, Sarah Amankwah, Colin Carnegie, Georgia Landers, Sophia Nell Huntley, Clayton Grover","March 31, 2023 (United States)",2 hours 14 minutes,United States,English,"Paramount Pictures, Entertainment One, Allspark Pictures","A charming thief and a band of unlikely adventurers embark on an epic quest to retrieve a lost relic, but things go dangerously awry when they run afoul of the wrong people.","$150,000,000 (estimated)","$208,177,026 ",Rated PG-13,"John Francis Daley, Jonathan Goldstein","Jonathan Goldstein, John Francis Daley, Michael Gilio, Chris McKay, Michael Gilio",posters2/poster_130.jpg
https://www.imdb.com/title/tt13309742/?ref_=sr_t_131,Blue Eye Samurai,8.7,,"Animation, Action, Adventure","Maya Erskine, George Takei, Masi Oka, Brenda Song, Darren Barnet, Randall Park, Kenneth Branagh, Cary-Hiroyuki Tagawa, Gedde Watanabe, Patrick Gallagher, Eric Bauza, Clyde Kusatsu, Ming-Na Wen, Keone Young, Marcus Choi, Ann Harada, Orli Mariko Green, Judah Green","November 3, 2023 (United States)",45 minutes,United States,English,"3 Arts Entertainment, Blue Spirit Animation, Netflix Animation","Driven by a dream of revenge against those who made her an outcast in Edo-period Japan, a young warrior cuts a bloody path toward her destiny.",,,TV-MA,"Jane Wu, Earl A. Hibbert, Ryan O'Loughlin, Michael Green, Sunny Sun, Alan Taylor, Alan Wan","Michael Green, Michael Green, Amber Noizumi, Amber Noizumi, Yana Bille",posters2/poster_131.jpg
https://www.imdb.com/title/tt7784604/?ref_=sr_t_132,Hereditary,7.3,Every family tree hides a secret.,"Drama, Horror, Mystery","Toni Collette, Milly Shapiro, Gabriel Byrne, Alex Wolff, Christy Summerhays, Morgan Lund, Mallory Bechtel, Jake Brown, Harrison Nell, BriAnn Rachele, Heidi Méndez, Moises L. Tovar, Jarrod Phillips, Ann Dowd, Brock McKinney, Zachary Arthur, David Stanley, William 'Bus' Riley","June 8, 2018 (United States)",2 hours 7 minutes,United States,English,"PalmStar Media, Finch Entertainment, Windy Hill Pictures",A grieving family is haunted by tragic and disturbing occurrences.,"$10,000,000 (estimated)","$82,735,159 ",Rated R,Ari Aster,Ari Aster,posters2/poster_132.jpg
https://www.imdb.com/title/tt12672620/?ref_=sr_t_133,The Three Musketeers - Part II: Milady,6.5,,"Action, Adventure, Drama","François Civil, Vincent Cassel, Romain Duris, Pio Marmaï, Eva Green, Louis Garrel, Vicky Krieps, Lyna Khoudri, Jacob Fortune-Lloyd, Eric Ruf, Marc Barbé, Patrick Mille, Julien Frison, Ralph Amoussou, Camille Rutherford, Ivan Franek, Gabriel Almaer, Thibault Vinçon","April 19, 2024 (United States)",1 hour 55 minutes,France,French,"Chapter 2, Pathé, M6 Films","D'Artagnan is forced to join forces with Milady to save Constance, who was kidnapped before his eyes. But as war is declared and Athos, Porthos and Aramis have already joined the front, a secret from the past shatters old alliances.","€36,000,000 (estimated)","$21,736,196 ",,Martin Bourboulon,"Matthieu Delaporte, Matthieu Delaporte, Matthieu Delaporte, Alexandre Dumas, Alexandre de La Patellière, Alexandre de La Patellière, Alexandre de La Patellière",posters2/poster_133.jpg
https://www.imdb.com/title/tt10293938/?ref_=sr_t_134,Outer Banks,7.5,Be Careful What You Search For,"Action, Crime, Drama","Chase Stokes, Madelyn Cline, Madison Bailey, J.D., Rudy Pankow, Drew Starkey, Charles Esten, Austin North, Caroline Arapoglou, Cullen Moss, Marland Burke, Julia Antonelli, E. Roger Mitchell, Samantha Soule, Carlacia Grant, Charles Halford, Nicholas Cirillo, Deion Smith","April 15, 2020 (United States)",50 minutes,United States,English,"Netflix, Red Canoe Productions, Rock Fish Productions","On an island of haves and have-nots, teen John B enlists his three best friends to hunt for a legendary treasure linked to his father's disappearance.",,,TV-MA,"Jonas Pate, Valerie Weiss, Darnell Martin, Cherie Nowlan, Sunny Hodge, Gonzalo Amat","Shannon Burke, Shannon Burke, Shannon Burke, Shannon Burke, Shannon Burke, Jonas Pate, Jonas Pate, Jonas Pate, Jonas Pate, Josh Pate, Josh Pate, Josh Pate, Josh Pate, Josh Pate, Crystal Garland, Crystal Garland, Crystal Garland, Rachel Alter, Rachel Alter, Rachel Alter, Nicholas Schutt, Nicholas Schutt, Kathleen Hale, Kathleen Hale, Kathleen Hale, Karen Corneille, Joey Elkins, Joey Elkins, Keith Josef Adkins, Keith Josef Adkins, Jay Beattie, Dan Dworkin",posters2/poster_134.jpg
https://www.imdb.com/title/tt1798709/?ref_=sr_t_135,Her,8,A Spike Jonze love story.,"Drama, Romance, Sci-Fi","Joaquin Phoenix, Amy Adams, Scarlett Johansson, Rooney Mara, Lynn Adrianna Freedman, Lisa Renee Pitts, Gabe Gomez, Chris Pratt, Artt Butler, May Lindstrom, Bill Hader, Kristen Wiig, Brian Johnson, Matt Letscher, Spike Jonze, Olivia Wilde, David Azar, Guy Lewis","January 10, 2014 (United States)",2 hours 6 minutes,United States,English,"Annapurna Pictures, Stage 6 Films","In a near future, a lonely writer develops an unlikely relationship with an operating system designed to meet his every need.","$23,000,000 (estimated)","$48,517,427 ",Rated R,Spike Jonze,Spike Jonze,posters2/poster_135.jpg
https://www.imdb.com/title/tt0458290/?ref_=sr_t_136,Star Wars: The Clone Wars,8.4,,"Animation, Action, Adventure","Tom Kane, Dee Bradley Baker, Matt Lanter, James Arnold Taylor, Ashley Eckstein, Matthew Wood, Corey Burton, Terrence 'T.C.' Carson, Catherine Taber, Stephen Stanton, Ian Abercrombie, Nika Futterman, Phil LaMarr, Anna Graves, David Acord, Sam Witwer, Brian George, Anthony Daniels","October 3, 2008 (United States)",23 minutes,United States,English,"CGCG, Cartoon Network, Disney+",Jedi Knights lead the Grand Army of the Republic against the droid army of the Separatists.,,,TV-PG,"Dave Filoni, Brian Kalin O'Connell, Steward Lee, Kyle Dunlevy, Giancarlo Volpe, Danny Keller, Bosco Ng, Rob Coleman, Justin Ridge, Saul Ruiz, Nathaniel Villanueva, Jesse Yeh, Duwayne Dunham, Dave Bullock, Atsushi Takeuchi, Robert Dalva, Walter Murch","George Lucas, Henry Gilroy, Henry Gilroy, Henry Gilroy, Henry Gilroy, Henry Gilroy, Drew Z. Greenberg, Drew Z. Greenberg, Scott Murphy, Scott Murphy, Katie Lucas, Christian Taylor, Dave Filoni, Dave Filoni, Dave Filoni, Steven Melching, Steven Melching, Matt Michnovetz, Brent V. Friedman, Brent V. Friedman, Chris Collins, Charles Murray, Charles Murray, Paul Dini, Paul Dini, Eoghan Mahony, George Krstic, George Krstic, Daniel Arkin, Daniel Arkin, Steven Long Mitchell, Craig W. Van Sickle, Cameron Litvack, Bonnie Mark, Jose Molina, Melinda Hsu, Melinda Hsu, Brian Larsen, Craig Titley, Craig Titley, Julie Siege, Jonathan Rinzler, Tim Burns, Kevin Campbell, Kevin Rubio, Bill Canterbury, Jen Klein, Andrew Kreisberg, Wendy Mericle, Ben Edlund",posters2/poster_136.jpg
https://www.imdb.com/title/tt3799694/?ref_=sr_t_137,The Nice Guys,7.4,Nice pair,"Action, Comedy, Crime","Russell Crowe, Ryan Gosling, Angourie Rice, Matt Bomer, Margaret Qualley, Yaya DaCosta, Keith David, Beau Knapp, Lois Smith, Murielle Telio, Gil Gerard, Daisy Tahan, Kim Basinger, Jack Kilmer, Lance Valentine Butler, Ty Simpkins, Cayla Brady, Tammi Arender","May 20, 2016 (United States)",1 hour 56 minutes,United States,English,"Warner Bros., Silver Pictures, Waypoint Entertainment","In 1970s Los Angeles, a mismatched pair of private eyes investigate a missing girl and the mysterious death of a porn star.","$50,000,000 (estimated)","$71,261,763 ",Rated R,Shane Black,"Shane Black, Anthony Bagarozzi",posters2/poster_137.jpg
https://www.imdb.com/title/tt1630029/?ref_=sr_t_138,Avatar: The Way of Water,7.5,,"Action, Adventure, Fantasy","Sam Worthington, Zoe Saldana, Sigourney Weaver, Stephen Lang, Kate Winslet, Cliff Curtis, Joel David Moore, CCH Pounder, Edie Falco, Brendan Cowell, Jemaine Clement, Jamie Flatters, Britain Dalton, Trinity Jo-Li Bliss, Jack Champion, Bailey Bass, Filip Geljo, Duane Evans Jr.","December 16, 2022 (United States)",3 hours 12 minutes,United States,English,"20th Century Studios, TSG Entertainment, Lightstorm Entertainment","Jake Sully lives with his newfound family formed on the extrasolar moon Pandora. Once a familiar threat returns to finish what was previously started, Jake must work with Neytiri and the army of the Na'vi race to protect their home.","$350,000,000 (estimated)","$2,320,250,281.00 ",Rated PG-13,James Cameron,"James Cameron, Rick Jaffa, Amanda Silver, James Cameron, Rick Jaffa, Amanda Silver, Josh Friedman, Shane Salerno, James Cameron",posters2/poster_138.jpg
