Movie_Link,Movie_Name,Ratings,Movie_category,Film_Actor,Release_Date,Duration,Original_Language,Description,Box Office,Budget,Directors,Writing_Credits,poster_path
https://www.themoviedb.org/movie/281338-war-for-the-planet-of-the-apes,Đại Chiến Hành Tinh Khỉ,72%,"Phim Chính Kịch, Phim Khoa Học Viễn Tưởng, Phim Chiến Tranh","[('Andy Serkis', 'Caesar'), ('Woody Harrelson', 'The Colonel'), ('Karin Konoval', 'Maurice'), ('Terry Notary', 'Rocket'), ('Steve Zahn', 'Bad Ape'), ('Amiah Miller', 'Nova'), ('Ty Olsson', 'Red Donkey'), ('Michael Adamthwaite', 'Luca'), ('Toby Kebbell', 'Koba')]",07/14/2017 (VN),2h 20m,Tiếng Anh,"War for Planet of the Apes, phần phim thứ 3 và cũng là cuối cùng của trilogy Planet of the Apes. Tiếp nối phần trước, sau khi quân đội biết sự tồn tại của xã hội loài khỉ dưới sự chỉ huy của Caesar, họ quyết định đến chiến đấu chống lại Caesar, nhóm lính được dẫn đầu bởi một vị tướng tàn bạo. Về phần vị vua khỉ của chúng ta, sau những mất mát của mình, anh ta dần trở nên đen tối hơn, có những suy nghĩ độc đoán hơn về con người và cách thống lĩnh của mình. Số phận của hai giống loài này phụ thuộc vào cuộc chiến cuối cùng này!","$490,700,000.00 ","$150,000,000.00 ",Matt Reeves,,posters3/poster_50.jpg
https://www.themoviedb.org/movie/61791-rise-of-the-planet-of-the-apes,Sự Nổi Dậy Của Hành Tinh Khỉ,73%,"Phim Gây Cấn, Phim Hành Động, Phim Chính Kịch, Phim Khoa Học Viễn Tưởng","[('Andy Serkis', 'Caesar'), ('James Franco', 'Will Rodman'), ('Freida Pinto', 'Caroline Aranha'), ('John Lithgow', 'Charles Rodman'), ('Brian Cox', 'John Landon'), ('Tom Felton', 'Dodge Landon'), ('Tyler Labine', 'Robert Franklin'), ('Karin Konoval', 'Maurice / Court Clerk'), ('Terry Notary', 'Rocket / Bright Eyes')]",08/19/2011 (VN),1h 45m,Tiếng Anh,"Will Rodman (James Franco) là một nhà khoa học tại công ty sinh học Gen-Sys, công ty này đang cố gắng phát triển một phương thuốc cho bệnh Alzheimer và đang thử nghiệm một loại thuốc theo liệu pháp gen lên những con tinh tinh. Loại thuốc này, là một loại virus được sửa đổi, giúp biến đổi những con tinh tinh, khiến chúng có khả năng thông minh của loài người. Một con tinh tinh cái đã cho rằng con của nó (mà phòng thí nghiệm vẫn chưa biết đến) bị đe dọa nên đã nổi giận và bị bắn chết bởi các nhân viên an ninh. Ông chủ của Will là Steven Jacobs (David Oyelowo) sau đó đã ra lệnh cho người giữ con tinh tinh này là Robert Franklin (Tyler Labine) phải kết liễu bằng thuốc những con tinh tinh còn lại. Franklin không thể khiến mình giết chết con tinh tinh con khi phát hiện ra sự tồn tại của nó và thay vào đó đã trao nó cho Will đem về nhà nuôi.","$482,900,000.00 ","$93,000,000.00 ",Rupert Wyatt,"Rick Jaffa, Amanda Silver",posters3/poster_51.jpg
https://www.themoviedb.org/movie/320288-dark-phoenix,X-Men: Phượng Hoàng Bóng Tối,60%,"Phim Khoa Học Viễn Tưởng, Phim Hành Động, Phim Phiêu Lưu","[('Sophie Turner', 'Jean Grey / Dark Phoenix'), ('James McAvoy', 'Charles Xavier / Professor X'), ('Nicholas Hoult', 'Hank McCoy / Beast'), ('Tye Sheridan', 'Scott Summers / Cyclops'), ('Michael Fassbender', 'Erik Lensherr / Magneto'), ('Alexandra Shipp', 'Ororo Munroe / Storm'), ('Evan Peters', 'Peter Maximoff / Quicksilver'), ('Jessica Chastain', 'Vuk'), ('Kodi Smit-McPhee', 'Kurt Wagner / Nightcrawler')]",06/07/2019 (VN),1h 54m,Tiếng Anh,"Một thập kỷ sau sự kiện trong phim X-Men: Cuộc chiến chống Apocalypse, nhóm X-Men đang theo đuổi những nhiệm vụ khó khăn hơn. Vào năm 1992, X-Men phản ứng với tín hiệu đau khổ từ tàu con thoi Endeavour, bị phá hủy nghiêm trọng bởi một năng lượng giống như ngọn lửa Mặt trời. Trong một lần trên vũ trụ, một cơn bão Mặt Trời đe dọa tính mạng của cả nhóm, khiến Jean Grey phải sử dụng sức mạnh để cứu mọi người. Nhưng, đồng thời, nó cũng làm cho Jean giải phóng một sức mạnh đáng gờm, Phượng hoàng Bóng tối.","$252,442,974.00 ","$200,000,000.00 ",Simon Kinberg,,posters3/poster_52.jpg
https://www.themoviedb.org/movie/680-pulp-fiction,Chuyện Tào Lao,85%,"Phim Gây Cấn, Phim Hình Sự","[('John Travolta', 'Vincent Vega'), ('Samuel L. Jackson', 'Jules Winnfield'), ('Uma Thurman', 'Mia Wallace'), ('Bruce Willis', 'Butch Coolidge'), ('Ving Rhames', 'Marsellus Wallace'), ('Harvey Keitel', 'Winston ""The Wolf"" Wolfe'), ('Eric Stoltz', 'Lance'), ('Tim Roth', 'Ringo (""Pumpkin"")'), ('Amanda Plummer', 'Yolanda (""Honey Bunny"")')]",10/14/1994 (US),2h 34m,Tiếng Anh,"Những câu chuyện tưởng chừng tầm phào về 2 gã găng tơ trên đường thực hiện mệnh lệnh của ông chủ với 1 võ sĩ quyền anh giết chết người phải chạy trốn có vẻ không liên quan nhưng khi ghép lại người xem sẽ có 1 bức tranh tổng thể, đặc trưng cho phong cách của đạo diễn Quentin Tarantino: đậm chất bạo lực, máu me.","$213,900,000.00 ","$8,500,000.00 ",Quentin Tarantino,Quentin Tarantino,posters3/poster_53.jpg
https://www.themoviedb.org/movie/609681-the-marvels,Biệt Đội Marvel,62%,"Phim Khoa Học Viễn Tưởng, Phim Phiêu Lưu, Phim Hành Động","[('Brie Larson', 'Carol Danvers / Captain Marvel'), ('Teyonah Parris', 'Monica Rambeau'), ('Iman Vellani', 'Kamala Khan / Ms. Marvel'), ('Zawe Ashton', 'Dar-Benn'), ('Samuel L. Jackson', 'Nick Fury'), ('Gary Lewis', ""Emperor Dro'ge""), ('Park Seo-jun', 'Prince Yan'), ('Zenobia Shroff', 'Muneeba Khan'), ('Mohan Kapur', 'Yusuf Khan')]",11/10/2023 (VN),1h 45m,Tiếng Anh,"Carol Danvers bị vướng vào sức mạnh của Kamala Khan và Monica Rambeau, buộc họ phải hợp tác với nhau để cứu vũ trụ.","$207,089,999.00 ","$274,800,000.00 ",Nia DaCosta,,posters3/poster_54.jpg
https://www.themoviedb.org/movie/218-the-terminator,Kẻ Hủy Diệt,77%,"Phim Hành Động, Phim Gây Cấn, Phim Khoa Học Viễn Tưởng","[('Arnold Schwarzenegger', 'The Terminator'), ('Michael Biehn', 'Kyle Reese'), ('Linda Hamilton', 'Sarah Connor'), ('Lance Henriksen', 'Detective Vukovich'), ('Paul Winfield', 'Lieutenant Ed Traxler'), ('Bess Motta', 'Ginger Ventura'), ('Rick Rossovich', 'Matt Buchanan'), ('Earl Boen', 'Dr. Peter Silberman'), ('Dick Miller', 'Pawnshop Clerk')]",10/26/1984 (US),1h 48m,Tiếng Anh,"Năm 2029, những kẻ cai trị Trái Đất quyết định gửi về quá khứ một robot sát thủ mang tên The Terminator - Kẻ Hủy Diệt để thay đổi quá khứ. Nhiệm vụ của tên robot này là giết chết Sarah Connor, người có vai trò quyết định trong cuộc kháng chiến của nhân loại sau này.","$78,371,200.00 ","$6,400,000.00 ",James Cameron,,posters3/poster_55.jpg
https://www.themoviedb.org/movie/111-scarface,Ông Trùm Mặt Sẹo,82%,"Phim Hành Động, Phim Hình Sự, Phim Chính Kịch","[('Al Pacino', ""Antonio 'Tony' Montana""), ('Steven Bauer', ""Manolo 'Manny' Ray""), ('Michelle Pfeiffer', 'Elvira'), ('Mary Elizabeth Mastrantonio', 'Gina Montana'), ('Robert Loggia', 'Frank Lopez'), ('Miriam Colon', 'Mama Montana'), ('F. Murray Abraham', 'Omar'), ('Paul Shenar', 'Alejandro Sosa'), ('Harris Yulin', 'Bernstein')]",12/09/1983 (US),2h 49m,Tiếng Anh,"125 nghìn người tị nạn ở Cuba được nhập cảnh Mỹ và đoàn tụ với người thân. Trong đám đông đó, Tony Montana lại nuôi tham vọng khác. Từ một gã tay chân cho băng đảng và bắt đầu dấn thân vào con đường tăm tối, Tony ngày càng bị cơn khát quyền lực dằn vặt, ngay cả khi đã trở thành ông trùm.","$66,023,329.00 ","$25,000,000.00 ",Brian De Palma,Oliver Stone,posters3/poster_56.jpg
https://www.themoviedb.org/movie/62-2001-a-space-odyssey,2001: Chuyến Du Hành Không Gian,81%,"Phim Khoa Học Viễn Tưởng, Phim Bí Ẩn, Phim Phiêu Lưu","[('Keir Dullea', 'Dr. David Bowman'), ('Gary Lockwood', 'Dr. Frank Poole'), ('William Sylvester', 'Dr. Heywood Floyd'), ('Douglas Rain', 'HAL 9000 (voice)'), ('Daniel Richter', 'Moonwatcher'), ('Leonard Rossiter', 'Dr. Andrei Smyslov'), ('Margaret Tyzack', 'Elena'), ('Robert Beatty', 'Dr. Ralph Halvorsen'), ('Sean Sullivan', 'Dr. Roy Michaels')]",04/02/1968 (VN),2h 29m,Tiếng Anh,"Bắt đầu phim là trong thời kỳ nguyên thủy, nơi những bầy vượn người tổ tiên bắt đầu biết dùng vũ khí để giết mồi. Và phần lớn bộ phim là cuộc du hành vào không gian của đội phi hành gia của Bowler Keir Dullea đến thám hiểm sao Mộc. Sau đó chiếc máy tính HAL 900 của phi thuyền với một trí thông minh nhân tạo cao đã làm phản. Vượt qua khó khăn, người sống sót duy nhất trong chuyến hành trình tới sao Mộc tiến tới bước tiến hóa tiếp theo của loài người...","$71,923,560.00 ","$12,000,000.00 ",Stanley Kubrick,"Stanley Kubrick, Arthur C. Clarke",posters3/poster_57.jpg
https://www.themoviedb.org/movie/284054-black-panther,Chiến Binh Báo Đen,74%,"Phim Hành Động, Phim Phiêu Lưu, Phim Khoa Học Viễn Tưởng","[('Chadwick Boseman', ""King T'Challa / Black Panther""), ('Michael B. Jordan', ""N'Jadaka / Erik 'Killmonger' Stevens""), (""Lupita Nyong'o"", 'Nakia'), ('Danai Gurira', 'Okoye'), ('Martin Freeman', 'Everett K. Ross'), ('Daniel Kaluuya', ""W'Kabi""), ('Letitia Wright', 'Shuri'), ('Winston Duke', ""M'Baku""), ('Sterling K. Brown', ""N'Jobu"")]",02/16/2018 (VN),2h 15m,Tiếng Anh,"Vương quốc Wakanda, quê hương của Black Panther/ T'Challa hiện ra qua lời kể của một nhân chứng sống sót trở về. Đây là quốc gia khá khép kín và sở hữu lượng Vibranium lớn nhất trên thế giới. Black Panther - người cầm quyền của Wakanda sở hữu bộ áo giáp chống đạn và móng vuốt sắc nhọn, anh được miêu tả là “người tốt với trái tim nhân hậu”. Nhưng cũng chính vì những đức tính tốt này mà Black Panther gặp khó khăn khi kế thừa ngai vàng sau khi vua cha băng hà. Đối mặt với sự phản bội và hiểm nguy, vị vua trẻ phải tập hợp các đồng minh và phát huy toàn bộ sức mạnh của Black Panther để đánh bại kẻ thù, đem lại an bình cho nhân dân của mình.","$1,349,926,083.00 ","$200,000,000.00 ",Ryan Coogler,,posters3/poster_58.jpg
https://www.themoviedb.org/movie/405774-bird-box,Lồng Chim,68%,"Phim Kinh Dị, Phim Gây Cấn, Phim Chính Kịch","[('Sandra Bullock', 'Malorie Hayes'), ('Trevante Rhodes', 'Tom'), ('John Malkovich', 'Douglas'), ('Sarah Paulson', 'Jessica'), ('Jacki Weaver', 'Cheryl'), ('Rosa Salazar', 'Lucy'), ('Danielle Macdonald', 'Olympia'), ('Lil Rel Howery', 'Charlie'), ('Tom Hollander', 'Gary')]",12/21/2018 (VN),2h 4m,Tiếng Anh,"Chuyện gì sẽ xảy ra nếu cả thế giới rơi vào nguy kịch trước sự tấn công bởi những con quái vật mà chưa một ai từng thấy hình dạng? Sẽ đáng sợ ra sao nếu chúng sơ sẩy một tích tắc nhìn vào chúng, và rồi chúng ta phát điên lên, tự huỷ sự sống của bản thân? Với cách duy nhất để sống sót là bịt mắt và trốn chạy, Malorie (Sandra Bullock) phải làm mọi cách để giữ hai con an toàn giữa cuộc chiến trong bóng tối. Không chỉ phải chiến đấu với những con quái vật vô hình, cô còn phải đấu tranh với bản thân khi chỉ cần một lần hé nhìn là có thể mất đi ánh sáng mãi mãi.",-,"$19,800,000.00 ",Susanne Bier,Eric Heisserer,posters3/poster_59.jpg
https://www.themoviedb.org/movie/299537-captain-marvel,Đại Uý Marvel,68%,"Phim Hành Động, Phim Phiêu Lưu, Phim Khoa Học Viễn Tưởng","[('Brie Larson', 'Carol Danvers / Vers / Captain Marvel'), ('Samuel L. Jackson', 'Nick Fury'), ('Ben Mendelsohn', 'Talos / Keller'), ('Jude Law', 'Yon-Rogg'), ('Annette Bening', 'Supreme Intelligence / Dr. Wendy Lawson'), ('Djimon Hounsou', 'Korath'), ('Lee Pace', 'Ronan the Accuser'), ('Lashana Lynch', 'Maria Rambeau'), ('Gemma Chan', 'Minn-Erva')]",03/08/2019 (VN),2h 4m,Tiếng Anh,"Từ xa xưa, hai tộc Kree và Skrulls đã xảy ra cuộc chiến tranh kéo dài rất lâu, gọi là Chiến tranh Kree–Skrull. Với trình độ kĩ thuật phát triển, người Kree dần áp đảo trong cuộc chiến và khiến cho số lượng người Skrulls bị giảm đi đáng kể. Năm 1995, Vers thức giấc tại Hala, quê hương của Đế chế Kree. Cô luôn bị ác mộng về một vụ rơi máy bay, và về một người phụ nữ bị sát hại trước mặt mình. Trí nhớ của cô dừng lại tại thời điểm cô đạt được sức mạnh của mình. Cô được Yon-Rogg, thủ lĩnh của Starforce huấn luyện để trở thành thành viên của đội. Mặc dù Yon-Rogg tin rằng cô đã sẵn sàng nhưng Supreme Intelligence, một trí tuệ nhân tạo có vai trò điều hành Đế chế Kree lại không cho cô gia nhập đội, nơi mà có Minn-Erva - một xạ thủ bắn tỉa và các cộng sự Korath, Bron-Char và Att-Lass.","$1,131,416,446.00 ","$152,000,000.00 ","Ryan Fleck, Anna Boden","Ryan Fleck, Anna Boden, Geneva Robertson-Dworet",posters3/poster_60.jpg
https://www.themoviedb.org/movie/760104-x,Dự Án Đẫm Máu,67%,"Phim Kinh Dị, Phim Gây Cấn, Phim Bí Ẩn","[('Mia Goth', 'Maxine / Pearl'), ('Jenna Ortega', 'Lorraine'), ('Brittany Snow', 'Bobby-Lynne'), ('Kid Cudi', 'Jackson'), ('Martin Henderson', 'Wayne'), ('Owen Campbell', 'RJ'), ('Stephen Ure', 'Howard'), ('James Gaylyn', 'Sheriff Dentler'), ('Simon Prast', 'Televangelist')]",03/18/2022 (US),1h 46m,Tiếng Anh,"Năm 1979, một nhóm cá nhà làm phim khiêu dâm trẻ tuổi bắt đầu bộ phim của mình ở vùng nông thôn Texas, nhưng khi đôi vợ chồng chủ nhà già phát hiện những điều họ làm, dàn diễn viên bị cuốn vào cuộc truy đuổi kịch tính và không kém phần nhục dục.","$14,740,889.00 ","$1,000,000.00 ",Ti West,,posters3/poster_61.jpg
https://www.themoviedb.org/movie/1366-rocky,Rocky,78%,Phim Chính Kịch,"[('Sylvester Stallone', ""Robert 'Rocky' Balboa""), ('Talia Shire', ""Adrianna 'Adrian' Pennino""), ('Burt Young', 'Paulie Pennino'), ('Carl Weathers', 'Apollo Creed'), ('Burgess Meredith', 'Mickey Goldmill'), ('Thayer David', ""George 'Miles' Jergens""), ('Joe Spinell', 'Tony Gazzo'), ('Jimmy Gambina', 'Mike'), ('Bill Baldwin', 'Fight Announcer')]",11/21/1976 (US),2h,Tiếng Anh,"Phim kể về một anh chàng vô công rồi nghề chẳng có tương lai, Rocky Balboa bước lên võ đài và đánh bại cả đương kim vô địch quyền Anh. Số phận đã mỉm cười và trao vào tay anh một cú đấm đủ làm choáng váng đối thủ, và cả một trái tim nhiệt huyết dành cho môn thể thao này.","$225,300,000.00 ","$1,000,000.00 ",John G. Avildsen,Sylvester Stallone,posters3/poster_62.jpg
https://www.themoviedb.org/movie/297762-wonder-woman,Wonder Woman: Nữ Thần Chiến Binh,72%,"Phim Hành Động, Phim Phiêu Lưu, Phim Giả Tượng","[('Gal Gadot', 'Diana Prince / Wonder Woman'), ('Chris Pine', 'Steve Trevor'), ('Connie Nielsen', 'Hippolyta'), ('Robin Wright', 'Antiope'), ('Danny Huston', 'Ludendorff'), ('David Thewlis', 'Sir Patrick / Ares'), ('Saïd Taghmaoui', 'Sameer'), ('Ewen Bremner', 'Charlie'), ('Eugene Brave Rock', 'The Chief')]",06/02/2017 (VN),2h 21m,Tiếng Anh,"Trước khi trở thành Wonder Woman, Diana là công chúa chiến binh Amazon của hòn đảo Themyscira. Khi chàng phi công Steve Trevor trôi dạt vào đảo và kể về cuộc đại chiến đang diễn ra tại thế giới bên ngoài, Diana quyết định rời khỏi quê nhà để giải cứu nhân loại. Từ đó cô khám phá ra quyền năng và sứ mệnh thật sự của mình.","$823,970,682.00 ","$149,000,000.00 ",Patty Jenkins,Allan Heinberg,posters3/poster_63.jpg
https://www.themoviedb.org/movie/157336-interstellar,Hố Đen Tử Thần,84%,"Phim Phiêu Lưu, Phim Chính Kịch, Phim Khoa Học Viễn Tưởng","[('Matthew McConaughey', 'Joseph ""Coop"" Cooper'), ('Anne Hathaway', 'Dr. Amelia Brand'), ('Jessica Chastain', 'Murphy ""Murph"" Cooper'), ('Michael Caine', 'Professor John Brand'), ('Bill Irwin', 'TARS (voice)'), ('Ellen Burstyn', 'Old Murph'), ('Mackenzie Foy', 'Young Murph'), ('Casey Affleck', 'Tom Cooper'), ('John Lithgow', 'Donald')]",11/07/2014 (VN),2h 49m,Tiếng Anh,"Interstellar nói về chuyến hành trình đi tìm một hành tinh mới cho loài người trú ngụ khi mà Trái Đất dần dần không còn là nơi an toàn và sự sống thì đang chết dần với những dịch bệnh trên các loại cây lương thực, đe dọa đến sự tồn tại của loài người một cách mạnh mẽ. Chúng ta sẽ đi theo hành trình của phi hành đoàn gồm Copper, Amelia cùng các thành viên khác trong việc giải cứu các phi hành gia khác đã lên đường khám phá các hành tinh mới để tìm ra hành tinh mới cho loài người trú ngụ","$701,729,206.00 ","$165,000,000.00 ",Christopher Nolan,,posters3/poster_64.jpg
https://www.themoviedb.org/movie/106-predator,Quái Thú Vô Hình,75%,"Phim Khoa Học Viễn Tưởng, Phim Hành Động, Phim Phiêu Lưu, Phim Gây Cấn","[('Arnold Schwarzenegger', 'Major Alan ""Dutch"" Schaefer'), ('Carl Weathers', 'Al Dillon'), ('Elpidia Carrillo', 'Anna Gonsalves'), ('Jesse Ventura', 'Blain Cooper'), ('Sonny Landham', 'Billy Sole'), ('Bill Duke', 'Mac Eliot'), ('Richard Chaves', 'Jorge ""Poncho"" Ramirez'), ('R. G. Armstrong', 'Major General Homer Phillips'), ('Shane Black', 'Rick Hawkins')]",06/12/1987 (US),1h 47m,Tiếng Anh,"Predator (tên tiếng Việt là Quái vật ăn thịt hay Quái vật vô hình) là bộ phim khoa học viễn tưởng, hành động Mỹ. Bộ phim xoay quanh trung đội đặc nhiệm của thiếu tá Alan ""Dutch"" Schaefer được lệnh tới khu vực rừng nhiệt đới ở biên giới giải cứu một bộ trưởng bị phiến quân Guatemala bắt cóc. George Dillon, một điệp viên của CIA, được phái tới để hỗ trợ nhóm đặc nhiệm. Họ di chuyển bằng trực thăng tới vùng hoạt động của lực lượng phiến loạn.Chỉ ít lâu sau khi đặt chân vào rừng rậm, cả nhóm nhận ra mình đang bị rơi vào cạm bẫy chết chóc. Duy có điều, kẻ săn mồi này lại đến từ ngoài trái đất. Trong trạng thái hoang mang tột độ, họ chụm đầu vào nhau để tìm biện pháp đối phó ...","$98,267,558.00 ","$15,000,000.00 ",John McTiernan,,posters3/poster_65.jpg
https://www.themoviedb.org/movie/490132-green-book,Cẩm Nang Xanh,82%,"Phim Chính Kịch, Phim Lịch Sử","[('Viggo Mortensen', 'Tony Lip'), ('Mahershala Ali', 'Dr. Don Shirley'), ('Linda Cardellini', 'Dolores'), ('Sebastian Maniscalco', 'Johnny Venere'), ('Dimiter D. Marinov', 'Oleg'), ('P.J. Byrne', 'Record Exec'), ('Mike Hatton', 'George'), ('Joe Cortese', 'Gio Loscudo'), ('Maggie Nixon', 'Copa Coat Check Girl')]",11/16/2018 (US),2h 10m,Tiếng Anh,"Lấy bối cảnh nước Mỹ những năm 1960 khi nạn phân biệt chủng tộc còn nặng nề. Tony Lip được thuê làm người lái xe kiêm vệ sĩ cho nghệ sĩ piano huyền thoại da đen - Don Shirley, trong chuyến lưu diễn xuyên miền nam nước Mỹ.","$319,700,000.00 ","$23,000,000.00 ",Peter Farrelly,,posters3/poster_66.jpg
https://www.themoviedb.org/movie/1062807-spyxfamily-code-white,Gia Đình x Điệp Viên Mã: Trắng,77%,"Phim Hoạt Hình, Phim Hài, Phim Phiêu Lưu, Phim Hành Động","[('Takuya Eguchi', 'Loid Forger (voice)'), ('Atsumi Tanezaki', 'Anya Forger (voice)'), ('Saori Hayami', 'Yor Forger (voice)'), ('Kenichirou Matsuda', 'Narrator / Bond Forger (voice)'), ('Tomoya Nakamura', 'Dmitri (voice)'), ('Kento Kaku', 'Luka (voice)'), ('Banjo Ginga', 'Snijder (voice)'), ('Shunsuke Takeuchi', 'Type F (voice)')]",02/10/2024 (VN),1h 50m,Tiếng Nhật,"Trong bộ phim lần này, sau khi nhận được yêu cầu thay thế mình trong Chiến dịch Strix, Loid Forger quyết định giúp con gái Anya chiến thắng trong cuộc thi nấu ăn tại Học viện Eden bằng cách nấu bữa ăn yêu thích của hiệu trưởng để tránh bị thay thế khỏi nhiệm vụ mật. Nhưng từ đây, gia đình Forger phát hiện ra bí mật kinh hoàng ảnh hưởng đến hòa bình thế giới.","$51,737,130.00 ",-,Takashi Katagiri,Ichirou Ookouchi,posters3/poster_67.jpg
https://www.themoviedb.org/movie/526896-morbius,Morbius,60%,"Phim Hành Động, Phim Khoa Học Viễn Tưởng, Phim Giả Tượng","[('Jared Leto', 'Dr. Michael Morbius / Morbius'), ('Matt Smith', 'Milo / Lucien'), ('Adria Arjona', 'Martine Bancroft'), ('Jared Harris', 'Dr. Emil Nicholas'), ('Al Madrigal', 'Agent Alberto Rodriguez'), ('Tyrese Gibson', 'Agent Simon Stroud'), ('Zaris-Angel Hator', 'Anna'), ('Joe Ferrara', 'Bush Pilot'), ('Charlie Shotwell', 'Young Michael')]",04/01/2022 (VN),1h 45m,Tiếng Anh,"Sau khi bị mắc một căn bệnh hiếm gặp về máu, vị giáo sư Michael Morbius đã cố gắng tạo một thứ thuốc để tự điều trị cho bản thân mình nhưng cũng vì thứ thuốc đó đã khiến trở thành một dạng ma cà rồng.","$167,635,712.00 ","$75,000,000.00 ",Daniel Espinosa,"Burk Sharpless, Matt Sazama",posters3/poster_68.jpg
https://www.themoviedb.org/movie/141-donnie-darko,Giấc Mơ,78%,"Phim Giả Tượng, Phim Chính Kịch, Phim Bí Ẩn","[('Jake Gyllenhaal', 'Donnie Darko'), ('Jena Malone', 'Gretchen Ross'), ('James Duval', 'Frank'), ('Drew Barrymore', 'Karen Pomeroy'), ('Beth Grant', 'Kitty Farmer'), ('Maggie Gyllenhaal', 'Elizabeth Darko'), ('Mary McDonnell', 'Rose Darko'), ('Holmes Osborne', 'Eddie Darko'), ('Noah Wyle', 'Prof. Kenneth Monnitoff')]",10/26/2001 (US),1h 54m,Tiếng Anh,"Donnie Darko là một cậu học sinh ‘cá biệt’ bị ám ảnh bởi hình ảnh của một con thỏ khổng lồ luôn tìm cách lôi kéo cậu tham gia một loạt tội ác sau một tai nạn kỳ lạ. Những tình huống ly kì hồi hộp làm khán giả bị cuốn theo sự hoang tưởng trong tiềm thức của nhân vật chính. Cho đến cuối cùng, họ mới nhận ra được sự thật của những hoang tưởng ấy bắt nguồn từ đâu...","$7,500,000.00 ","$4,500,000.00 ",Richard Kelly,,posters3/poster_69.jpg
https://www.themoviedb.org/movie/206647-spectre,Điệp Viên 007: Bóng Ma,65%,"Phim Hành Động, Phim Phiêu Lưu, Phim Gây Cấn","[('Daniel Craig', 'James Bond'), ('Christoph Waltz', 'Franz Oberhauser / Ernst Stavro Blofeld'), ('Léa Seydoux', 'Dr. Madeleine Swann'), ('Ralph Fiennes', 'M'), ('Monica Bellucci', 'Lucia Sciarra'), ('Ben Whishaw', 'Q'), ('Naomie Harris', 'Eve Moneypenny'), ('Dave Bautista', 'Mr. Hinx'), ('Andrew Scott', 'Max Denbigh / C')]",11/06/2015 (VN),2h 28m,Tiếng Anh,"James Bond 24: Spectre (Điệp Viên 007: Bóng Ma): Trong Spectre, Daniel Craig lần thứ tư vào vai siêu điệp viên 007. Trong khi “sếp” M phải đấu tranh ở mặt trận chính trị để giữ tổ chức điệp viên tồn tại, Bond nhận được một thông điệp từ quá khứ dẫn anh đến hành trình lột trần sự thật khủng khiếp đằng sau Spectre","$880,674,609.00 ","$245,000,000.00 ",Sam Mendes,"Neal Purvis, Robert Wade, John Logan, Jez Butterworth",posters3/poster_70.jpg
https://www.themoviedb.org/movie/16320-serenity,Sứ Mệnh Nguy Hiểm,74%,"Phim Khoa Học Viễn Tưởng, Phim Hành Động, Phim Phiêu Lưu, Phim Gây Cấn","[('Nathan Fillion', 'Malcolm ""Mal"" Reynolds'), ('Summer Glau', 'River Tam'), ('Gina Torres', 'Zoë Alleyne Washburne'), ('Alan Tudyk', 'Hoban ""Wash"" Washburne'), ('Morena Baccarin', 'Inara Serra'), ('Adam Baldwin', 'Jayne Cobb'), ('Jewel Staite', 'Kaywinnet Lee ""Kaylee"" Frye'), ('Sean Maher', 'Simon Tam'), ('Ron Glass', 'Shepherd Derrial Book')]",09/30/2005 (US),1h 59m,Tiếng Anh,"Bộ phim được làm dựa trên kịch bản chuyển thể từ một phim truyền hình tên là ""Firefly"". Phim kể về cuộc phiêu lưu trong không gian của những người điều hành con tàu Serenity gồm thuyền trưởng Malcolm và các nhân viên là Zoe, Wash, Kaylee và Jayne. Khi Malcolm đồng ý chở 2 vị khách là vị bác sĩ trẻ Simon cùng với người chị có tinh thần bất ổn River thì những rắc rối bắt đầu xảy ra.","$38,869,464.00 ","$39,000,000.00 ",Joss Whedon,,posters3/poster_71.jpg
