Movie_Link,Movie_Name,Ratings,Movie_category,Film_Actor,Release_Date,Duration,Original_Language,Description,Box Office,Budget,Directors,Writing_Credits,poster_path
https://www.themoviedb.org/movie/9482-judge-dredd,Thẩm Phán Dredd,58%,Phim Khoa Học Viễn Tưởng,"[('Sylvester Stallone', 'Judge Joseph Dredd'), ('Diane Lane', 'Judge Hershey'), ('Armand Assante', 'Rico'), ('Rob Schneider', ""Herman 'Fergee' Ferguson""), ('Jürgen Prochnow', 'Judge Griffin'), ('Max von Sydow', 'Chief Justice Fargo'), ('Christopher Adamson', 'Mean Machine'), ('Joanna Miles', 'Judge Evelyn McGruder'), ('Joan Chen', 'Dr. Ilsa Hayden')]",06/30/1995 (US),1h 36m,Tiếng Anh,"In a dystopian future, Dredd, the most famous judge (a cop with instant field judiciary powers) is convicted for a crime he did not commit while his murderous counterpart escapes.","$113,493,481.00 ","$90,000,000.00 ",Danny Cannon,"William Wisher, Steven E. de Souza",posters3/poster_97.jpg
https://www.themoviedb.org/movie/766507-prey,Quái Thú Vô Hình: Săn Mồi,77%,"Phim Gây Cấn, Phim Hành Động, Phim Khoa Học Viễn Tưởng","[('Amber Midthunder', 'Naru'), ('Dakota Beavers', 'Taabe'), ('Michelle Thrush', 'Aruka'), ('Stormee Kipp', 'Wasape'), ('Julian Black Antelope', 'Chief Kehetu'), ('Dane DiLiegro', 'Predator'), ('Stefany Mathias', 'Sumu (Chief Wife)'), ('Bennett Taylor', 'Raphael'), ('Mike Paterson', 'Big Beard')]",08/02/2022 (US),1h 40m,Tiếng Anh,"Lấy bối cảnh 300 trước tại vùng đồng bằng Nam Hoa Kỳ. Tại đây, một sinh vật ngoại lai đến từ ngoài vũ trụ đổ bộ xuống Trái Đất đe dọa cuộc sống của một bộ tộc cổ xưa. Naru, một nữ chiến binh lành nghề, phải dùng mọi kỹ năng của mình để tồn tại cũng như bảo vệ ngôi làng trước mối hiểm họa mà cô chưa từng hiểu biết",-,"$65,000,000.00 ",Dan Trachtenberg,Patrick Aison,posters3/poster_98.jpg
https://www.themoviedb.org/movie/339403-baby-driver,Quái Xế Baby,75%,"Phim Hành Động, Phim Hình Sự","[('Ansel Elgort', 'Baby'), ('Kevin Spacey', 'Doc'), ('Lily James', 'Debora'), ('Jon Hamm', 'Buddy'), ('Jamie Foxx', 'Bats'), ('Jon Bernthal', 'Griff'), ('Eiza González', 'Darling'), ('Flea', 'Eddie'), ('CJ Jones', 'Joseph')]",06/30/2017 (VN),1h 53m,Tiếng Anh,"Baby Driver là một 2017 hành động phim tội phạm được viết kịch bản và đạo diễn bởi Edgar Wright. Bộ phim có sự tham gia Ansel Elgort, Kevin Spacey, Lily James, Jon Bernthal, Eiza González, Jon Hamm và Jamie Foxx . Bộ phim kể về vụ cướp của Baby do Ansel Elgort thủ vai.","$226,945,087.00 ","$34,000,000.00 ",Edgar Wright,,posters3/poster_99.jpg
https://www.themoviedb.org/movie/399170-logan-lucky,Vụ Trộm May Rủi,67%,"Phim Hài, Phim Hình Sự, Phim Hành Động, Phim Chính Kịch","[('Channing Tatum', 'Jimmy Logan'), ('Adam Driver', 'Clyde Logan'), ('Daniel Craig', 'Joe Bang'), ('Riley Keough', 'Mellie Logan'), ('Katie Holmes', 'Bobbie Jo Chapman'), ('Katherine Waterston', 'Sylvia Harrison'), ('Seth MacFarlane', 'Max Chilblain'), ('Dwight Yoakam', 'Warden Burns'), ('Sebastian Stan', 'Dayton White')]",09/15/2017 (VN),1h 58m,Tiếng Anh,"Lâm vào tình cảnh “không còn gì để mất”, anh em nhà Logan với những suy nghĩ táo bạo và điên rồ đã quyết định thực hiện một vụ cướp thế kỉ tại giải đua xe huyền thoại Coca-Cola 600. Vốn chỉ là những tay gà mờ nên cả hai đã phải tìm mọi cách giúp Joa Bang, tên trộm cắp chuyên nghiệp trốn thoát khỏi nhà tù để giúp đỡ trong phi vụ này. Kể từ đây, vô số tình huống dở khóc dở cười đã xảy ra và càng dấn thân vào vụ việc, họ càng nhận ra rằng mọi thứ dường như đã tuột khỏi tầm kiểm soát…","$48,453,605.00 ","$29,000,000.00 ",Steven Soderbergh,,posters3/poster_100.jpg
https://www.themoviedb.org/movie/618588-arthur-the-king,Arthur: Chú Chó Kiên Cường,69%,"Phim Chính Kịch, Phim Phiêu Lưu","[('Mark Wahlberg', 'Michael Light'), ('Nathalie Emmanuel', 'Olivia'), ('Simu Liu', 'Leo'), ('Ali Suliman', 'Chik'), ('Juliet Rylance', 'Helen Light'), ('Bear Grylls', 'Self'), ('Michael Landes', 'Broadrail Executive'), ('Paul Guilfoyle', 'Charlie Light'), ('Rob Collins', 'Decker Swanson')]",05/03/2024 (VN),1h 47m,Tiếng Anh,"Over the course of ten days and 435 miles, an unbreakable bond is forged between pro adventure racer Michael Light and a scrappy street dog companion dubbed Arthur. As the team is pushed to their outer limits of endurance in the race, Arthur redefines what victory, loyalty and friendship truly mean.","$31,649,885.00 ","$19,000,000.00 ",Simon Cellan Jones,,posters3/poster_101.jpg
https://www.themoviedb.org/movie/16281-creepshow,Chương Trình Kinh Dị,69%,"Phim Kinh Dị, Phim Hài","[('Hal Holbrook', 'Henry Northrup (segment ""The Crate"")'), ('Adrienne Barbeau', 'Wilma Northrup (segment ""The Crate"")'), ('Fritz Weaver', 'Dexter Stanley (segment ""The Crate"")'), ('Leslie Nielsen', 'Richard Vickers (segment ""Something To Tide You Over"")'), ('Carrie Nye', 'Sylvia Grantham (segment ""Father\'s Day"")'), ('E.G. Marshall', 'Upson Pratt (segment ""They\'re Creeping Up On You"")'), ('Viveca Lindfors', 'Aunt Bedelia (segment ""Father\'s Day"")'), ('Ed Harris', 'Hank Blaine (segment ""Father\'s Day"")'), ('Ted Danson', 'Harry Wentworth (segment ""Something To Tide You Over"")')]",11/10/1982 (US),2h,Tiếng Anh,"Five tales in the style of classic '50s horror comics, involving a murdered man emerging from the grave, a meteor's ooze that makes everything grow, a snack for a crated creature, a scheming husband, and a malevolent millionaire with an insect phobia.","$21,028,755.00 ","$8,000,000.00 ",George A. Romero,Stephen King,posters3/poster_102.jpg
https://www.themoviedb.org/movie/635-angel-heart,Linh Hồn Quỷ Dữ,71%,"Phim Kinh Dị, Phim Bí Ẩn","[('Mickey Rourke', 'Harry Angel'), ('Robert De Niro', 'Louis Cyphre'), ('Lisa Bonet', 'Epiphany Proudfoot'), ('Charlotte Rampling', 'Margaret Krusemark'), ('Stocker Fontelieu', 'Ethan Krusemark'), ('Brownie McGhee', 'Toots Sweet'), ('Michael Higgins', 'Doctor Fowler'), ('Elizabeth Whitcraft', 'Connie'), ('Eliott Keener', 'Sterne')]",03/06/1987 (US),1h 53m,Tiếng Anh,"Thám tử tư Harry Angel được một người đàn ông giàu có bí ẩn, tên là Louis Cyphre, thuê đi tìm một nhạc công ""mắc nợ"" với ông ta có tên là Johnny Favorite. Tưởng chừng như công việc vô cùng đơn giản, Angel tìm tới những người từng biết Johnny để truy tìm. Nhưng những người mà Angel gặp, lần lượt bị sát hại một cách dã man. Angel từ từ phát hiện ra một âm mưu kinh khủng liên quan đến tà thuật. Johnny Favorite là ai? Tại sao Louise Cyphre muốn tìm cho bằng được hắn?","$17,200,000.00 ","$17,000,000.00 ",Alan Parker,Alan Parker,posters3/poster_103.jpg
https://www.themoviedb.org/movie/395990-death-wish,Thần Chết,62%,"Phim Hành Động, Phim Hình Sự, Phim Chính Kịch, Phim Gây Cấn","[('Bruce Willis', 'Paul Kersey'), (""Vincent D'Onofrio"", 'Frank Kersey'), ('Dean Norris', 'Detective Rains'), ('Elisabeth Shue', 'Lucy Kersey'), ('Camila Morrone', 'Jordan Kersey'), ('Beau Knapp', 'Knox'), ('Kimberly Elise', 'Detective Jackson'), ('Len Cariou', 'Ben'), ('Jack Kesy', 'The Fish')]",05/04/2018 (VN),1h 47m,Tiếng Anh,"Được MGM làm lại dựa trên bộ phim gốc cùng tên năm 1974, nội dung phim tập trung vào Paul Kersey, một bác sĩ phẫu thuật sống tại Chicago, người đã nhận thấy thành phố nơi ông đang sinh sống luôn bị bao trùm bởi những hành động bạo lực và phi nhân tính mà trong đó vợ và cô con gái của Paul cũng là nạn nhân. Lực lượng cảnh sát không thể khống chế được hết những tên tội phạm trong thành phố, vậy nên đây chính là lúc Paul trả thù và làm người hùng.","$34,017,028.00 ","$30,000,000.00 ",Eli Roth,"Joe Carnahan, Wendell Mayes",posters3/poster_104.jpg
https://www.themoviedb.org/movie/335983-venom,Venom,68%,"Phim Khoa Học Viễn Tưởng, Phim Hành Động","[('Tom Hardy', 'Eddie Brock / Venom'), ('Michelle Williams', 'Anne Weying'), ('Riz Ahmed', 'Carlton Drake / Riot'), ('Scott Haze', 'Security Chief Roland Treece'), ('Reid Scott', 'Dr. Dan Lewis'), ('Jenny Slate', 'Dr. Dora Skirth'), ('Melora Walters', 'Homeless Woman Maria'), ('Woody Harrelson', 'Cletus Kasady / Carnage'), ('Peggy Lu', 'Mrs. Chen')]",10/05/2018 (VN),1h 52m,Tiếng Anh,Quái Vật Venom là một kẻ thù nguy hiểm và nặng ký của Người nhện trong loạt series của Marvel. Chàng phóng viên Eddie Brock bí mật theo dõi âm mưu xấu xa của một tổ chức và đã không may mắn khi nhiễm phải loại cộng sinh trùng ngoài hành tinh (Symbiote) và từ đó đã không còn làm chủ bản thân về thể chất lẫn tinh thần. Điều này đã dần biến anh thành quái vật đen tối và nguy hiểm nhất chống lại người Nhện - Venom ...,"$856,085,151.00 ","$116,000,000.00 ",Ruben Fleischer,"Kelly Marcel, Scott Rosenberg, Jeff Pinkner",posters3/poster_105.jpg
https://www.themoviedb.org/movie/383498-deadpool-2,Deadpool 2,75%,"Phim Hành Động, Phim Hài, Phim Phiêu Lưu","[('Ryan Reynolds', 'Wade Wilson / Deadpool / Juggernaut (voice) / Ryan Reynolds'), ('Josh Brolin', 'Nathan Summers / Cable'), ('Morena Baccarin', 'Vanessa Carlysle'), ('Julian Dennison', 'Russell Collins / Firefist'), ('Zazie Beetz', 'Neena Thurman / Domino'), ('T.J. Miller', 'Jack Hammer / Weasel'), ('Leslie Uggams', 'Blind Al'), ('Karan Soni', 'Dopinder'), ('Brianna Hildebrand', 'Ellie Phimister / Negasonic Teenage Warhead')]",05/18/2018 (VN),2h,Tiếng Anh,"Trong phần 2 Deadpool sẽ đối đầu với sát nhân Cable, một kẻ đến từ tương lai với âm mưu giết hại một đứa bé – Người mà theo hắn sau này sẽ trở thành một dị nhân đầy quyền năng. Với nỗ lực đảm bảo sự an toàn cho đứa bé, Deadpool sẽ nhận được sự giúp đỡ từ cả những người bạn mới và cũ, và đặc biệt là các thành viên từ một đội quân mới thành lập có tên X-Force","$785,896,632.00 ","$110,000,000.00 ",David Leitch,,posters3/poster_106.jpg
https://www.themoviedb.org/movie/378018-the-void,Quái Vật Xúc Tu,59%,"Phim Bí Ẩn, Phim Kinh Dị, Phim Khoa Học Viễn Tưởng","[('Aaron Poole', 'Daniel Carter'), ('Kathleen Munroe', 'Allison'), ('Art Hindle', 'Mitchell'), ('Daniel Fathers', 'Vincent'), ('Kenneth Welsh', 'Dr. Richard Powell'), ('Ellen Wong', 'Kim'), ('Stephanie Belding', 'Beverly'), ('Mik Byskov', 'Simon'), ('Grace Munro', 'Maggie')]",10/21/2016 (CA),1h 30m,Tiếng Anh,"In the middle of a routine patrol, officer Daniel Carter happens upon a blood-soaked figure limping down a deserted stretch of road. He rushes the young man to a nearby rural hospital staffed by a skeleton crew, only to discover that patients and personnel are transforming into something inhuman. As the horror intensifies, Carter leads the other survivors on a hellish voyage into the subterranean depths of the hospital in a desperate bid to end the nightmare before it's too late.","$151,042.00 ",-,"Jeremy Gillespie, Steven Kostanski",,posters3/poster_107.jpg
https://www.themoviedb.org/movie/807-se7en,Se7en,84%,"Phim Hình Sự, Phim Bí Ẩn, Phim Gây Cấn","[('Morgan Freeman', 'Somerset'), ('Brad Pitt', 'Mills'), ('Gwyneth Paltrow', 'Tracy'), ('John Cassini', 'Officer Davis'), ('Peter Crombie', ""Dr. O'Neill""), ('Reg E. Cathey', 'Dr. Santiago'), ('R. Lee Ermey', 'Police Captain'), ('Daniel Zacapa', 'Detective Taylor at First Murder'), ('Andrew Kevin Walker', 'Dead Man at 1st Crime Scene')]",09/22/1995 (US),2h 7m,Tiếng Anh,"Hai viên cảnh sát William Somerset và David Mills phối hợp điều tra một vụ án phức tạp liên quan đến 7 điều cấm trong Kinh thánh. Hung thủ được dự đoán là do trước kia hắn lớn lên trong môi trường đạo nghiêm khắc nên tâm lí bất ổn và rồi lần lượt giết người dựa trên 7 tội lỗi trong Kinh thánh mà hắn gán cho mỗi người. 7 tội lỗi đó là: kiêu hãnh (Pride), ghen tị (Envy), ham ăn (Gluttony), sắc dục (Lust), tức giận (Wrath), tham lam (Greed) và lười biếng (Sloth). Án mạng đầu tiên là một tên béo phì với dòng chữ Gluttony viết bằng máu trên tường. Greed là án mạng xảy ra sau đó ở nơi làm của 1 tên luật sư. Một tên buôn ma túy tên Victor bị giết với tội lười biếng - Sloth. Lust là tội gán cho một cô gái điếm. Cuối cùng, Pride là 1 cô nàng quá mải mê chăm chút bề ngoài của mình.","$327,311,859.00 ","$33,000,000.00 ",David Fincher,,posters3/poster_108.jpg
https://www.themoviedb.org/movie/794-the-omen,Đứa Con Của Satan,74%,"Phim Kinh Dị, Phim Gây Cấn","[('Gregory Peck', 'Robert Thorn'), ('Lee Remick', 'Katherine Thorn'), ('David Warner', 'Keith Jennings'), ('Billie Whitelaw', 'Mrs. Baylock'), ('Harvey Stephens', 'Damien'), ('Patrick Troughton', 'Father Brennan'), ('Martin Benson', 'Father Spiletto'), ('Robert Rietti', 'Monk'), ('Tommy Duggan', 'Priest')]",09/16/1976 (GB),1h 51m,Tiếng Anh,"The Omen kể về 1 gia đình thành đạt về mọi mặt nhưng không có con. Trong một lần sinh, con của họ đã bị chết. Người chồng, vì không muốn vợ đau khổ, đã nhận nuôi 1 đứa con khác và giấu không cho vợ biết. Khủng khiếp thay, đứa trẻ này lại chính là hiện thân của chúa quỷ Satan hung bạo. Từng người một đã phải ngã quỵ trước trò chơi của quỷ. Rồi gia đình họ sẽ đi về đâu?","$60,922,980.00 ","$2,800,000.00 ",Richard Donner,David Seltzer,posters3/poster_109.jpg
https://www.themoviedb.org/movie/141052-justice-league,Liên Minh Công Lý,61%,"Phim Hành Động, Phim Phiêu Lưu, Phim Khoa Học Viễn Tưởng","[('Ben Affleck', 'Batman / Bruce Wayne'), ('Henry Cavill', 'Superman / Clark Kent / Kal-El'), ('Amy Adams', 'Lois Lane'), ('Gal Gadot', 'Wonder Woman / Diana Prince'), ('Ezra Miller', 'The Flash / Barry Allen'), ('Jason Momoa', 'Aquaman / Arthur Curry'), ('Ray Fisher', 'Cyborg / Victor Stone'), ('Jeremy Irons', 'Alfred Pennyworth'), ('Diane Lane', 'Martha Kent')]",11/17/2017 (VN),2h,Tiếng Anh,"Justice League hay còn được biết đến với cái tên Liên Minh Công Lý, là tập hợp những siêu anh hùng mang trong mình sức mạnh phi thường để giải cứu thế giới khỏi những thế lực đen tối trong vũ trụ DC. Lần này, nhân loại phải đối mặt với tên ác quỷ vô cùng tàn độc – Steppenwolf. Hắn là một trong những tay sai đắc lực của Darksied – một ác nhân và cũng chính là kẻ thù lớn nhất của Liên Minh Công Lý. Steppenwolf đã phô trương năng lực siêu phàm của mình, gieo rắc nỗi sợ hãi và bóng tối tới xứ Themyscira – quê hương của Wonder Woman và loài người.","$661,326,987.00 ","$300,000,000.00 ","Zack Snyder, Joss Whedon","Joss Whedon, Chris Terrio",posters3/poster_110.jpg
https://www.themoviedb.org/movie/1209288-justice-league-crisis-on-infinite-earths-part-two,Liên Minh Công Lý: Khủng Hoảng Trên Trái Đất Vô Tận Phần Hai,64%,"Phim Hoạt Hình, Phim Khoa Học Viễn Tưởng, Phim Hành Động","[('Jensen Ackles', 'Batman / Bruce Wayne (voice)'), ('Darren Criss', 'Superman / Earth-2 Superman (voice)'), ('Meg Donnelly', 'Supergirl / Harbinger (voice)'), ('Stana Katic', 'Wonder Woman (voice)'), ('Jonathan Adams', 'Monitor (voice)'), ('Gideon Adlon', 'Batgirl / Kryptonian Voice (voice)'), ('Geoffrey Arend', 'Psycho Pirate / Charles Halstead / Hawkman (voice)'), ('Troy Baker', 'The Joker (voice)'), ('Zach Callison', 'Earth-2 Robin / Robin / Damian Wayne (voice)')]",04/23/2024 (US),1h 34m,Tiếng Anh,"An endless army of shadow demons bent on the destruction of all reality swarms over our world and all parallel Earths! The only thing opposing them is the mightiest team of metahumans ever assembled. But not even the combined power of Superman, Batman, Wonder Woman, Green Lantern and all their fellow superheroes can slow down the onslaught of this invincible horde. What mysterious force is driving them? And how do the long-buried secrets of the Monitor and Supergirl threaten to crush our last defense?",-,-,Jeff Wamester,,posters3/poster_111.jpg
https://www.themoviedb.org/movie/198184-chappie,Chappie,68%,"Phim Hình Sự, Phim Hành Động, Phim Khoa Học Viễn Tưởng","[('Sharlto Copley', 'Chappie'), ('Dev Patel', 'Deon Wilson'), ('Hugh Jackman', 'Vincent Moore'), ('Ninja', 'Ninja'), ('Yo-Landi Visser', 'Yo-Landi'), ('Sigourney Weaver', 'Michelle Bradley'), ('Chris Shields', 'Journalist'), ('Anderson Cooper', 'Anderson Cooper'), ('Jose Pablo Cantillo', 'Yankie (Amerika)')]",03/06/2015 (US),2h,Tiếng Anh,"Bộ phim Chappie xoay quanh câu chuyện về một chú robot của lực lượng cảnh sát Johannesburg, bị hỏng sau một trận đánh, Chappie được một nhà khoa học trẻ khôi phục lại và “thổi hồn” vào biến cậu thành khác biệt. Chappie có linh hồn, có tình cảm và có suy nghĩ như một con người. Ẩn trong vẻ ngoài lạnh lùng cứng nhắc của một robot cảnh sát, linh hồn Chappie non nớt và ngây thơ như một đứa trẻ. Và hơn bao giờ hết, cậu có một niềm thiết tha mãnh liệt với cuộc sống.","$104,399,548.00 ","$49,000,000.00 ",Neill Blomkamp,,posters3/poster_112.jpg
https://www.themoviedb.org/movie/235-stand-by-me,Hãy Đứng Bên Tôi,79%,"Phim Hình Sự, Phim Chính Kịch","[('Wil Wheaton', 'Gordie Lachance'), ('River Phoenix', 'Chris Chambers'), (""Jerry O'Connell"", 'Vern Tessio'), ('Corey Feldman', 'Teddy Duchamp'), ('Kiefer Sutherland', 'Ace Merrill'), ('Casey Siemaszko', 'Billy Tessio'), ('Gary Riley', 'Charlie Hogan'), ('Bradley Gregg', 'Eyeball Chambers'), ('Jason Oliver', 'Vince Desjardins')]",08/08/1986 (US),1h 29m,Tiếng Anh,"Muốn phiêu lưu trong rừng để tìm xác một thiếu niên mất tích, bốn cậu bé nhận ra một số sự thật về chính mình trên đường đi.","$52,300,000.00 ","$8,000,000.00 ",Rob Reiner,"Bruce A. Evans, Raynold Gideon",posters3/poster_113.jpg
https://www.themoviedb.org/movie/299536-avengers-infinity-war,Avengers: Cuộc Chiến Vô Cực,82%,"Phim Phiêu Lưu, Phim Hành Động, Phim Khoa Học Viễn Tưởng","[('Robert Downey Jr.', 'Tony Stark / Iron Man'), ('Chris Hemsworth', 'Thor Odinson'), ('Mark Ruffalo', 'Bruce Banner / Hulk'), ('Chris Evans', 'Steve Rogers / Captain America'), ('Scarlett Johansson', 'Natasha Romanoff / Black Widow'), ('Benedict Cumberbatch', 'Stephen Strange / Doctor Strange'), ('Tom Holland', 'Peter Parker / Spider-Man'), ('Chadwick Boseman', ""T'Challa / Black Panther""), ('Don Cheadle', ""James 'Rhodey' Rhodes / War Machine"")]",04/25/2018 (VN),2h 29m,Tiếng Anh,"Sau chuyến hành trình độc nhất vô nhị không ngừng mở rộng và phát triển vụ trũ điện ảnh Marvel, bộ phim Avengers: Cuộc Chiến Vô Cực sẽ mang đến màn ảnh trận chiến cuối cùng khốc liệt nhất mọi thời đại. Biệt đội Avengers và các đồng minh siêu anh hùng của họ phải chấp nhận hy sinh tất cả để có thể chống lại kẻ thù hùng mạnh Thanos trước tham vọng hủy diệt toàn bộ vũ trụ của hắn.","$2,052,415,039.00 ","$300,000,000.00 ","Anthony Russo, Joe Russo","Christopher Markus, Stephen McFeely",posters3/poster_114.jpg
https://www.themoviedb.org/movie/315635-spider-man-homecoming,Người Nhện: Trở Về Nhà,73%,"Phim Hành Động, Phim Phiêu Lưu, Phim Khoa Học Viễn Tưởng, Phim Chính Kịch","[('Tom Holland', 'Peter Parker / Spider-Man'), ('Michael Keaton', 'Adrian Toomes / Vulture'), ('Robert Downey Jr.', 'Tony Stark / Iron Man'), ('Marisa Tomei', 'May Parker'), ('Jon Favreau', ""Harold 'Happy' Hogan""), ('Gwyneth Paltrow', ""Virginia 'Pepper' Potts""), ('Zendaya', ""Michelle 'MJ' Jones""), ('Donald Glover', 'Aaron Davis'), ('Jacob Batalon', 'Ned')]",07/07/2017 (VN),2h 13m,Tiếng Anh,"Tạm biệt hai franchise về thời sinh viên, Spider-Man: Homecoming sẽ lần đầu tiên đưa các khán giả đến với cuộc sống trung học của Peter Paker – siêu anh hùng Người Nhện. Liệu một cậu bé chưa trưởng thành sẽ làm thế nào để cân bằng cuộc sống bình thường và trách nhiệm của một anh hùng giải cứu thế giới. Đây cũng là lần đầu tiên, series Người Nhện có sự tham gia sản xuất của Marvel Studio và sự xuất hiện của Iron Man – Robert Downey Jr.","$880,166,924.00 ","$175,000,000.00 ",Jon Watts,"Jon Watts, Jonathan Goldstein, Christopher Ford, Erik Sommers, John Francis Daley, Chris McKenna",posters3/poster_115.jpg
https://www.themoviedb.org/movie/79474-mas-que-amor-frenesi,"Not Love, Just Frenzy",55%,"Phim Hài, Phim Chính Kịch, Phim Lãng Mạn, Phim Gây Cấn","[('Nancho Novo', 'Max'), ('Cayetana Guillén Cuervo', 'Mónica'), ('Ingrid Rubio', 'Yeye'), ('Beatriz Santiago', 'María'), ('Javier Manrique', 'Luis'), ('Javier Albalá', 'Alex'), ('Liberto Rabal', 'David'), ('Bibiana Fernández', 'Cristina'), ('Juan Diego Botto', 'Carlos')]",11/15/1996 (ES),2h 5m,Tiếng Tây Ban Nhà kiểu Cax-ti-le,"From the land of Almodovar comes a hot new film about drugs, sex & everything else!",-,-,"David Menkes, Miguel Bardem, Alfonso Albacete","David Menkes, Miguel Bardem, Alfonso Albacete",posters3/poster_116.jpg
https://www.themoviedb.org/movie/829-chinatown,Phố Tàu,79%,"Phim Hình Sự, Phim Chính Kịch, Phim Bí Ẩn, Phim Gây Cấn","[('Jack Nicholson', ""J.J. 'Jake' Gittes""), ('Faye Dunaway', 'Evelyn Cross Mulwray'), ('John Huston', 'Noah Cross'), ('Perry Lopez', 'Lieutenant Lou Escobar'), ('John Hillerman', 'Russ Yelburton'), ('Diane Ladd', 'Ida Sessions'), ('Roman Polanski', 'Man with Knife'), ('Roy Jenson', 'Claude Mulvihill'), ('Richard Bakalyan', 'Detective Loach')]",06/20/1974 (US),2h 10m,Tiếng Anh,"Nội dung phim xoay quanh gia đình Hollis Mulwray, một chủ đất giàu có ở California. Giả vờ là người vợ Evelyn của Hollis, một kẻ đồng mưu tên Ida Sessions nhờ thám tử tư J. J. Jake Gitters điều tra người chồng ngoại tình của mình. Trong quá trình điều tra, Jake phát hiện nhiều việc đáng sợ... Là một cựu cảnh sát ở Chinatown (một biểu tượng của Los Angeles), Jake cố gắng tách cái xấu ra khỏi cái tốt và trừng phạt những kẻ phạm tội, minh oan cho những người ngay thẳng.","$30,000,000.00 ","$6,000,000.00 ",Roman Polanski,Robert Towne,posters3/poster_117.jpg
https://www.themoviedb.org/movie/447200-skyscraper,Tòa Tháp Chọc Trời,63%,"Phim Hành Động, Phim Gây Cấn, Phim Phiêu Lưu","[('Dwayne Johnson', 'Will Sawyer'), ('Neve Campbell', 'Sarah Sawyer'), ('Chin Han', 'Zhao Long Ji'), ('Roland Møller', 'Kores Botha'), ('Noah Taylor', 'Mr. Pierce'), ('Byron Mann', 'Inspector Wu'), ('Pablo Schreiber', 'Ben'), ('McKenna Roberts', 'Georgia Sawyer'), ('Noah Cottrell', 'Henry Sawyer')]",07/13/2018 (VN),1h 42m,Tiếng Anh,"Tòa Tháp Chọc Trời là câu chuyện kể về cựu trưởng nhóm cứu hộ FBI Will Ford, giờ đã trở thành người bảo vệ cho những tòa nhà cao tầng. Trong quá trình làm việc, anh bất ngờ thấy tòa nhà cao nhất và có an ninh tốt nhất trên thế giới đột ngột bốc cháy và gia đình anh bị kẹt trong đó. Điều tệ nhất là, anh đã bị gài vào toàn bộ những sự việc này và vừa phải tìm cách thoát khỏi tòa nhà này, vừa phải cứu cả gia đình mình.","$292,400,000.00 ","$125,000,000.00 ",Rawson Marshall Thurber,Rawson Marshall Thurber,posters3/poster_118.jpg
https://www.themoviedb.org/movie/948-halloween,Halloween,76%,"Phim Kinh Dị, Phim Gây Cấn","[('Donald Pleasence', 'Dr. Sam Loomis'), ('Jamie Lee Curtis', 'Laurie Strode'), ('P.J. Soles', 'Lynda Van Der Klok'), ('Nancy Kyes', 'Annie Brackett'), ('Charles Cyphers', 'Sheriff Leigh Brackett'), ('Kyle Richards', 'Lindsey Wallace'), ('Brian Andrews', 'Tommy Doyle'), ('John Michael Graham', 'Bob Simms'), ('Nancy Stephens', 'Marion Chambers')]",10/25/1978 (US),1h 31m,Tiếng Anh,"Buổi tối ngày 31 tháng 10 năm 1963, cậu bé 6 tuổi Michael Myers đâm cô chị 15 tuổi đến chết. Sau khi gia đình cậu bé trở về nhà đã phát hiện ra vụ việc và lập tức đưa hắn vào viện tâm thần điều trị đặc biệt dưới sự theo dõi của bác sĩ Loomis.Ngày 30 tháng 10 năm 1978, khi Michael tròn 21 tuổi, bác sĩ Loomis quyết định có 1 buổi kiểm tra xem hắn đã hoàn toàn bình phục hay chưa nhưng Michael đã tấn công mọi người và bỏ trốn. Hắn đã trở về quê nhà và tiến hành cuộc thảm sát đẫm máu trong đêm Halloween…","$70,300,000.00 ","$325,000.00 ",John Carpenter,"John Carpenter, Debra Hill",posters3/poster_119.jpg
